UserId,Tweets,Likes,Comments,Retweets,Tweet_Url
@androidcentral,"With more layoffs coming to Reality Labs, Meta will likely become more dependent on Qualcomm",20,1.0,3.0,https://twitter.com/androidcentral/status/1709478514431340622
@androidcentral,"If the Galaxy S23 is too small and the Galaxy S23+ is too big, then the Galaxy S23 FE might be perfect for you",15,2.0,3.0,https://twitter.com/androidcentral/status/1709346374251163965
@androidcentral,Samsung's new Galaxy Tab S9 FE offers up to 12GB of RAM and an IP rating for added durability,20,1.0,2.0,https://twitter.com/androidcentral/status/1709345095240069145
@androidcentral,Samsung's new Galaxy S23 FE showcases an Android device unwilling to compromise on the most important specs,35,1.0,2.0,https://twitter.com/androidcentral/status/1709343840153317398
@androidcentral,"Make sure to tune into our live blog, where we'll have the latest details on the Made by Google event",35,2.0,2.0,https://twitter.com/androidcentral/status/1709335046056800424
@androidcentral,The Pixel 8 launch is in less than 24 hours!,75,1.0,7.0,https://twitter.com/androidcentral/status/1709285444314128808
@androidcentral,Emoji reactions are starting to roll out for Gmail users on Android as a way of bringing expression to an otherwise mundane email,32,1.0,3.0,https://twitter.com/androidcentral/status/1709280156995457132
@androidcentral,Creating custom Google Home routines will be easier than ever with generative AI,34,2.0,7.0,https://twitter.com/androidcentral/status/1709238651899539777
@androidcentral,One of the best-selling OnePlus phones of 2023 is getting a gorgeous Solar Red color variant,26,1.0,4.0,https://twitter.com/androidcentral/status/1709179117072216289
@androidcentral,"It looks like YouTube is giving its Library tab a facelift, renaming it to 'You' and making it more personal",31,1.0,2.0,https://twitter.com/androidcentral/status/1709168249613488426
@androidcentral,"A feature we really would've liked to see on the original Pixel Watch is apparently coming to the Pixel Watch 2, according to the latest leak",48,3.0,4.0,https://twitter.com/androidcentral/status/1709051198240665865
@androidcentral,Bard may soon be able to remember you,21,1.0,3.0,https://twitter.com/androidcentral/status/1708954523945841043
@androidcentral,"OnePlus talks about the hinge on its first foldable, but doesn't let us see everything just yet",25,1.0,3.0,https://twitter.com/androidcentral/status/1708952769153900565
@androidcentral,"Google Messages makes it easier to share files or links with your contacts, without having to scroll through a million conversations",37,1.0,7.0,https://twitter.com/androidcentral/status/1708921632520081906
@androidcentral,"All three Galaxy S24 models have leaked, and from the looks of it, we probably shouldn't expect many visual changes",53,1.0,6.0,https://twitter.com/androidcentral/status/1708587307454894343
@androidcentral,Google continues to expand access to its AI-powered generative search experience,46,1.0,4.0,https://twitter.com/androidcentral/status/1708582233555001358
@androidcentral,Need a wireless charger for your Pixel that won't break the bank? The iOttie iON Wireless Duo charger stand is exactly what you need,43,1.0,8.0,https://twitter.com/androidcentral/status/1708576282886254828
@androidcentral,Google has a pretty exciting launch coming up that will be filled with new Pixels and hopefully plenty of new software,57,1.0,4.0,https://twitter.com/androidcentral/status/1708542340233679334
@androidcentral,"The Pixel 8 launches soon, and it'll be one of the hottest phones of the year (not literally, we hope)",102,6.0,16.0,https://twitter.com/androidcentral/status/1708266064419733706
@androidcentral,You shouldn't be in a rush to get a Wi-Fi 7 router just yet,26,1.0,2.0,https://twitter.com/androidcentral/status/1708239126539935976
@androidcentral,It looks like Google finally settled on a UI for the Messages app,66,5.0,8.0,https://twitter.com/androidcentral/status/1707927253089222805
@androidcentral,A Quest 2 trade-in offer would've been a great way to convert some of its 20 million owners to Quest 3 users (and prevented a ton of e-waste),21,1.0,1.0,https://twitter.com/androidcentral/status/1707820049900200100
@androidcentral,It looks like the Pixel Watch 2 may come with a welcome Fitbit upgrade,27,2.0,1.0,https://twitter.com/androidcentral/status/1707813764672663626
@androidcentral,You might have a hard time telling the Galaxy S23 Ultra and S24 Ultra apart,39,1.0,6.0,https://twitter.com/androidcentral/status/1707806236287058150
@androidcentral,"Twitter, now X, used to let you flag tweets that you thought were misleading, but it just got rid of that feature",44,7.0,11.0,https://twitter.com/androidcentral/status/1707709463065432086
@androidcentral,Samsung may not be looking to drastically overhaul the Galaxy S24 design,45,1.0,5.0,https://twitter.com/androidcentral/status/1707652202947318196
@androidcentral,"With all these leaks, the Galaxy S23 FE has to be around the corner",37,1.0,3.0,https://twitter.com/androidcentral/status/1707498174812680645
@androidcentral,"The At a Glance widget is getting a new look, and it's rolling out more widely across Android phones",76,3.0,6.0,https://twitter.com/androidcentral/status/1707453132639211604
@androidcentral,The Pixel is becoming increasingly popular in the United States,132,6.0,10.0,https://twitter.com/androidcentral/status/1707382410927604052
@androidcentral,"Disney+ follows Netflix with its own password-sharing crackdown, and it starts in North America",21,4.0,5.0,https://twitter.com/androidcentral/status/1707350711485276443
@androidcentral,A new Android 14 beta is rolling out on the Galaxy S23,63,3.0,9.0,https://twitter.com/androidcentral/status/1707125476420878718
@androidcentral,"Meta just launched the new Quest 3, and we got to try it out",19,1.0,4.0,https://twitter.com/androidcentral/status/1707090746262651162
@androidcentral,"The Pixel 8 may bring better performance with a new chip, but it also needs to stay cool under pressure",66,1.0,8.0,https://twitter.com/androidcentral/status/1707060542781739077
@androidcentral,"Apple finally bit the bullet and brought USB-C to the iPhone 15, and this could be a great thing for accessory makers, but there are still some things to consider",36,3.0,5.0,https://twitter.com/androidcentral/status/1706913064379973822
@androidcentral,"Google Podcasts is going away in 2024, and YouTube Music's podcasts feature will go live globally",52,6.0,3.0,https://twitter.com/androidcentral/status/1706897608772366822
@androidcentral,Samsung may kick off 2024 with an early Galaxy S24 launch,66,4.0,9.0,https://twitter.com/androidcentral/status/1706778442455265482
@androidcentral,YouTube is axing its cheaper Premium Lite plan,39,4.0,7.0,https://twitter.com/androidcentral/status/1706717530939646366
@androidcentral,"Xiaomi made a Wear OS smartwatch, and it's launching globally. All the details here:",31,1.0,7.0,https://twitter.com/androidcentral/status/1706665495888621684
@androidcentral,"TECNO's Phantom V Flip is going on sale soon, and it will cost just $600. Head to our review to know all about the most affordable foldable available today:",23,1.0,2.0,https://twitter.com/androidcentral/status/1706520674846871662
@androidcentral,It looks like the Pixel 8 upgrades may come at a price,51,3.0,6.0,https://twitter.com/androidcentral/status/1706377116973977620
@androidcentral,Pixel 8 software support could make most Android phones jealous,67,5.0,6.0,https://twitter.com/androidcentral/status/1706358782366806144
@androidcentral,Fitbit has had a rough 2023; it needs more than the Charge 6 to turn things around.,28,1.0,3.0,https://twitter.com/androidcentral/status/1705963050988171369
@androidcentral,Would you pay to use X (Twitter)?,167,142.0,54.0,https://twitter.com/androidcentral/status/1705711278335910102
@androidcentral,WhatsApp is making it easier to shop within the app,63,3.0,7.0,https://twitter.com/androidcentral/status/1705705622065319947
@androidcentral,Get ready to pay more for Prime Video if you want to avoid ads,30,1.0,5.0,https://twitter.com/androidcentral/status/1705675417779138938
@androidcentral,"Microsoft Surface will have to go on without Panos Panay, but that could be good news for Amazon",33,1.0,3.0,https://twitter.com/androidcentral/status/1705666286586408980
@androidcentral,"OxygenOS 14 may look the same, but there are some notable features arriving with the update",34,1.0,6.0,https://twitter.com/androidcentral/status/1705658148248310186
@androidcentral,"USB-C on the iPhone 15 is a pretty big deal, and",49,31.0,8.0,https://twitter.com/androidcentral/status/1705486161177706732
@androidcentral,It looks like Google Weather's redesign is finally appearing on more phones,31,2.0,1.0,https://twitter.com/androidcentral/status/1705321592031511005
@androidcentral,"Porcelain looks great, but Sky might be the one",35,1.0,3.0,https://twitter.com/androidcentral/status/1705317567324094557
@androidcentral,"Google Wallet is acting up on the first Android 14 QPR1 beta, and contactless payments are completely broken",28,2.0,2.0,https://twitter.com/androidcentral/status/1705274526173372863
@androidcentral,"If you're an Android user who has been on the fence about switching to an iPhone, Apple just made it a little easier for you with the iPhone 15",49,22.0,8.0,https://twitter.com/androidcentral/status/1705184126179881076
@androidcentral,The new YouTube Create app wants to ease the process of making videos for the platform as it continues to compete with TikTok,33,1.0,5.0,https://twitter.com/androidcentral/status/1705022859905483245
@androidcentral,"TikTok is steadily making moves to improve its search experience, even going so far as to integrate Google Search links and Wikipedia snippets",22,1.0,2.0,https://twitter.com/androidcentral/status/1704930038171267579
@androidcentral,The Pixel 8 hasn't even launched and we're already getting leaks of the Pixel 8a,89,2.0,13.0,https://twitter.com/androidcentral/status/1704890003971579971
@androidcentral,The iPhone 15 Pro's most exciting feature has nothing to do with cameras or titanium,36,2.0,4.0,https://twitter.com/androidcentral/status/1704859297786536058
@androidcentral,"Upcoming releases like Dungeons of Eternity finally get multiplayer roguelikes right, and old favorites like Demeo are still getting some amazing new updates.",19,1.0,2.0,https://twitter.com/androidcentral/status/1704858285814251904
@androidcentral,Google explains the inspiration behind the Pixel's iconic camera bar,117,6.0,10.0,https://twitter.com/androidcentral/status/1704664258309485002
@androidcentral,The OnePlus Open launch could be just around the corner,42,1.0,10.0,https://twitter.com/androidcentral/status/1704627002769125675
@androidcentral,Amazon is upgrading Alexa with some generative AI chops,28,3.0,7.0,https://twitter.com/androidcentral/status/1704583994782654676
@androidcentral,"They may not seem like much, but Amazon's new Fire HD 10 Kids tablets are getting some great upgrades",33,1.0,6.0,https://twitter.com/androidcentral/status/1704540193271824894
@androidcentral,"Apple, Google, and Mobvoi have all passed Samsung in this one key smartwatch spec",27,3.0,3.0,https://twitter.com/androidcentral/status/1704376620386042217
@androidcentral,"Netgear rolls out the Orbi 970, a high-end Wi-Fi 7 mesh system that costs $2,299",20,1.0,1.0,https://twitter.com/androidcentral/status/1704320883693883533
@androidcentral,A new chip for Android TV boxes could bring some welcome upgrades,39,1.0,9.0,https://twitter.com/androidcentral/status/1704257086253666362
@androidcentral,"Elon Musk wants to tackle bots on X, so he's making us pay",117,46.0,34.0,https://twitter.com/androidcentral/status/1704234413901365656
@androidcentral,Samsung may ditch the 10x zoom camera on the Galaxy S24 Ultra,46,3.0,6.0,https://twitter.com/androidcentral/status/1704227638800212207
@androidcentral,"The new Apple Watch seems great, but it could be even better with this one feature",37,3.0,5.0,https://twitter.com/androidcentral/status/1704201659339968825
@androidcentral,"Arlo's new Essential Cameras and Video Doorbell are faster, better, and much more affordable",22,1.0,2.0,https://twitter.com/androidcentral/status/1704171499165196617
@androidcentral,"One surprising Pixel 8 feature is likely going to be on the Pixel Watch 2, plus several other Pixel phone features are reportedly moving over, as well",51,2.0,4.0,https://twitter.com/androidcentral/status/1704164978565996853
@androidcentral,Google says a recent court ruling means you can't play your Nest speakers in multiple rooms at the same time,44,8.0,9.0,https://twitter.com/androidcentral/status/1704126310061052391
@androidcentral,"Companies like to show off how powerful their new chips are, but they should be focusing on better efficiency",31,3.0,4.0,https://twitter.com/androidcentral/status/1703902135249760347
@androidcentral,"Google's Gemini, a next-gen large language model, has apparently begun limited testing with a few outside developers, which could indicate a proper consumer rollout is drawing closer",22,1.0,4.0,https://twitter.com/androidcentral/status/1703882098241597755
@androidcentral,"Amazon's Alexa and Echo Devices division is in a bad place, but veteran Microsoft Surface exec Panos Panay could help rekindle the business",24,1.0,4.0,https://twitter.com/androidcentral/status/1703869268788383771
@androidcentral,Excited for OxygenOS 14? Here's a look at the best new features in OnePlus's Android 14-based interface:,32,1.0,7.0,https://twitter.com/androidcentral/status/1703705504827260990
@androidcentral,"USB-C on the iPhone 15 is pretty exciting, but not as exciting as the A17 Pro powering Apple's latest flagships",39,2.0,8.0,https://twitter.com/androidcentral/status/1703381750603215239
@androidcentral,"The Xiaomi 13 Ultra has some of the best cameras you'll find on a smartphone right now, and this accessory really enhances the experience",40,3.0,7.0,https://twitter.com/androidcentral/status/1703138446917701644
@androidcentral,Google has a lot riding on the outcome of this trial,25,1.0,1.0,https://twitter.com/androidcentral/status/1703114089046679787
@androidcentral,Keep your Pixel Watch updated,27,1.0,3.0,https://twitter.com/androidcentral/status/1703097160936362053
@androidcentral,"We still haven't received stable Android 14, but Google is pushing ahead with the first QPR1 beta as soon as September 18",44,1.0,6.0,https://twitter.com/androidcentral/status/1703091065870307791
@androidcentral,"Some iPhone 15 ""features"" may sound a bit familiar",53,1.0,5.0,https://twitter.com/androidcentral/status/1703085402037395956
@androidcentral,"New phone chips like Apple's A17 Pro promise amazing performance. Can we please get some amazing battery life, too?",33,2.0,2.0,https://twitter.com/androidcentral/status/1703062448087994772
@androidcentral,The Samsung Galaxy Ring is all but confirmed for early 2024,37,1.0,5.0,https://twitter.com/androidcentral/status/1702926544614695268
@androidcentral,You may not want to get your hopes up about the Galaxy S24 charging speeds,37,4.0,4.0,https://twitter.com/androidcentral/status/1702773551835529621
@androidcentral,The Galaxy S23 FE launch may be imminent as an alleged press image leaks,20,1.0,4.0,https://twitter.com/androidcentral/status/1702751671346974945
@androidcentral,Bose is launching two new headphones and a pair of earbuds which will replace several older devices as the company moves into a new future for audio experiences,15,1.0,3.0,https://twitter.com/androidcentral/status/1702748134076498230
@androidcentral,"With the Magic V2, Honor is offering one of the best foldable designs available today:",16,1.0,4.0,https://twitter.com/androidcentral/status/1702705733996036157
@androidcentral,"We've talked about the things the iPhone 15 ""stole"" from Android, but what about the things Android should take from the iPhone 15?",36,2.0,3.0,https://twitter.com/androidcentral/status/1702356550877081685
@androidcentral,This is a pretty big deal for everyone who owns a Chromebook,56,4.0,20.0,https://twitter.com/androidcentral/status/1702352784777965587
@androidcentral,A leaked user manual has pulled back the curtain on the Galaxy Buds FE's design,23,1.0,1.0,https://twitter.com/androidcentral/status/1702329213150523699
@androidcentral,Samsung's rumored Oura Ring challenger may be revealed alongside the Galaxy S24,45,2.0,5.0,https://twitter.com/androidcentral/status/1702044994784158094
@androidcentral,"Are you planning on staying on the beta train, or hopping off before things get crazy?",39,5.0,1.0,https://twitter.com/androidcentral/status/1702032405425422504
@androidcentral,Check out these five Google Search features that might make your life easier!,26,1.0,5.0,https://twitter.com/androidcentral/status/1701883941249007679
@androidcentral,The Pixel 8 chipset may come with more than just a performance boost,48,2.0,9.0,https://twitter.com/androidcentral/status/1701701481613631583
@androidcentral,"It might come as a surprise, but Apple is actually ""borrowing"" less with the iPhone 15 than it did with the iPhone 14",61,3.0,12.0,https://twitter.com/androidcentral/status/1701690404846948526
@androidcentral,Apple finally did the thing and switched the iPhone to USB-C,72,3.0,5.0,https://twitter.com/androidcentral/status/1701678335854571946
@androidcentral,Say hello to the most powerful color E Ink tablet on the market,19,3.0,3.0,https://twitter.com/androidcentral/status/1701597793780162810
@androidcentral,"Lenovo may have a new ""Chromebook Plus"" device in the works",27,1.0,2.0,https://twitter.com/androidcentral/status/1701359721389727761
@androidcentral,"Beeper isn't perfect, but it's a good effort to bring iMessage and RCS under one roof",31,1.0,2.0,https://twitter.com/androidcentral/status/1701329421267878096
@androidcentral,"Looking to get some help from AI? Microsoft is ready to assist with your social media posts, image requests, and more",27,1.0,2.0,https://twitter.com/androidcentral/status/1701316594872336888
@androidcentral,"WhatsApp is rolling out the emoji reaction feature for Channels on the beta channel, so now you can let your heart emojis do the talking",44,1.0,6.0,https://twitter.com/androidcentral/status/1701198812268634173
@androidcentral,Samsung could add some pep to its budget tablet lineup with a Plus variant of the upcoming Galaxy Tab A9,16,1.0,2.0,https://twitter.com/androidcentral/status/1701121654884028812
@androidcentral,"We reviewed one of our favorite new smart scales, with its handy new Eyes Closed tool",17,1.0,1.0,https://twitter.com/androidcentral/status/1700979532617130070
@androidcentral,"If you've never tried MagSafe accessories before, this one from Spigen will absolutely convert you",20,1.0,2.0,https://twitter.com/androidcentral/status/1700973708364673112
@androidcentral,YouTube's NFL Sunday Ticket free trial comes with some caveats,22,1.0,1.0,https://twitter.com/androidcentral/status/1700967618176233548
@androidcentral,Google is officially in Pixel 8 mode,109,2.0,8.0,https://twitter.com/androidcentral/status/1700956651602276398
@androidcentral,Huawei's Mate X5 is basically a boosted Mate X3,31,2.0,3.0,https://twitter.com/androidcentral/status/1700950530644684857
@androidcentral,"The Pixel Watch 2 doesn't look much different from its predecessor, but it's the inside that counts",52,4.0,4.0,https://twitter.com/androidcentral/status/1700940995871838213
@androidcentral,Marshall's Emberton II Bluetooth speaker sounds just as good as you could have hoped for,27,1.0,3.0,https://twitter.com/androidcentral/status/1700928219216572775
@androidcentral,The Galaxy S23 FE appears to be one step closer to launching as we get a peek at specs and live images,50,1.0,5.0,https://twitter.com/androidcentral/status/1700919324624511304
@androidcentral,"VO2 Max is the key stat all fitness watches use to decide how fit you are. Here's how our Fitness Editor went from ""good"" to ""excellent"" in a month",23,1.0,3.0,https://twitter.com/androidcentral/status/1700888372254793757
@androidcentral,Using iMessage on Android comes with a few caveats,41,4.0,10.0,https://twitter.com/androidcentral/status/1700571536367768064
@androidcentral,Wear OS 4 makes its way to Samsung's older smartwatches,38,1.0,2.0,https://twitter.com/androidcentral/status/1700564676474531901
@androidcentral,Android's latest brand makeover adds another dimension to the bugdroid,50,2.0,5.0,https://twitter.com/androidcentral/status/1700548706217365673
@androidcentral,Lots of exciting new features and updates are coming to your Android phone,36,2.0,4.0,https://twitter.com/androidcentral/status/1700540020006785128
@androidcentral,"USB-C on the iPhone has been a long time coming. It's still not going to make everything magical, though",56,1.0,7.0,https://twitter.com/androidcentral/status/1700525731804045700
@androidcentral,The OnePlus 12 may be backtracking on a daring design choice for the rear camera module,28,1.0,4.0,https://twitter.com/androidcentral/status/1700482461728137529
@androidcentral,Mark your calendars for the Pixel Watch 2's arrival in India,32,1.0,2.0,https://twitter.com/androidcentral/status/1700298994692292913
@androidcentral,"If you're envious of StandBy Mode on the iPhone, then you'll want to check out this app from the Play Store",34,1.0,4.0,https://twitter.com/androidcentral/status/1700289671631183928
@androidcentral,It's the end of the line for the Galaxy Note 10,40,2.0,8.0,https://twitter.com/androidcentral/status/1700266027785896311
@androidcentral,A new Chromecast with Google TV could be in the works with a brand-new remote,40,2.0,4.0,https://twitter.com/androidcentral/status/1700240117347102936
@androidcentral,Google finally rolls out 'Proofread with Gboard' on the beta channel in hopes of putting the final nail in the coffin of grammar mistakes,37,2.0,2.0,https://twitter.com/androidcentral/status/1700041292581908649
@androidcentral,Samsung may be gearing up to launch a pair of affordable earbuds,20,1.0,2.0,https://twitter.com/androidcentral/status/1699853073458360725
@androidcentral,Big phones like the upcoming Pixel 8 Pro would benefit immensely if Google upgraded them with this iPhone feature,38,2.0,4.0,https://twitter.com/androidcentral/status/1699665064347730143
@androidcentral,Xiaomi's upcoming phones are getting a welcome boost in software support,35,2.0,4.0,https://twitter.com/androidcentral/status/1699565666305540601
@androidcentral,"Stadia who? YouTube starts testing ""Playables"" with select users",28,2.0,3.0,https://twitter.com/androidcentral/status/1699546291842187626
@androidcentral,"Account linking, adding new devices, and more are coming to the Pixel Watch app",26,2.0,1.0,https://twitter.com/androidcentral/status/1699524141878063511
@androidcentral,"Another day, another Android 14 beta update",66,3.0,6.0,https://twitter.com/androidcentral/status/1699511546542448850
@androidcentral,Google is incorporating short-form videos into the Play Store to help you discover apps,33,3.0,4.0,https://twitter.com/androidcentral/status/1699496951371182270
@androidcentral,"The Fairphone 5 isn't headed to North America, and that's not surprising. It is disappointing, though, because it's a phone more people should want to buy",18,2.0,5.0,https://twitter.com/androidcentral/status/1699493937361105223
@androidcentral,Looking for the perfect writing companion? The Boox Tab Ultra is making me reconsider how I take notes on a daily basis.,11,2.0,1.0,https://twitter.com/androidcentral/status/1699437410969329780
@androidcentral,Google isn't doing a very good job keeping the Pixel 8 Pro under wraps,51,4.0,6.0,https://twitter.com/androidcentral/status/1699252345802985568
@androidcentral,It looks like the stable Android 14 update might come later rather than sooner,39,2.0,11.0,https://twitter.com/androidcentral/status/1699248591376634328
@androidcentral,Google is highlighting some new features coming to Wear OS smartwatches,26,1.0,3.0,https://twitter.com/androidcentral/status/1699185162787987922
@androidcentral,"Walking 5 miles a day for 31 days had an immediate, positive impact on our writer's health",35,1.0,4.0,https://twitter.com/androidcentral/status/1699162340317405619
@androidcentral,"A report claims Apple is looking to take on Chromebooks with a cheap MacBook, but Google probably doesn't have anything to worry about",16,3.0,2.0,https://twitter.com/androidcentral/status/1699156209218072687
@androidcentral,Waze launches its new Alien driving experience to help lead you back home,11,2.0,2.0,https://twitter.com/androidcentral/status/1699149667030761566
@androidcentral,Individual Workspace subscribers utilizing Google Meet will receive additional features and updates this week,16,2.0,2.0,https://twitter.com/androidcentral/status/1699144132147454146
@androidcentral,"A new leak shows off what could be the next ""affordable"" flip-style foldable",15,1.0,2.0,https://twitter.com/androidcentral/status/1699122743147417994
@androidcentral,Your favorite bugdroid has a new 3D look as Google updates the Android logo,38,1.0,1.0,https://twitter.com/androidcentral/status/1699122743126409464
@androidcentral,More flagship-level smartphones from Xiaomi may arrive soon,19,1.0,2.0,https://twitter.com/androidcentral/status/1699118216834904568
@androidcentral,Your favorite bugdroid has a new 3D look as Google updates the Android logo,64,3.0,7.0,https://twitter.com/androidcentral/status/1699108407872029110
@androidcentral,"The Assistant At a Glance widget is getting a Material You makeover, and it's rolling out to all Android phones as part of the latest feature drop",27,1.0,3.0,https://twitter.com/androidcentral/status/1699106899944222860
@androidcentral,Can you Netflix and chill with the Boox Tab Ultra? Probably not. But here's why you might not even miss it.,13,1.0,1.0,https://twitter.com/androidcentral/status/1699086687261819303
