UserId,Tweets,Likes,Comments,Retweets,Tweet_Url
@androidcentral,"Prime Big Deal Days is officially here, and we're sharing all of the best phone deals over the next few days as Amazon posts them. Check this page for live updates!",45,6.0,4.0,https://twitter.com/androidcentral/status/1711732504481140855
@androidcentral,"The unified Disney Plus and Hulu app will kick off in beta next month, with a full rollout planned for early 2024",15,1.0,1.0,https://twitter.com/androidcentral/status/1723580530170445998
@androidcentral,This is the biggest problem facing Chinese phone brands,31,5.0,1.0,https://twitter.com/androidcentral/status/1723458399889666469
@androidcentral,We wanted to see if the Pixel 8 Pro temperature sensor was actually worth including,50,2.0,4.0,https://twitter.com/androidcentral/status/1723425326036832561
@androidcentral,Galaxy S23 gets One UI 6 (Android 14) update in the US,64,1.0,1.0,https://twitter.com/androidcentral/status/1723399459214590386
@androidcentral,Gmail tests redesign on Android with a chat-style UI for replying to emails,64,2.0,9.0,https://twitter.com/androidcentral/status/1723096228706005032
@androidcentral,"Amazon is reportedly planning to ditch Android for its own Fire OS replacement, finally breaking free from Google's shackles",40,1.0,4.0,https://twitter.com/androidcentral/status/1722992782904561887
@androidcentral,The OnePlus Open and OPPO Pen put the Galaxy Z Fold 5 to shame,24,2.0,4.0,https://twitter.com/androidcentral/status/1722948497056452854
@androidcentral,"Google Messages may finally get a long-awaited ""Profiles"" feature",63,2.0,6.0,https://twitter.com/androidcentral/status/1722771082531291259
@androidcentral,Epic turned down an epic offer from Google to get Fortnite on the Play Store,25,1.0,1.0,https://twitter.com/androidcentral/status/1722725520717029745
@androidcentral,Leaked Galaxy Fit 3 renders show a larger display to challenge the Fitbit Charge 6,24,1.0,3.0,https://twitter.com/androidcentral/status/1722687526257701073
@androidcentral,"Most people use GPS watches to track their hikes, but you can make a case for this Garmin GPS+Satellite handheld instead",26,1.0,2.0,https://twitter.com/androidcentral/status/1722619171975160103
@androidcentral,The Pixel 8 Pro temperature sensor is only good for one thing (and hardly even that),44,2.0,1.0,https://twitter.com/androidcentral/status/1722314939669365120
@androidcentral,"You can now use AI to create your own Popsockets case, grip, or wallet",27,3.0,7.0,https://twitter.com/androidcentral/status/1722072970858750326
@androidcentral,Google launches a new tool to track shopping deals ahead of the holidays,62,2.0,9.0,https://twitter.com/androidcentral/status/1722052304826720714
@androidcentral,The first Pixel Watch 2 update is a small one,45,2.0,4.0,https://twitter.com/androidcentral/status/1722045150703096119
@androidcentral,"The Samsung Galaxy S Pen 'Creator Edition' finally arrives, with a few caveats",31,1.0,3.0,https://twitter.com/androidcentral/status/1722017373341819046
@androidcentral,Google has removed the option to get COVID-19 exposure notifications in Android's settings,45,1.0,6.0,https://twitter.com/androidcentral/status/1721499856802394144
@androidcentral,"It seems like Qualcomm's Snapdragon 8 Gen 3 for Galaxy chip might be getting a speed boost for its main core and GPU, but the other cores might be underclocked",32,1.0,6.0,https://twitter.com/androidcentral/status/1721426613823320552
@androidcentral,"Our full review of the Pixel Watch 2 is up, and there's a lot to like about this second-generation smartwatch",49,1.0,3.0,https://twitter.com/androidcentral/status/1721259594322747400
@androidcentral,"Foldable phones are great, but the software holds them back from achieving their full potential. Here are some software issues",32,1.0,3.0,https://twitter.com/androidcentral/status/1721242243338477589
@androidcentral,Google wants to upgrade your earbuds with health-tracking features,52,3.0,9.0,https://twitter.com/androidcentral/status/1721230871670165965
@androidcentral,"The Charge 6 is a solid fitness tracker, but it has its flaws. Here's how Fitbit should improve the next generation, both for hardware and software",28,2.0,5.0,https://twitter.com/androidcentral/status/1721198727182848421
@androidcentral,"VR news of the week: TikTok in VR, controller issues, and new smart glasses",35,1.0,3.0,https://twitter.com/androidcentral/status/1720865272028909654
@androidcentral,"Google's Pixel camera AI isn't ""destroying humanity"" or creating any sort of apocalypse",92,4.0,8.0,https://twitter.com/androidcentral/status/1720819700748157429
@androidcentral,A Google Password Manager redesign is on the way with a navigational bar,85,1.0,8.0,https://twitter.com/androidcentral/status/1720556982107594971
@androidcentral,The Galaxy Z Fold 6 could make S Pen cases a thing of the past,44,2.0,1.0,https://twitter.com/androidcentral/status/1720519467149488366
@androidcentral,The Galaxy S24 is rumored to be a New Year's present with a January launch,41,1.0,4.0,https://twitter.com/androidcentral/status/1720509927586660652
@androidcentral,"The Pixel 8 phones are apparently having trouble connecting to the internet, and their batteries drain quickly when using mobile data instead of Wi-Fi",49,16.0,3.0,https://twitter.com/androidcentral/status/1720457032526913827
@androidcentral,Apple made the wrong decision with not bringing the Apple Watch to Android,53,11.0,3.0,https://twitter.com/androidcentral/status/1720358907611075021
@androidcentral,A new Chromebook tablet could finally be around the corner,46,3.0,5.0,https://twitter.com/androidcentral/status/1720232334908104956
@androidcentral,Gboard may soon gain a little Google Lens magic to grab text from images,74,4.0,4.0,https://twitter.com/androidcentral/status/1720151808507572682
@androidcentral,"The Samsung Galaxy S24 is coming early next year, and we have a good idea of what the Ultra model will look like thanks to these concept images",51,4.0,6.0,https://twitter.com/androidcentral/status/1720006529519059400
@androidcentral,Ghostbusters: Rise of the Ghost Lord is light on lore but stuffed with fun,16,1.0,3.0,https://twitter.com/androidcentral/status/1719975153021440042
@androidcentral,Google Pixel 8 Pro review: King of the Androids,75,5.0,8.0,https://twitter.com/androidcentral/status/1719772569740390510
@androidcentral,Qualcomm's XPAN tech is the best new audio feature you'll probably never get to use,27,1.0,2.0,https://twitter.com/androidcentral/status/1719733822260916447
@androidcentral,Apple and Samsung lost market share to a phone brand you've never heard of,57,3.0,9.0,https://twitter.com/androidcentral/status/1719521647978274949
@androidcentral,YouTube ramps up efforts to block you from blocking ads,55,11.0,11.0,https://twitter.com/androidcentral/status/1719471076399300973
@androidcentral,"Chrome finally lets you move the address bar to the bottom, but not on Android",78,6.0,8.0,https://twitter.com/androidcentral/status/1719449192253256055
@androidcentral,Snapdragon 8 Gen 3's benchmark results show its dominance over Apple's A17 Pro,57,1.0,5.0,https://twitter.com/androidcentral/status/1719441120214565047
@androidcentral,"Fitbit Charge 6 review: Familiar hardware, Googleified",26,1.0,2.0,https://twitter.com/androidcentral/status/1719430311929405508
@androidcentral,Meta introduces ad-free plans for Facebook and Instagram users in Europe,24,1.0,2.0,https://twitter.com/androidcentral/status/1719151458484883476
@androidcentral,Google vows to fix Android 14's crippling storage problem on Pixels,60,1.0,10.0,https://twitter.com/androidcentral/status/1719058108230799810
@androidcentral,One UI 6 update brings several AI camera enhancements to Galaxy phones,44,1.0,4.0,https://twitter.com/androidcentral/status/1719049791030866234
@androidcentral,Samsung rolls out stable One UI 6 (Android 14) on the Galaxy S23 series,74,2.0,11.0,https://twitter.com/androidcentral/status/1719032683920298418
@androidcentral,Brace yourself for a pricier Samsung flagship phone in 2025,54,2.0,9.0,https://twitter.com/androidcentral/status/1718558789245526346
@androidcentral,"Google works hard to make sure AI isn't evil, here's why",79,6.0,10.0,https://twitter.com/androidcentral/status/1718284513594282249
@androidcentral,The fast-approaching OnePlus 12 scored high in AnTuTu benchmarks — and that's just the 12GB version!,40,1.0,6.0,https://twitter.com/androidcentral/status/1717973487610892428
@androidcentral,This rumored Galaxy Watch 7 upgrade could deliver a major battery boost over the Watch 6,56,6.0,7.0,https://twitter.com/androidcentral/status/1717968835888689349
@androidcentral,"Google wants to help you spot fake photos online, so it's rolling out its fact-checking tool to its search engine globally",51,2.0,8.0,https://twitter.com/androidcentral/status/1717887020503122079
@androidcentral,"Google Bard can now summarize multiple emails at once for you, gets visual upgrade",50,1.0,3.0,https://twitter.com/androidcentral/status/1717876425296908627
@androidcentral,T-Mobile wisely decided it was a bad idea to anger its most loyal customers,39,3.0,2.0,https://twitter.com/androidcentral/status/1717671986527166531
@androidcentral,Amazon's Q3 2023 beats expectations with a 13% rise in revenue,21,1.0,1.0,https://twitter.com/androidcentral/status/1717644280951365730
@androidcentral,Pixel 8 Pro display is much more power efficient than Samsung and Apple,111,4.0,13.0,https://twitter.com/androidcentral/status/1717623253038944650
@androidcentral,X (Twitter) rolls out Video and Voice calls for users behind its Premium paywall,30,4.0,3.0,https://twitter.com/androidcentral/status/1717606740722675733
@androidcentral,"Samsung's Temporary Cloud Backup holds your data for 30 days, arriving for Android 14",24,1.0,4.0,https://twitter.com/androidcentral/status/1717516450871599327
@androidcentral,"Google isn't telling anyone why some flicker-sensitive users have been able to use the Pixel 8 Pro without issues, and it's a mystery",76,6.0,9.0,https://twitter.com/androidcentral/status/1717447237549105649
@androidcentral,"The Google Pixel Tablet might soon be able to see and hear you, so you can control it without touching it",35,1.0,3.0,https://twitter.com/androidcentral/status/1717438433189064833
@androidcentral,Meta’s insanely profitable Q3 earnings prove AI and Reels will provide much more profit than the Quest 3,16,1.0,2.0,https://twitter.com/androidcentral/status/1717314798445097021
@androidcentral,"Motorola always seems to be experimenting with concepts, and its latest brings back memories of LG's heydays",43,2.0,2.0,https://twitter.com/androidcentral/status/1717302295568711851
@androidcentral,Honor's on-device LLM for the Magic 6 draws knowledge from your media.,31,2.0,3.0,https://twitter.com/androidcentral/status/1717280882929631284
@androidcentral,Would you replace your smartwatch with a wearable phone?,104,27.0,8.0,https://twitter.com/androidcentral/status/1717196591176503662
@androidcentral,"After rolling out Beta 8 for the Galaxy S23 series, this could be Samsung's final week of Android 14 testing before, potentially, releasing it for every user next week",44,1.0,5.0,https://twitter.com/androidcentral/status/1717103978364760127
@androidcentral,"There's a lot to love in the latest Meta Quest update including a new extended battery mode for Quest 3, hand tracking improvements, mixed reality enhancements, and more",26,2.0,3.0,https://twitter.com/androidcentral/status/1716916196531183685
@androidcentral,Qualcomm comes after Google's AI crown with the new Snapdragon 8 Gen 3,49,1.0,11.0,https://twitter.com/androidcentral/status/1716893600632521078
@androidcentral,U.S. folks now have a new way to buy a Nothing Phone (2) instead of getting it straight from the source,22,1.0,1.0,https://twitter.com/androidcentral/status/1716880854059004264
@androidcentral,"Nick Sutrich has taken over 100,000 photos using so many different phones. It's very clear that Google's Pixel 8 Pro ups the ante and tops any smartphone out there.",26,1.0,2.0,https://twitter.com/androidcentral/status/1716874736754450656
@androidcentral,The OnePlus 12 will bring back this popular feature cut from the 11,41,1.0,5.0,https://twitter.com/androidcentral/status/1716867874323902849
@androidcentral,Gmail gets more functional on bigger screens with the new update,56,1.0,7.0,https://twitter.com/androidcentral/status/1716799218948456823
@androidcentral,The 7th Guest VR brings the 1992 FMV classic back to life in an amazing way.,20,1.0,2.0,https://twitter.com/androidcentral/status/1716789159921103147
@androidcentral,"No more accidental emergency calls from your Android phone thanks to Google's new ""touch and hold"" step",57,1.0,6.0,https://twitter.com/androidcentral/status/1716666384183091389
@androidcentral,"One app can be used to control a lot more devices, and new Matter-ready devices can now talk to each other",26,1.0,2.0,https://twitter.com/androidcentral/status/1716583547341811916
@androidcentral,Samsung may pack more AI into the Galaxy S24 series to take on Google,49,1.0,7.0,https://twitter.com/androidcentral/status/1716537899481502185
@androidcentral,"The updated Matter 1.2 standard includes support for nine new device types, covering more of your smart home than ever",27,1.0,2.0,https://twitter.com/androidcentral/status/1716477732266131858
@androidcentral,Google Messages could soon make photo sharing a breeze,50,3.0,2.0,https://twitter.com/androidcentral/status/1716386010580332638
@androidcentral,Instagram's app icon on Android finally adopts dynamic theming,58,4.0,3.0,https://twitter.com/androidcentral/status/1716350965698203954
@androidcentral,Google Keep is sprucing up your old notes with rich text formatting tools (the feature was previously limited to new notes),63,2.0,7.0,https://twitter.com/androidcentral/status/1716297641548448011
@androidcentral,"Brave browser's privacy focus takes a backseat as it secretly installs a VPN on your Windows PC, surprising users more than safeguarding them",66,3.0,13.0,https://twitter.com/androidcentral/status/1716263163048448047
@androidcentral,X plans to start charging new users $1 a year for full access to the platform,77,3.0,12.0,https://twitter.com/androidcentral/status/1716198679797735593
@androidcentral,I'm happy this annoyingly popular watch display tech is dying a slow death,36,1.0,3.0,https://twitter.com/androidcentral/status/1716114742475907200
@androidcentral,"Pixel 7 users, rejoice! The Pixel 8's multilingual voice typing is coming your way.",80,2.0,12.0,https://twitter.com/androidcentral/status/1716033348672319589
@androidcentral,Android 14 review: Steady refinement,55,1.0,4.0,https://twitter.com/androidcentral/status/1715797183486710000
@androidcentral,Motorola Razr (2023) review: An affordable foldable for the masses,36,2.0,5.0,https://twitter.com/androidcentral/status/1715778357936169225
@androidcentral,Samsung aims to sell 20 million foldables in 2024,62,4.0,3.0,https://twitter.com/androidcentral/status/1715767430222381444
@androidcentral,The Galaxy S23 inches closer to stable Android 14,62,1.0,2.0,https://twitter.com/androidcentral/status/1715510215125168500
@androidcentral,Google Wallet catches up to Apple Wallet for digital IDs,62,2.0,4.0,https://twitter.com/androidcentral/status/1715486811831590914
@androidcentral,"ChromeOS 118 is rolling out, bringing the new Chromebook Plus features with it",41,1.0,2.0,https://twitter.com/androidcentral/status/1715470953684095305
@androidcentral,OnePlus and OPPO tease a 'historic' new smartphone display,54,5.0,2.0,https://twitter.com/androidcentral/status/1715451593380761917
@androidcentral,"Amazon Fire TV Stick 4K Max (2023) review: Setting the standard, again",17,1.0,1.0,https://twitter.com/androidcentral/status/1715414103634636800
@androidcentral,"I want everyone to love the OnePlus Open as much as I do, but you won't",17,1.0,1.0,https://twitter.com/androidcentral/status/1715323739087253548
@androidcentral,Amazon's refreshed Fire HD 10 tablet lineup is fit for all ages,29,1.0,8.0,https://twitter.com/androidcentral/status/1715139774460174746
@androidcentral,WhatsApp will soon let you set up a second account on the same device,36,1.0,6.0,https://twitter.com/androidcentral/status/1715051465503375829
@androidcentral,OnePlus Open review: The best foldable you won't buy,42,4.0,2.0,https://twitter.com/androidcentral/status/1715025324428386363
@androidcentral,Why I'm picking the Quest 3 over the PSVR 2,20,2.0,1.0,https://twitter.com/androidcentral/status/1715006148670029943
@androidcentral,"The Motorola Razr ""Minus"" has one big plus, and that's the price",18,1.0,2.0,https://twitter.com/androidcentral/status/1714971403194085830
@androidcentral,Netflix is raising prices... again,45,5.0,8.0,https://twitter.com/androidcentral/status/1714770871364067517
@androidcentral,Gboard update lets you set your emoji skin tone with one tap,36,1.0,3.0,https://twitter.com/androidcentral/status/1714732360342593863
@androidcentral,Rumored Galaxy S24 colors point to a bright future,26,1.0,1.0,https://twitter.com/androidcentral/status/1714699140536693105
@androidcentral,"X's new $1/year subscription fee aims to curb bots and spam on the platform, and if you're too cheap to shell out, you'll be relegated to the sidelines as a spectator",48,6.0,14.0,https://twitter.com/androidcentral/status/1714588160208834965
@androidcentral,"After seeing the Pixel Watch 2, I'm glad I didn't buy into the original Pixel Watch",66,11.0,6.0,https://twitter.com/androidcentral/status/1714574596316274854
@androidcentral,More rumors point to a premium Galaxy Watch 'Ultra' with a MicroLED display,40,2.0,3.0,https://twitter.com/androidcentral/status/1714453766466937095
@androidcentral,Pixel 6 owners face a critical storage bug with Android 14,66,1.0,8.0,https://twitter.com/androidcentral/status/1714330471864103418
@androidcentral,"It's past time for fitness watches to guarantee proper software updates, the same way phones and smartwatches do",28,3.0,1.0,https://twitter.com/androidcentral/status/1713579509826359481
@androidcentral,Threads gains an 'edit' button with no paywall,23,3.0,3.0,https://twitter.com/androidcentral/status/1713330872219242935
@androidcentral,"Meta knocks it out of the park with the new Quest 3, taking VR gaming and mixed reality to new heights",31,1.0,2.0,https://twitter.com/androidcentral/status/1713307394015367637
@androidcentral,The Pixel Watch 2 is what the original Pixel Watch should've been,52,2.0,4.0,https://twitter.com/androidcentral/status/1713278180474184020
@androidcentral,The new Pixel 8 Pro takes Google's AI to another level,85,1.0,5.0,https://twitter.com/androidcentral/status/1713258921572311471
@androidcentral,"With the Pixel 8 series, there is now a clear divide between Google's Android and Google Pixel",86,1.0,10.0,https://twitter.com/androidcentral/status/1713209306667946362
@androidcentral,Pixel Watch charging speed recently got a downgrade,44,2.0,4.0,https://twitter.com/androidcentral/status/1712923688054505837
@androidcentral,More Samsung phones get a taste of Android 14 with the One UI 6 beta,41,1.0,5.0,https://twitter.com/androidcentral/status/1712914884227211729
@androidcentral,Hear me out (again): Google should release a Pixelbook 2,48,3.0,4.0,https://twitter.com/androidcentral/status/1712787041551843491
@androidcentral,Google is letting you create images directly in Search with generative AI,61,3.0,9.0,https://twitter.com/androidcentral/status/1712564076952400052
@androidcentral,The Tensor G3 in the Pixel 8 is the best phone chip today,84,4.0,6.0,https://twitter.com/androidcentral/status/1712348641053044842
@androidcentral,"The Pixel has gotten so much better over the years, and the Pixel 8 Pro is easily Google's best phone yet",63,1.0,1.0,https://twitter.com/androidcentral/status/1712153345182282053
@androidcentral,Samsung joins Google in pressuring Apple to adopt the RCS standard,97,4.0,15.0,https://twitter.com/androidcentral/status/1712117333647299006
@androidcentral,Face Unlock on the Pixel 8 has a major advantage over the Pixel 7,53,1.0,2.0,https://twitter.com/androidcentral/status/1711839154516984229
@androidcentral,Passkeys are now the default method when logging in to your personal Google account,29,4.0,6.0,https://twitter.com/androidcentral/status/1711716979420110934
@androidcentral,"Google's Pixel 8 is raising the stakes with its promise of seven years of software updates, and Samsung is feeling the heat and may have to step up its game",53,4.0,9.0,https://twitter.com/androidcentral/status/1711657618274505115
@androidcentral,The Pixel 8 is the latest example of Google making AI more fun and accessible,48,2.0,5.0,https://twitter.com/androidcentral/status/1711448993790664798
@androidcentral,Samsung quietly unwraps the Galaxy Tab A9 series in select markets,28,3.0,6.0,https://twitter.com/androidcentral/status/1711435635351867645
@androidcentral,"Android's ""lime green"" texts get called out in Drake's new album",28,5.0,4.0,https://twitter.com/androidcentral/status/1711413166561763807
@androidcentral,Google says that a budget-friendly Pixel phone is not in the cards,44,6.0,3.0,https://twitter.com/androidcentral/status/1711407445417893992
@androidcentral,The Pixel Watch 2 is that long-awaited Goldilocks watch that doesn't compromise on smarts *or* fitness,41,3.0,1.0,https://twitter.com/androidcentral/status/1711353597802226106
@androidcentral,Why the Pixel 8's Face Unlock upgrade is a big deal,101,3.0,10.0,https://twitter.com/androidcentral/status/1711080299138834921
@androidcentral,The Pixel Watch 2 feels like it's finally ready to replace Fitbit,31,3.0,2.0,https://twitter.com/androidcentral/status/1710745433813774820
@androidcentral,These are our first impressions of the new Google Pixel 8 and Pixel 8 Pro,63,2.0,6.0,https://twitter.com/androidcentral/status/1710724499774079100
@androidcentral,"With the Pixel 8, Google just won the AI war",48,2.0,3.0,https://twitter.com/androidcentral/status/1710672587800404021
@androidcentral,"Xiaomi's latest MIUI version based on Android 14 is here, and it's beating out the competition",32,1.0,4.0,https://twitter.com/androidcentral/status/1710663683280384069
@androidcentral,"This feature was supposed to be limited to the Pixel 8, but thanks to the community, you don't have to wait to enjoy an all-new way to customize your current Pixel.",49,2.0,4.0,https://twitter.com/androidcentral/status/1710534423307760094
@androidcentral,Don't text Drake from an Android phone,36,2.0,8.0,https://twitter.com/androidcentral/status/1710463716544692689
@androidcentral,"Spotify's ""Supremium"" tier might arrive sooner than you think",36,2.0,5.0,https://twitter.com/androidcentral/status/1710375636827615323
@androidcentral,"I'm all aboard the Google Assistant with Bard hype train, and you should be too",68,2.0,4.0,https://twitter.com/androidcentral/status/1710249813302776316
@androidcentral,OnePlus 11R Solar Red hands-on: This is one of the best OnePlus phones ever made,83,1.0,10.0,https://twitter.com/androidcentral/status/1710180914263998521
@androidcentral,Samsung gave the Galaxy SmartTag a makeover and a battery life boost that's twice as long as the previous model,35,1.0,4.0,https://twitter.com/androidcentral/status/1710179219894915245
@androidcentral,Google unveils the Android 14 statue upside down with a piece of cake,63,2.0,10.0,https://twitter.com/androidcentral/status/1710023069958316423
@androidcentral,"X, formerly Twitter, now removes headlines from articles posted to the platform",26,3.0,7.0,https://twitter.com/androidcentral/status/1710004952968380888
@androidcentral,The original Pixel Watch is getting Wear OS 4 later this year,51,3.0,5.0,https://twitter.com/androidcentral/status/1709988121796805103
@androidcentral,"OnePlus divulges what the OnePlus 11R Solar Red will cost, and it is turning out to be a real bargain",26,2.0,2.0,https://twitter.com/androidcentral/status/1709853140588388516
@androidcentral,"The Pixel 8 series gets to India, and the pricing is not great to say the least",54,5.0,6.0,https://twitter.com/androidcentral/status/1709846871936753912
@androidcentral,How much more could Netflix charge?,14,1.0,2.0,https://twitter.com/androidcentral/status/1709682342409785396
@androidcentral,Generative AI was the common theme across hardware and software announcements during the Pixel event,39,2.0,1.0,https://twitter.com/androidcentral/status/1709674797095862498
@androidcentral,"The Pixel 8 Pro feels a lot nicer now that Google switched to matte glass. Oh and there's a bunch of AI stuff, too",74,4.0,5.0,https://twitter.com/androidcentral/status/1709631478814949389
@androidcentral,"The Pixel 8 and 8 Pro are here, and they'll get guaranteed Android OS updates all the way through 2030. All the details here:",91,2.0,12.0,https://twitter.com/androidcentral/status/1709584317788360932
@androidcentral,"Pixels are getting even more features thanks to the latest feature drop, arriving alongside Android 14",54,1.0,6.0,https://twitter.com/androidcentral/status/1709582919579079098
@androidcentral,"Google is finally pushing the stable Android 14 update to Pixel phones, and it's coming to even more devices later this year",104,1.0,15.0,https://twitter.com/androidcentral/status/1709581666107183231
@androidcentral,"Google Assistant is getting supercharged with generative AI, thanks to Bard",19,2.0,4.0,https://twitter.com/androidcentral/status/1709580400060752104
@androidcentral,"The Pixel Watch 2 is better than ever, with longer battery life and better Fitbit integration",22,1.0,4.0,https://twitter.com/androidcentral/status/1709579134790226330
@androidcentral,"Google announces the new Pixel 8 series, starting at just $699",49,3.0,4.0,https://twitter.com/androidcentral/status/1709578141998432463
@androidcentral,"Samsung launches the Galaxy S23 FE in India, but it's a non-starter. Here's what you should buy instead:",26,1.0,4.0,https://twitter.com/androidcentral/status/1709530259853599085
