UserId,Tweets,Likes,Comments,Retweets,Tweet_Url
@androidcentral,"The Galaxy Watch 4 series is finally getting a One UI 5 Watch glow-up, at least in the US",32,1.0,3.0,https://twitter.com/androidcentral/status/1699081648334159876
@androidcentral,"WhatsApp could be getting a fresh new look, with a white top bar and green accents",57,2.0,4.0,https://twitter.com/androidcentral/status/1698984395128856764
@androidcentral,"UGREEN's latest charging station goes up to an insane 300W, and is now available globally. Here's everything you need to know about it:",20,1.0,1.0,https://twitter.com/androidcentral/status/1698972165616595436
@androidcentral,Here are some helpful back-to-school tips on protecting your privacy,21,2.0,2.0,https://twitter.com/androidcentral/status/1698840551347425661
@androidcentral,The OnePlus Open may be built to last for years to come,32,1.0,3.0,https://twitter.com/androidcentral/status/1698828544317575397
@androidcentral,"Get ready to shell out a little more than you might have thought for the Pixel 8, if this rumor doesn't lie",47,2.0,3.0,https://twitter.com/androidcentral/status/1698762185936109844
@androidcentral,"The Pixel Fold is a great piece of hardware, but",30,1.0,4.0,https://twitter.com/androidcentral/status/1698579922220888248
@androidcentral,"Do you actually need to walk 10,000 steps a day? Our Fitness Editor hit that goal every day in August to see if it's worth the fuss",38,4.0,7.0,https://twitter.com/androidcentral/status/1698351649817825517
@androidcentral,"Sony just dropped a new compact phone, the Xperia 5 V, and it's got some surprisingly powerful specs and features for its size",58,1.0,7.0,https://twitter.com/androidcentral/status/1698306600534950221
@androidcentral,Samsung may outfit the S24 Ultra with an optimized version of its 200MP camera found in the Galaxy S23 Ultra,33,3.0,3.0,https://twitter.com/androidcentral/status/1697698357567725891
@androidcentral,Huawei may have gotten back into the 5G game with the Mate 60 and Mate 60 Pro,29,1.0,5.0,https://twitter.com/androidcentral/status/1697692836597039207
@androidcentral,This week was light on Quest 3 leaks but heavy on promises delivered by Meta. Check out the new features coming to your Quest headset soon,17,1.0,2.0,https://twitter.com/androidcentral/status/1697687536745738422
@androidcentral,Google may have even more camera tricks up its sleeve for the Pixel 8 Pro,53,1.0,5.0,https://twitter.com/androidcentral/status/1697671681018315249
@androidcentral,Samsung's software expertise on foldable phones really gives it a leg up on the rest of the competition.,25,1.0,3.0,https://twitter.com/androidcentral/status/1697581951505314105
@androidcentral,Honor just showed off a foldable that's designed to be carried as a purse,26,3.0,3.0,https://twitter.com/androidcentral/status/1697546754672218458
@androidcentral,Chrome users are complaining after the latest update got rid of a feature,19,1.0,2.0,https://twitter.com/androidcentral/status/1697398630590628016
@androidcentral,You can now comment on your favorite songs with YouTube Music's updated Now Playing UI,20,2.0,3.0,https://twitter.com/androidcentral/status/1697393349928374316
@androidcentral,A new One UI 6 beta brings additional features,40,1.0,4.0,https://twitter.com/androidcentral/status/1697355349404115202
@androidcentral,"We can argue about light mode vs dark mode all day, but one is the clear loser on most modern smartphones for a surprising reason",16,1.0,4.0,https://twitter.com/androidcentral/status/1697321666592870668
@androidcentral,"Google Play is gifting users with a seven-day points for 8x more points and the opportunity to use points on Walmart Plus, Instacart, and Discord offers",18,2.0,3.0,https://twitter.com/androidcentral/status/1697309306268356822
@androidcentral,Samsung is finally bringing Wear OS 4 to its older smartwatches,33,1.0,5.0,https://twitter.com/androidcentral/status/1697301247601016837
@androidcentral,OxygenOS 14 will soon be upon us,28,2.0,3.0,https://twitter.com/androidcentral/status/1697297711702180108
@androidcentral,"As we approach Halloween, all manner of scary creatures are on everyone's minds.",11,1.0,1.0,https://twitter.com/androidcentral/status/1697294456381145428
@androidcentral,"XGIMI has a new 4K laser projector in the Horizon Ultra, and it is fabulous",18,1.0,1.0,https://twitter.com/androidcentral/status/1697289055103496680
@androidcentral,The latest Withings hybrid smartwatch gives the Fitbit Sense 2 a run for its money with not one but two skin temperature sensors,14,1.0,1.0,https://twitter.com/androidcentral/status/1697286895569445263
@androidcentral,"Jabra takes it up a notch with the new Elite 10 wireless earbuds, which sound as good as they look",31,1.0,2.0,https://twitter.com/androidcentral/status/1697239073822331097
@androidcentral,"The new Fairphone 5 is much more modern, modular, and will last for a long time",49,1.0,2.0,https://twitter.com/androidcentral/status/1697114008027865574
@androidcentral,It might not be long before Google's rumored Chromebook Plus branding makes its way to the first devices,28,1.0,2.0,https://twitter.com/androidcentral/status/1697005545230598422
@androidcentral,"As long as you have the budget, this USB-C hub from Dockcase is much more than a way to connect everything to your computer",26,1.0,1.0,https://twitter.com/androidcentral/status/1696954717522334008
@androidcentral,"Google sets a date for the Pixel 8 launch event, which will take place in early October",58,1.0,8.0,https://twitter.com/androidcentral/status/1696943878828409027
@androidcentral,Google accidentally leaked its upcoming Pixel 8 Pro,63,8.0,6.0,https://twitter.com/androidcentral/status/1696927036307128754
@androidcentral,"If you're looking to run your way into shape, the COROS PACE 3 is a great starting point that won't break the bank",12,1.0,1.0,https://twitter.com/androidcentral/status/1696895593753334217
@androidcentral,"It's been said that dark mode on phones makes for a more comfortable viewing experience, but is it actually better for your eyes? Not necessarily says",24,3.0,2.0,https://twitter.com/androidcentral/status/1696857059046662406
@androidcentral,The first half of 2023 was dominated by Samsung and Apple,41,1.0,4.0,https://twitter.com/androidcentral/status/1696755897236652424
@androidcentral,"Google Meet’s Duet AI is the meeting assistant that’s always got your back, even when you’re not there",23,1.0,2.0,https://twitter.com/androidcentral/status/1696667318921896228
@androidcentral,"Google could start offering longer update support for its phones, starting with the Pixel 8",68,4.0,12.0,https://twitter.com/androidcentral/status/1696639382768300269
@androidcentral,Duet AI for Workspace can summarize lengthy documents and even create a presentation for you,28,1.0,3.0,https://twitter.com/androidcentral/status/1696610440644608393
@androidcentral,Samsung updates the Galaxy Buds 2 Pro with enhanced Auracast capabilities,27,1.0,1.0,https://twitter.com/androidcentral/status/1696591569460072810
@androidcentral,"The COROS PACE 3 is one of the best running watches we've ever tested, and it costs half as much as our favorite, the Garmin Forerunner 265",20,2.0,2.0,https://twitter.com/androidcentral/status/1696510538862190885
@androidcentral,"Nothing's CMF-branded smartwatch has been leaked, giving us a sneak peek at its design, specs, and price",32,2.0,3.0,https://twitter.com/androidcentral/status/1696479270447509986
@androidcentral,The new OPPO Find N3 Flip comes with more cameras than other flip-style foldables,16,1.0,2.0,https://twitter.com/androidcentral/status/1696428739444269359
@androidcentral,ASUS confirms that the Zenfone line will live on,47,2.0,3.0,https://twitter.com/androidcentral/status/1696364567742325071
@androidcentral,"The latest update for your Chromebook is filled with exciting changes and tweaks, including system-wide autocorrection and much more.",22,1.0,1.0,https://twitter.com/androidcentral/status/1696283031449792647
@androidcentral,"The Galaxy S23 Ultra had a flatter display, but the S24 Ultra could go completely flat",29,4.0,1.0,https://twitter.com/androidcentral/status/1696273985074250181
@androidcentral,"Not every cover screen is made the same, but phones like the Galaxy Z Flip 5 offer an experience that makes them great for quick replies and glanceable information",15,1.0,1.0,https://twitter.com/androidcentral/status/1696260698290979059
@androidcentral,Google may utilize Garmin's emergency response coordination center to bring SOS messaging support to Android users in over 150 countries,26,1.0,2.0,https://twitter.com/androidcentral/status/1696220870904094753
@androidcentral,"Messenger Lite, the app for people who just wanted to chat without all the bells and whistles, is biting the dust on September 18",48,7.0,4.0,https://twitter.com/androidcentral/status/1695351143566639315
@androidcentral,"The latest look at ""Link Your Devices"" for Android reveals some interesting (and useful) features",28,1.0,1.0,https://twitter.com/androidcentral/status/1695162386083119213
@androidcentral,Using an eSIM is supposed to be easier but phone carriers have a unique ability to ruin everything.,25,3.0,1.0,https://twitter.com/androidcentral/status/1694989514907713778
@androidcentral,"If you bought this Wear OS watch and are having serious problems, you're not alone",21,2.0,2.0,https://twitter.com/androidcentral/status/1694825200691425493
@androidcentral,You can now use Threads on your web browser,20,3.0,2.0,https://twitter.com/androidcentral/status/1694796479410376887
@androidcentral,The next Fan Edition Galaxy smartphone may arrive very soon,18,1.0,2.0,https://twitter.com/androidcentral/status/1694790438954193221
@androidcentral,"Running two copies of the same game on a foldable is wild, but the Honor Magic V2 gives users a separate space to enjoy their favorite apps... twice",22,1.0,2.0,https://twitter.com/androidcentral/status/1694488479038664944
@androidcentral,A Google Glass reboot could still happen...but Google is having serious XR issues behind the scenes,17,2.0,1.0,https://twitter.com/androidcentral/status/1694433944366719236
@androidcentral,"Price might be holding us back from Samsung's foldable, however, a new rumor suggests the company is already developing an FE version of its Fold and Flip models",27,1.0,1.0,https://twitter.com/androidcentral/status/1694410535389859944
@androidcentral,Starting college and need the right tech? Chromebooks are the go-to choice for students on a budget,27,1.0,3.0,https://twitter.com/androidcentral/status/1694335437844725802
@androidcentral,"It looks like someone may have a retail Quest 3 early, and they unbox it for everyone to see",19,1.0,1.0,https://twitter.com/androidcentral/status/1694317650627731728
@androidcentral,"MagSafe is part of the new wireless charging standard, but how about adding it to existing phones? We found out how well it works on the Pixel Fold",32,1.0,3.0,https://twitter.com/androidcentral/status/1694280391916495231
@androidcentral,"Honor is returning to India, and it has big plans",29,1.0,1.0,https://twitter.com/androidcentral/status/1694190319871660278
@androidcentral,MediaTek teams up with Meta to bring on-device generative AI features to its upcoming Dimensity 9300 platform,44,1.0,4.0,https://twitter.com/androidcentral/status/1694185671349723262
@androidcentral,Better battery life could be in tow for the Galaxy S24 and S24+,34,5.0,1.0,https://twitter.com/androidcentral/status/1694057364276576431
@androidcentral,"Turns out, adding a magnet to wireless chargers and accessories is pretty darn cool. Here's how you can do it, too",32,4.0,5.0,https://twitter.com/androidcentral/status/1694048798295703921
@androidcentral,WhatsApp is stepping up its messaging game with new text formatting options that will make your messages look sharp,45,1.0,2.0,https://twitter.com/androidcentral/status/1694009045688967541
@androidcentral,This golf club accessory isn't just some crappy plastic add-on. It's a legit golf club complete with trigger grips for popular VR golf games!,14,1.0,1.0,https://twitter.com/androidcentral/status/1694002998941536670
@androidcentral,"Now you can easily find and play your favorite songs on YouTube Music for Wear OS, no more fumbling around with your tiny watch screen",18,1.0,1.0,https://twitter.com/androidcentral/status/1693895821509427454
@androidcentral,"Google is working on integrating Health Connect into Android 14, but the process is causing sync problems for those enrolled in its latest beta",36,1.0,3.0,https://twitter.com/androidcentral/status/1693823073806319642
@androidcentral,Google might follow after Apple by offering an eSIM-only Pixel 8,31,7.0,7.0,https://twitter.com/androidcentral/status/1693702776935657598
@androidcentral,"Though Samsung skipped out on a new set of Galaxy Buds during Unpacked, a new leak suggests they may be coming soon",28,2.0,3.0,https://twitter.com/androidcentral/status/1693687675117506875
@androidcentral,Samsung's coming for iPhone users again by updating the Try Galaxy app to simulate the Galaxy Z Fold 5's larger display experience,24,3.0,2.0,https://twitter.com/androidcentral/status/1693677620750172577
@androidcentral,Garmin fans have waited years (literally) for this sleep-tracking update,23,2.0,1.0,https://twitter.com/androidcentral/status/1693671834493853720
@androidcentral,The next One UI update makes screen casting nearly effortless,61,2.0,5.0,https://twitter.com/androidcentral/status/1693655725476634984
@androidcentral,"The Galaxy Z Flip 5 and Motorola Razr Plus are some of the most interesting foldable phones to launch this year, but one feels a lot better to use than the other",35,1.0,3.0,https://twitter.com/androidcentral/status/1693618217640493242
@androidcentral,"The Google Camera app may finally get a UI upgrade, so it can look as good as it takes photos",91,1.0,13.0,https://twitter.com/androidcentral/status/1693545288701444589
@androidcentral,Samsung brings Wear OS 4 to its older Galaxy smartwatches and updates its foldables with the latest software,57,2.0,3.0,https://twitter.com/androidcentral/status/1693362612921086387
@androidcentral,Samsung just brought some camera improvements for the Galaxy S23,59,1.0,4.0,https://twitter.com/androidcentral/status/1693356576977867036
@androidcentral,"We're so close to stable Android 14, but Google had to squash a few bugs in the beta first",74,1.0,3.0,https://twitter.com/androidcentral/status/1693350648102662421
@androidcentral,Amazfit's running watch relies on the Zepp Coach AI to guide your training and recovery. Can you trust it?,30,1.0,2.0,https://twitter.com/androidcentral/status/1693294333854675223
@androidcentral,"Google is preparing to give future smartphones the power to text for help, even when there's no signal",60,1.0,11.0,https://twitter.com/androidcentral/status/1693172212289650727
@androidcentral,It's almost as satisfying to watch a phone get put together as it is to watch them get disassembled,40,1.0,1.0,https://twitter.com/androidcentral/status/1692973063799820373
@androidcentral,One UI 6 beta already received its first update,50,3.0,4.0,https://twitter.com/androidcentral/status/1692967840012239281
@androidcentral,"There's been a lot of talk lately about PWM and display flicker, but what is it, and how can you avoid it?",34,2.0,2.0,https://twitter.com/androidcentral/status/1692960140037693662
@androidcentral,Samsung is sure to update plenty of phones to One UI 6,45,1.0,4.0,https://twitter.com/androidcentral/status/1692952049774690706
@androidcentral,Rumored display change for the next iPhone SE could could be good news for Android,47,1.0,5.0,https://twitter.com/androidcentral/status/1692946243004006626
@androidcentral,"If Samsung really planned to use an Exynos chip for its Vision Pro rival, it made the right call to start over",29,1.0,1.0,https://twitter.com/androidcentral/status/1692935683596317026
@androidcentral,"Pixels take some of the best photos, but video isn't their strong suit",45,2.0,3.0,https://twitter.com/androidcentral/status/1692916613480055208
@androidcentral,T-Mobile's first Revvl tablet is a cheap 5G alternative to the Galaxy Tab S9+,28,2.0,2.0,https://twitter.com/androidcentral/status/1692595484462813217
@androidcentral,This Pixel Watch 2 listing gets us pretty excited,41,3.0,6.0,https://twitter.com/androidcentral/status/1692591449869561874
@androidcentral,It looks like Chromebooks aren't getting dedicated NVIDIA GPUs,24,1.0,4.0,https://twitter.com/androidcentral/status/1692294503405584434
@androidcentral,We might finally get a camera upgrade on the Galaxy Z Flip 6,33,1.0,3.0,https://twitter.com/androidcentral/status/1692237386824978446
@androidcentral,We're already starting to learn more about what we might expect from the Galaxy S24 Ultra next year,41,1.0,3.0,https://twitter.com/androidcentral/status/1692228574260969804
@androidcentral,"We love the Galaxy Watch 6 Classic’s rotating bezel, but don’t sleep on the ultra-light Watch 6",45,1.0,3.0,https://twitter.com/androidcentral/status/1692055231226347694
@androidcentral,The Pixel Watch and Galaxy Watch 6 could get a Google Assistant tile soon,52,1.0,5.0,https://twitter.com/androidcentral/status/1691985713330323661
@androidcentral,An update to Nearby Share on Android could make sharing files a little faster,51,1.0,8.0,https://twitter.com/androidcentral/status/1691912997227167904
