UserId,Tweets,Likes,Comments,Retweets,Tweet_Url
@sundarpichai,Elbow or fist bump? Navigating this new normal together and so glad to be back in person with,4.6K,134,202,https://twitter.com/sundarpichai/status/1448109947275857926
@sundarpichai,Thanks,692,33,61,https://twitter.com/sundarpichai/status/1448093571672805378
@sundarpichai,At,912,49,119,https://twitter.com/sundarpichai/status/1447984160782520323
@sundarpichai,Can't wait! See you soon:),1.6K,75,115,https://twitter.com/sundarpichai/status/1447952866124054530
@sundarpichai,"There's so much momentum happening across Africa, and we're excited to showcase it at our first",2.1K,155,386,https://twitter.com/sundarpichai/status/1445739705388077061
@sundarpichai,"Today we’re sharing new ways people can use our products to make sustainable choices, including tools to book flights or purchase appliances with lower carbon footprints, a Nest program to support clean energy from home, eco-friendly routes on Maps & more.",3.3K,167,510,https://twitter.com/sundarpichai/status/1445646895062216711
@sundarpichai,At,1.9K,136,252,https://twitter.com/sundarpichai/status/1443275938783924225
@sundarpichai,"Today we’re announcing that by 2030 we’ll replenish 120% of the water we consume across all our data centers & offices, in addition to running them on 24/7 carbon-free energy. We’re also investing to support water-scarce communities & ecosystems.",3.9K,232,460,https://twitter.com/sundarpichai/status/1435953005942087688
@sundarpichai,"To help with Afghanistan’s humanitarian crisis, we’re providing funding to orgs including",1.5K,196,211,https://twitter.com/sundarpichai/status/1433523072905080843
@sundarpichai,"We're making more real-time COVID vaccine info for India easier to find in Search and Google Maps, now in 9 languages",2.6K,133,318,https://twitter.com/sundarpichai/status/1433125400394100737
@sundarpichai,The birth of,2K,90,220,https://twitter.com/sundarpichai/status/1432873001381367811
@sundarpichai,Glad to be part of Germany’s transition to a digital & sustainable economy - today we’re investing €1B through 2030 in new and expanded,1.5K,69,220,https://twitter.com/sundarpichai/status/1432736394795896832
@sundarpichai,"Project Guideline helps people with visual impairments run on their own, using",1.1K,86,129,https://twitter.com/sundarpichai/status/1429896592258060289
@sundarpichai,"Happy 75th Independence Day, India! Wishing everyone a safe and happy celebration:)
Many thanks to our guest artist Sayan Mukherjee for this year's beautiful doodle!",16K,374,1.3K,https://twitter.com/sundarpichai/status/1426689401069793280
@sundarpichai,"A huge thanks to all of our interns, who joined us this year from more than 400 universities and more than 40 countries! We’re glad you’re with us:)",2.2K,99,161,https://twitter.com/sundarpichai/status/1420785214419132416
@sundarpichai,We’ve long supported,1.1K,101,118,https://twitter.com/sundarpichai/status/1420768007756734466
@sundarpichai,"In many parts of Southeast Asia and beyond, the impact of COVID remains severe. To help, we’re providing additional support to UNICEF & the IFRC for healthcare equipment, as well as funding for public health campaigns in the region.",1.4K,68,173,https://twitter.com/sundarpichai/status/1420626173025943554
@sundarpichai,Can't wait to see everyone's,14K,440,4.2K,https://twitter.com/sundarpichai/status/1418705224575852545
@sundarpichai,Might need to work on my surfing skills,13K,361,758,https://twitter.com/sundarpichai/status/1418445370514833408
@sundarpichai,"The AlphaFold database shows the potential for AI to profoundly accelerate scientific progress, greatly expanding our accumulated knowledge of protein structures and the human proteome overnight.",2.5K,74,332,https://twitter.com/sundarpichai/status/1418229304194859011
@sundarpichai,Great to see the methods for @DeepMind's AlphaFold breakthrough published today along with the open-source code. This is an exciting step forward that will help enable the scientific community to accelerate research in many important areas.,1.7K,168,228,https://twitter.com/sundarpichai/status/1415804661903200256
@sundarpichai,"Excited to launch the Delhi NCR Cloud region, our second in India, tenth in Asia-Pacific - look forward to seeing how India’s businesses and institutions will use the power of",3.1K,105,322,https://twitter.com/sundarpichai/status/1415561038309695490
@sundarpichai,Excited to announce the next steps in our partnership with,7.1K,279,1K,https://twitter.com/sundarpichai/status/1408000852581748736
@sundarpichai,is a time for reflection as we commemorate the end of slavery in the US. Proud to share today’s Doodle by guest artist Rachelle Baker which honors Juneteenth and celebrates Black culture & community.,1.5K,134,176,https://twitter.com/sundarpichai/status/1406337513740849155
@sundarpichai,And that's a wrap on day 1! Thanks to everyone who stopped by our new Google Store in NYC. It's a beautiful space and one of <215 retail spaces in the world with a LEED Platinum rating. Can't wait to check it out next time I'm in town:),7.6K,166,362,https://twitter.com/sundarpichai/status/1405733471889203204
@sundarpichai,Proud of the work,762,64,48,https://twitter.com/sundarpichai/status/1405639983193460739
@sundarpichai,"As part of our ongoing racial equity commitments, we’re proud to partner with 10 HBCUs to expand opportunities for underrepresented groups in STEM. Our new $50M commitment will support scholarships, develop curriculum & career readiness, and more.",1.4K,79,188,https://twitter.com/sundarpichai/status/1405564921497018373
@sundarpichai,"Our hearts go out to those in India impacted by the ongoing COVID-19 crisis, and we continue to look for ways to help. Today",5.5K,199,666,https://twitter.com/sundarpichai/status/1405398171904184321
@sundarpichai,Who will win,3.3K,473,313,https://twitter.com/sundarpichai/status/1404677428132257792
@sundarpichai,"Big congrats to Milo Golding, our 2021 Doodle for Google winner! His artwork titled ""Finding Hope"" was inspired by this year's theme ""I am strong because…"" and will be on our US homepage tomorrow. Sharing the news with Milo was the highlight of my week:)",4.7K,156,473,https://twitter.com/sundarpichai/status/1404440402552233989
@sundarpichai,Happy to share that the fully integrated,1.7K,90,255,https://twitter.com/sundarpichai/status/1404418927535423492
@sundarpichai,"Thoughts with Christian Eriksen and his family, teammates. Incredible effort from the paramedic team",27K,212,1.6K,https://twitter.com/sundarpichai/status/1403767256979410946
@sundarpichai,"Today we’re announcing Firmina, the longest subsea cable in the world capable of running from a single power source at one end if necessary. Firmina will run from the US East Coast to Argentina to help improve access to Google services in South America.",3.2K,316,422,https://twitter.com/sundarpichai/status/1402631166000189445
@sundarpichai,Thank you to European Commission EVP,1.9K,173,121,https://twitter.com/sundarpichai/status/1397973768534900747
@sundarpichai,"So important to catalyze new approaches, great to see this!",1.6K,104,111,https://twitter.com/sundarpichai/status/1397635354115465218
@sundarpichai,"So inspired by the story of Jason Barnes, a drummer and composer who worked with a team of",2K,71,296,https://twitter.com/sundarpichai/status/1395485288529465345
@sundarpichai,Thanks,1.6K,73,125,https://twitter.com/sundarpichai/status/1395454776226111488
@sundarpichai,Proud to work with,986,42,128,https://twitter.com/sundarpichai/status/1395417527161802753
@sundarpichai,Excited for the direction we’re headed with,1.3K,61,110,https://twitter.com/sundarpichai/status/1395241867206266880
@sundarpichai,AI is powering a lot of the improvements we’re making in,1.6K,72,132,https://twitter.com/sundarpichai/status/1395199400331288580
@sundarpichai,More about our investments in quantum computing - really excited about the potential to solve complex problems like more efficient batteries and better drug discovery,2.7K,73,244,https://twitter.com/sundarpichai/status/1395156196395347968
@sundarpichai,At,3.8K,155,460,https://twitter.com/sundarpichai/status/1394868108259565575
@sundarpichai,So excited that,11K,235,1.1K,https://twitter.com/sundarpichai/status/1394692289453121540
@sundarpichai,"Google is proud to support our nation’s immigrants. We joined 30 other companies to protect the H-4 EAD program which spurs innovation, creates jobs and opportunities, and helps families.",3K,272,497,https://twitter.com/sundarpichai/status/1393186323603750912
@sundarpichai,Our hearts go out to the communities in Latin America hit hard by COVID-19. We’re providing $33M in new funding and grants to increase access to quality information and support humanitarian efforts by partners like,1.6K,93,215,https://twitter.com/sundarpichai/status/1392838724623376394
@sundarpichai,"Glad to see the US government announcing an ambitious, yet attainable goal to cut greenhouse gas emissions by 50%+ below 2005 levels by 2030. At Google, we're committed to doing our part by working to achieve carbon-free operations by 2030.",1.8K,122,192,https://twitter.com/sundarpichai/status/1385276305365635078
@sundarpichai,"Proud that we’ve matched our operations with 100% renewable energy 4 years in a row.

5 of our data centers are running on ~90% carbon-free energy, putting us on track to operate on 24/7 carbon-free energy by 2030.",3.9K,148,484,https://twitter.com/sundarpichai/status/1384935522792050688
@sundarpichai,"To help with equitable COVID-19 vaccine distribution efforts globally, we’re providing 250,000 vaccines to countries in need, supporting pop-up vaccine sites in the US & committing another $250M in ad grants to help connect people to accurate vaccine info",1.6K,109,203,https://twitter.com/sundarpichai/status/1382726635728740354
@sundarpichai,Our planet has seen rapid environmental change in the past half-century -- more than any other point in human history. The new Timelapse feature in,1.9K,98,357,https://twitter.com/sundarpichai/status/1382682787912642567
@sundarpichai,Excited that we're launching a new,1.7K,90,193,https://twitter.com/sundarpichai/status/1382319507469864968
@sundarpichai,...and we're back:) Join us May 18-20 for,8.4K,337,2K,https://twitter.com/sundarpichai/status/1379850658694635521
@sundarpichai,Helpful new AI-powered features are coming to,4.3K,204,642,https://twitter.com/sundarpichai/status/1376898299140087815
@sundarpichai,Our planet has seen rapid environmental change in the past half-century -- more than any other point in human history. The new Timelapse feature in,1.9K,98,357,https://twitter.com/sundarpichai/status/1382682787912642567
@sundarpichai,".@DeepMind's incredible AI-powered protein folding breakthrough will help us better understand one of life’s fundamental building blocks + enable researchers to tackle new and hard problems, from fighting diseases to environmental sustainability.",5.4K,100,1.1K,https://twitter.com/sundarpichai/status/1333434525284671489
@sundarpichai,We’ve redesigned the,2.4K,217,250,https://twitter.com/sundarpichai/status/1329161445863407616
@sundarpichai,Today we’re proud to honor veterans with a,2.7K,141,176,https://twitter.com/sundarpichai/status/1326602781805801473
@sundarpichai,"Sharing some updates on our racial equity commitments, including a new goal to increase supplier diversity by spending $100M with Black-owned businesses and a minimum of $1B total with diverse-owned suppliers in the US each year starting in 2021",2.7K,226,358,https://twitter.com/sundarpichai/status/1319315634723799040
@sundarpichai,"22 years in, we’re still focused on providing the most helpful Google Search experience powered by",2.9K,186,468,https://twitter.com/sundarpichai/status/1316826472191938560
@sundarpichai,"We're introducing Journalist Studio, a suite of tools to help reporters do their work more efficiently, including using",2.8K,108,533,https://twitter.com/sundarpichai/status/1316343653116178432
@sundarpichai,"Such a nice moment, congrats to Paul Milgrom and Robert Wilson for their Nobel Prize!",7.6K,98,741,https://twitter.com/sundarpichai/status/1315766766824349696
@sundarpichai,"This week, we’re introducing the COVID layer in",5.7K,152,1.2K,https://twitter.com/sundarpichai/status/1308831700538060800
@sundarpichai,Congrats to our 2020,3.1K,65,261,https://twitter.com/sundarpichai/status/1308664267495763968
@sundarpichai,Saddened by the loss of one of our true heroes. Justice Ginsburg’s legacy will ensure that women will always have a seat at the table (and on our highest court) -- America is a better country because of her service.,7.2K,208,454,https://twitter.com/sundarpichai/status/1307126627579686913
@sundarpichai,As we kick off,839,36,90,https://twitter.com/sundarpichai/status/1306363540903657473
@sundarpichai,"As of today, Google is the 1st major company to eliminate our entire carbon legacy, including before we became carbon neutral in 2007. We’re also proud that by 2030, we aim to operate on 24/7 carbon-free energy in our data centers & campuses worldwide.",16K,441,2.6K,https://twitter.com/sundarpichai/status/1305446704267685893
@sundarpichai,"Nonprofits & academic institutions around the world are using AI + data analytics to better understand COVID-19 and its impact on communities. To support this work,",2.7K,84,387,https://twitter.com/sundarpichai/status/1304070373344911360
@sundarpichai,So heartbreaking to read.  RIP Chadwick Boseman.,12K,101,925,https://twitter.com/sundarpichai/status/1299550743045701638
@sundarpichai,Proud to share,5.3K,104,767,https://twitter.com/sundarpichai/status/1299059655302287360
@sundarpichai,Thrilled to have Halimah as our new general counsel - she's a longtime Googler with a wealth of experience working with teams across the company. Look forward to continue working with her in her new role!,1.8K,84,112,https://twitter.com/sundarpichai/status/1298365268524064768
@sundarpichai,"To help those in areas impacted by wildfires, we've expanded our SOS alerts on Search & Maps in the US to include satellite data-powered boundary maps that show size & location of fires.",3.1K,153,354,https://twitter.com/sundarpichai/status/1296433055138185219
@sundarpichai,"Excited to share the new Pixel 4a - with the same great camera and security, new Assistant languages, and all the helpful features of",7.4K,323,661,https://twitter.com/sundarpichai/status/1290334891339476992
@sundarpichai,"Building a more helpful Google for everyone means ensuring that anyone can access and enjoy our products. As we mark the 30th anniversary of the Americans with Disabilities Act, we remain committed to working alongside the disability community to make that a reality.",7.6K,190,451,https://twitter.com/sundarpichai/status/1287449397530255360
@sundarpichai,The word that comes to  my mind when I think of the life of,6.5K,181,389,https://twitter.com/sundarpichai/status/1284337766986215424
@sundarpichai,Is it possible to detect earthquakes with submarine cables? We think it might be.,8.3K,356,1.4K,https://twitter.com/sundarpichai/status/1283857388752134144
@sundarpichai,Everyone should have access to the internet. Proud to partner with,32K,750,5.7K,https://twitter.com/sundarpichai/status/1283332612308627456
@sundarpichai,I want to thank,2K,51,210,https://twitter.com/sundarpichai/status/1283159596811513857
@sundarpichai,"Now more than ever, work isn’t defined by a physical place--it can happen anywhere. At today’s",4.6K,107,530,https://twitter.com/sundarpichai/status/1283069450833412096
@sundarpichai,(reposting with correct hashtag),1.8K,77,75,https://twitter.com/sundarpichai/status/1282702718784557056
@sundarpichai,For decades we have worked with publishers to grow audiences and build value. We continue that progress today with the introduction of a licensing program to pay publishers for high-quality content.,2K,94,343,https://twitter.com/sundarpichai/status/1276051969610661888
@sundarpichai,"Privacy is at the heart of everything we do, and we’ll keep challenging ourselves to do more with less. As a next step, today we’re changing our data retention practices to make auto-delete the default for our core activity settings.",4.7K,303,906,https://twitter.com/sundarpichai/status/1275835273637576704
@sundarpichai,Proud that,1.8K,60,442,https://twitter.com/sundarpichai/status/1270968380304941058
@sundarpichai,Also excited that in,2.7K,84,421,https://twitter.com/sundarpichai/status/1270957112097570816
@sundarpichai,"Android 11 is now available in beta, with a focus on people, controls and safety.",4.9K,137,698,https://twitter.com/sundarpichai/status/1270954939309645824
@sundarpichai,"Today on US Google & YouTube homepages we share our support for racial equality in solidarity with the Black community and in memory of George Floyd, Breonna Taylor, Ahmaud Arbery & others who don’t have a voice. For those feeling grief, anger, sadness & fear, you are not alone.",35K,1.5K,6.4K,https://twitter.com/sundarpichai/status/1267094364976672768
@sundarpichai,"Thanks, good to catch up with",887,73,63,https://twitter.com/sundarpichai/status/1263922589690236928
@sundarpichai,We’re introducing new accessibility tools including more prominent wheelchair accessibility info in,2.9K,146,451,https://twitter.com/sundarpichai/status/1263524102968500224
@sundarpichai,At first I didn't believe it but:),1.8K,70,201,https://twitter.com/sundarpichai/status/1263358158589714433
@sundarpichai,We’re introducing new accessibility tools including more prominent wheelchair accessibility info in,2.9K,146,451,https://twitter.com/sundarpichai/status/1263524102968500224
@sundarpichai,Happy 10th birthday BigQuery! What started as an internal Google product is now serving petabyte-scale data needs for businesses all around the world. Congrats to the team and many thanks to our developers and customers for their support.,2.1K,48,250,https://twitter.com/sundarpichai/status/1263193094410760192
@sundarpichai,The,5.2K,130,902,https://twitter.com/sundarpichai/status/1263152555036532737
@sundarpichai,We’re rolling out new tools + redesigned privacy & security settings in,2.1K,79,398,https://twitter.com/sundarpichai/status/1262789524817457152
@sundarpichai,Thanks,1K,24,79,https://twitter.com/sundarpichai/status/1262786483468955650
@sundarpichai,"We've re-engineered Google Meet to make secure video meetings free for everyone, with helpful features powered by",5.7K,355,1.4K,https://twitter.com/sundarpichai/status/1260253803636330496
@sundarpichai,"We're launching some new features in Google Lens to help you be even more productive, including copying written text to send straight to your computer.",1.8K,70,406,https://twitter.com/sundarpichai/status/1258495772879810560
@sundarpichai,: looking forward to celebrating you and your achievements on June 6th!,1.9K,50,367,https://twitter.com/sundarpichai/status/1257763748057513985
@sundarpichai,Thank you to teachers everywhere working tirelessly to support their students in these tough times & always. This,2K,73,333,https://twitter.com/sundarpichai/status/1257302367344537603
@sundarpichai,We’ve been carbon neutral since 2007 & matched our electricity usage w/ 100% renewable energy since 2017. A new carbon-intelligent computing platform in our data centers now shifts tasks to times of day when cleaner energy sources are plentiful.,3.9K,139,705,https://twitter.com/sundarpichai/status/1252946372904382464
@sundarpichai,Seeing how people are coming together to solve big challenges is what gives me hope for future generations. Thank you,1.3K,70,160,https://twitter.com/sundarpichai/status/1250894586391613440
@sundarpichai,Really moving to read,1.1K,44,176,https://twitter.com/sundarpichai/status/1245949767877660672
@sundarpichai,Proud to work with,4.5K,223,651,https://twitter.com/sundarpichai/status/1245436573946019840
@sundarpichai,Proud we're partnering with,1K,50,239,https://twitter.com/sundarpichai/status/1245071579584671746
@sundarpichai,To help those working to combat,2.3K,80,903,https://twitter.com/sundarpichai/status/1244656614419755013
@sundarpichai,As the world continues to battle the,4.6K,121,1.1K,https://twitter.com/sundarpichai/status/1244520204048072706
@sundarpichai,We’re committing $800M+ in new,7.9K,420,2.5K,https://twitter.com/sundarpichai/status/1243583928532754432
@sundarpichai,As the world continues to battle the,4.6K,121,1.1K,https://twitter.com/sundarpichai/status/1244520204048072706
@sundarpichai,You can now find YouTube learning resources and content for families at our new Learn@Home hub,1.6K,54,466,https://twitter.com/sundarpichai/status/1242248426378559488
@sundarpichai,Happy to help support this great content being made available to kids everywhere,711,20,98,https://twitter.com/sundarpichai/status/1242215500626587648
@sundarpichai,We’re partnering w/ the federal govt + other leaders in technology & academia to provide,3.3K,72,699,https://twitter.com/sundarpichai/status/1242189828319399936
@sundarpichai,"The Teach from Home hub is now available in English, plus downloadable toolkits in 7 other languages with more coming soon.",935,30,248,https://twitter.com/sundarpichai/status/1241072257029439488
@sundarpichai,"We're launching a Transcribe feature in Google Translate that can convert speech into another language as it’s happening. Starting in 8 languages, rolling out to Android today, more to come soon.",6.3K,219,1.6K,https://twitter.com/sundarpichai/status/1239992121840427009
@sundarpichai,"Contributing to social distancing if you are able to, helps the overall community spread and most importantly, will help offset the peak loads through critical healthcare systems and also saves it for people in need. (based on expert advice). Please contribute if you are able to",1.9K,64,437,https://twitter.com/sundarpichai/status/1237499299589582848
@sundarpichai,Excited for a great game at,2.4K,65,273,https://twitter.com/sundarpichai/status/1236520567743774720
@sundarpichai,"The @DeepMind team is sharing predictions of some protein structures associated with the virus that causes COVID-19, generated by the latest AlphaFold system. We hope this will help researchers around the world in their current efforts.",2.9K,57,810,https://twitter.com/sundarpichai/status/1235672334658240512
@sundarpichai,"We want to help businesses and schools impacted by COVID-19 stay connected: starting this week, we'll roll out free access to our advanced Hangouts Meet video-conferencing capabilities through July 1, 2020 to all G Suite customers globally.",13K,245,4.2K,https://twitter.com/sundarpichai/status/1234887183896461313
@sundarpichai,"Today I’m pleased to announce that Google will invest more than $10 billion in offices and data centers across the U.S in 2020, creating more opportunities in communities from Massachusetts to Texas.",4.2K,204,609,https://twitter.com/sundarpichai/status/1232667712515559425
@sundarpichai,"RIP Katherine Johnson, inspiring mathematician, leader and trailblazer.",3.9K,58,396,https://twitter.com/sundarpichai/status/1231996865048006659
@sundarpichai,A big welcome to the winning teams of our,3.3K,118,338,https://twitter.com/sundarpichai/status/1228160697202135040
@sundarpichai,축하합니다 Bong Joon-ho and the cast of,5.4K,71,663,https://twitter.com/sundarpichai/status/1226724457529528320
@sundarpichai,"We’re proud to invest in products & partnerships that help people in Europe succeed. Our new economic impact report estimates that Google’s tools created €177B in economic activity for businesses, developers, creators & publishers across Europe in 2019.",1.2K,72,138,https://twitter.com/sundarpichai/status/1225691492431187969
@sundarpichai,Visited,2.2K,79,239,https://twitter.com/sundarpichai/status/1219239237343571970
@sundarpichai,"""At the center of nonviolence stands the principle of love."" Today we honor the life and legacy of Dr. Martin Luther King, Jr.",2K,56,228,https://twitter.com/sundarpichai/status/1219207973370658816
@sundarpichai,Great to see the bipartisan support & leadership across government to pass the,879,48,87,https://twitter.com/sundarpichai/status/1217915527961563137
@sundarpichai,500K+ job openings in the US require proficiency in Python: our new,5K,161,1.2K,https://twitter.com/sundarpichai/status/1217854359641280512
@sundarpichai,"The Advanced Protection Program is our strongest level of security for Google Accounts. Today, we’re simplifying the enrollment process for everyone, and enabling iPhones in addition to Android phones to be used as security keys.",2.7K,104,582,https://twitter.com/sundarpichai/status/1217471308511862785
@sundarpichai,Nice recap from,896,31,80,https://twitter.com/sundarpichai/status/1215382000019787776
@sundarpichai,"Devastating to see the catastrophic bushfires in Australia - we’ve been working with emergency services to provide SOS alerts & info on our crisis map, and",2.3K,98,378,https://twitter.com/sundarpichai/status/1214300690903748608
@sundarpichai,Looking forward to a new year and a new decade ahead - wishing everyone a very happy 2020,9.4K,513,684,https://twitter.com/sundarpichai/status/1212239098875789313
@sundarpichai,"This year, searches for heroes — both superheroes and everyday heroes — soared around the world. Thank you to all of the heroes who inspired us to go further and dream bigger in 2019.",22K,860,11K,https://twitter.com/sundarpichai/status/1204676617731051520
@sundarpichai,This week at our,1.3K,82,168,https://twitter.com/sundarpichai/status/1204607619937161217
@sundarpichai,Greetings from Tokyo! Celebrating the opening of our new office in Shibuya with a traditional sake barrel breaking ceremony,7.1K,147,555,https://twitter.com/sundarpichai/status/1196411288450146304
@sundarpichai,US Army veteran Pete Damon is the guest artist behind today's,2K,63,162,https://twitter.com/sundarpichai/status/1193908277920141317
