UserId,Tweets,Likes,Comments,Retweets,Tweet_Url
@sundarpichai,"New features on Search and Lens to help learners get a deeper understanding of math and science topics on Search, including step-by-step explanations and solutions for math problems, help with physics word problems + new 3D models of science topics.",1.3K,72,206,https://twitter.com/sundarpichai/status/1719464988119613930
@sundarpichai,Today we’re building on our commitment to safe + secure AI with the first bug bounty program specific to generative AI. We’re also expanding our open source security work to make info about AI supply chain security universally discoverable and verifiable.,684,81,121,https://twitter.com/sundarpichai/status/1717691479991410986
@sundarpichai,AI is making it easier to explore and navigate with,1.1K,51,156,https://twitter.com/sundarpichai/status/1717682000428220519
@sundarpichai,Important to call out and stand against antisemitism at this terrible moment. It’s never acceptable. Proud to sign this commitment to raise awareness and condemn this historic evil.,5.1K,702,977,https://twitter.com/sundarpichai/status/1712287474242982008
@sundarpichai,"Deeply saddened by the terrorist attacks in Israel this weekend and the escalating conflict underway. Google has 2 offices and over 2,000 employees in Israel. It’s unimaginable what they’re experiencing. Our immediate focus since Saturday has been on employee safety. We’ve now…",12K,402,1.5K,https://twitter.com/sundarpichai/status/1711814868985413907
@sundarpichai,"We’re also rolling out Android 14 this week, starting on Pixel. Big focus was on improving performance + efficiency of the platform, along with more customization options and accessibility features. The team made me this bugdroid to celebrate:)",2.1K,124,277,https://twitter.com/sundarpichai/status/1710037625346609418
@sundarpichai,"So excited to see Pixel 8, Pixel 8 Pro, Pixel Buds Pro, Pixel Watch 2 + our new G3 Tensor unveiled at",7.4K,367,848,https://twitter.com/sundarpichai/status/1709587317248217388
@sundarpichai,"More news today from Chromebooks: we’re introducing Chromebook Plus! This new category of Chromebooks has 2x the processing power, along with AI-powered tools, a 1080p camera, Adobe Photoshop + more. Biggest change we’ve made to Chromebooks yet.",2.2K,135,311,https://twitter.com/sundarpichai/status/1708971042318713174
@sundarpichai,We’re partnering with HP to manufacture Chromebooks in India - These are the first Chromebooks to be made in India and will make it easier for Indian students to have access to affordable and secure computing.,22K,540,3.3K,https://twitter.com/sundarpichai/status/1708675924584222736
@sundarpichai,Sending condolences to Sen. Feinstein’s family and all those mourning her passing. She was an incredible leader and trailblazer and we thank her for her decades of service to California.,920,60,49,https://twitter.com/sundarpichai/status/1707891578076086519
@sundarpichai,Happy 25th birthday,39K,1.4K,4.7K,https://twitter.com/sundarpichai/status/1706889998040211599
@sundarpichai,"Bem Vinda, Nuvem! We’re collaborating on a new transatlantic subsea cable Nuvem, which means ""cloud"" in Portuguese. It will connect Portugal, Bermuda, and the US, helping to provide digital services and new opportunities for local economies.",974,88,138,https://twitter.com/sundarpichai/status/1706422871910985993
@sundarpichai,"Unbearably sad to lose Luiz. He was behind so many of Google’s technical achievements, writing the book on our data centers, leading the design of our computing infrastructure, and so much more. He was at the top of his field, earning ACM’s highest honor in computer architecture.…",5.5K,192,461,https://twitter.com/sundarpichai/status/1705068406901231913
@sundarpichai,At,1.3K,97,216,https://twitter.com/sundarpichai/status/1696580607273238886
@sundarpichai,What an incredible moment! Congratulations to,124K,1K,14K,https://twitter.com/sundarpichai/status/1694399109468246352
@sundarpichai,"Hallo Germany! The Google Cloud region in Berlin-Brandenburg is now ready for customers. It's our second region in Germany, and is part of our commitment to invest 1 billion euros in Germany’s digital infrastructure and clean energy between 2021 and 2030.",1.3K,75,168,https://twitter.com/sundarpichai/status/1694019497068294356
@sundarpichai,What a great,3.1K,98,150,https://twitter.com/sundarpichai/status/1693318398610997729
@sundarpichai,"New updates to our Search Generative Experience include definitions with related images to help explain complex topics, more coding capabilities, and a new experiment that helps you find what you're looking for in a long article more easily.",2.3K,195,440,https://twitter.com/sundarpichai/status/1691496643441336324
@sundarpichai,Excited that RCS messages on,2K,125,299,https://twitter.com/sundarpichai/status/1689112056920723457
@sundarpichai,"Spent time with the Google DeepMind team in London this week, including the people working on our next generation models. Great to see the exciting progress and talk to",3.5K,206,261,https://twitter.com/sundarpichai/status/1684708875394547713
@sundarpichai,Great to join students + policy leaders in DC to announce funding for cybersecurity clinics across the US. These clinics give students hands-on experience in cybersecurity by providing free services to protect critical infrastructure in their communities.,1.8K,151,193,https://twitter.com/sundarpichai/status/1671951616784695321
@sundarpichai,"Over the last 18 months,",829,95,117,https://twitter.com/sundarpichai/status/1671242535627522048
@sundarpichai,Great progress with,1K,101,100,https://twitter.com/sundarpichai/status/1666584802638823424
@sundarpichai,"We’re updating Bard with a new technique called implicit code execution. Now it runs code in the background when it detects computational prompts, improving the accuracy of word and math problems by ~30%.",9.3K,445,1.3K,https://twitter.com/sundarpichai/status/1666498242740387840
@sundarpichai,Exciting to see how,1.4K,91,216,https://twitter.com/sundarpichai/status/1666482278019596288
@sundarpichai,Thanks,1.1K,96,127,https://twitter.com/sundarpichai/status/1657114281480167424
@sundarpichai,"5/ To enable businesses + developers to innovate with AI,",364,9,41,https://twitter.com/sundarpichai/status/1656395426541764609
@sundarpichai,Excited that,1.2K,59,210,https://twitter.com/sundarpichai/status/1656047001287680000
@sundarpichai,"We've started rolling out support for passkeys that let users sign in to our products with a fingerprint, a face scan or a screen lock PIN. Starting today, this will be available as an option for Google Account users.",5.7K,313,1.1K,https://twitter.com/sundarpichai/status/1653793204230303750
@sundarpichai,"Our 2022 Economic Impact Report published today shows our products & platforms helped provide $700B+ in economic activity for millions of American businesses, creators, developers & nonprofits last year, and the",1.1K,128,128,https://twitter.com/sundarpichai/status/1648682537693368322
@sundarpichai,Great to have,4.1K,1.2K,497,https://twitter.com/sundarpichai/status/1647816553415712768
@sundarpichai,Happy Easter to everyone celebrating! Hope the day is bright and joyful and that you can spend it with friends and family.,2.6K,199,150,https://twitter.com/sundarpichai/status/1645086283302313992
@sundarpichai,"WebGPU in Chromium 113, excited for the web and great to see this ship to stable!",1.5K,86,188,https://twitter.com/sundarpichai/status/1644202661808582659
@sundarpichai,Chag Sameach! Wishing everyone celebrating Passover a holiday full of good company and delicious food.,1.3K,111,65,https://twitter.com/sundarpichai/status/1643767860215554048
@sundarpichai,Thanks,927,123,96,https://twitter.com/sundarpichai/status/1641845353736724481
@sundarpichai,So excited to be supporting Replit and developers!,2.6K,201,288,https://twitter.com/sundarpichai/status/1640758051258138625
@sundarpichai,"RIP Gordon Moore. His vision inspired so many of us to pursue technology, was an inspiration to me. Thoughts with his family and everyone at Intel",5K,149,464,https://twitter.com/sundarpichai/status/1639449516838637568
@sundarpichai,Ramadan Mubarak! Wishing everyone who is observing a peaceful holiday and an easy fast.,5.7K,239,505,https://twitter.com/sundarpichai/status/1638722549491335169
@sundarpichai,It's impossible to express in one tweet all that,7.7K,226,319,https://twitter.com/sundarpichai/status/1626297421197373440
@sundarpichai,"5/ Developers can soon try our Generative Language API, initially powered by LaMDA with a range of models to follow. Over time, our goal is to create a set of tools and APIs that will make it easy for others to build more innovative applications with AI.",2K,106,209,https://twitter.com/sundarpichai/status/1622674686814601217
@sundarpichai,"Thinking of everyone in Türkiye and Syria who are experiencing devastating loss after the earthquakes. We've activated SOS alerts to provide relevant emergency information to those impacted, and",7.3K,138,593,https://twitter.com/sundarpichai/status/1622648907909189632
@sundarpichai,Proud that,1.7K,109,214,https://twitter.com/sundarpichai/status/1621618140240310273
@sundarpichai,Inspiring to see that 1M+ researchers have used @DeepMind,1.5K,114,179,https://twitter.com/sundarpichai/status/1620872748749950976
@sundarpichai,Summary of great research progress on,7.1K,891,1.3K,https://twitter.com/sundarpichai/status/1615820298305118221
@sundarpichai,Many thanks to guest artist and Marine Corps veteran Monty Little for today's Veterans Day,1.3K,1.1K,98,https://twitter.com/sundarpichai/status/1590981805028839424
@sundarpichai,Amazing momentum for,3.8K,397,303,https://twitter.com/sundarpichai/status/1590429455230828544
@sundarpichai,"We're building an AI model that supports the 1,000 most-spoken languages, a big step in making knowledge more accessible. Already we've developed a model trained on 400+ languages, the most covered by any speech model to date.",3.2K,552,414,https://twitter.com/sundarpichai/status/1587960107802894336
@sundarpichai,"3/ Using new advances in AI, we're bringing flood alert coverage to 18 more countries. And we're announcing Google FloodHub, a new platform that brings flood alerts to the general public, not just those in flood prone areas. More on these efforts:",1.2K,64,120,https://twitter.com/sundarpichai/status/1587873937290973185
@sundarpichai,We're rolling out Primetime Channels on,3.1K,229,306,https://twitter.com/sundarpichai/status/1587490009027747841
@sundarpichai,We're launching a new,4K,600,382,https://twitter.com/sundarpichai/status/1585298199430189057
@sundarpichai,"The alert came just before, felt like a long one, hope everyone is ok",55K,847,2.1K,https://twitter.com/sundarpichai/status/1584985092698800128
@sundarpichai,Really enjoyed being back in,2.9K,130,157,https://twitter.com/sundarpichai/status/1579614185646088192
@sundarpichai,Really excited about the future of,1K,90,117,https://twitter.com/sundarpichai/status/1579880132818264083
@sundarpichai,We announced our first,1.3K,138,203,https://twitter.com/sundarpichai/status/1578271716157009920
@sundarpichai,Two important breakthroughs from,0:04,https://,0:01 / 0:05,https://twitter.com/sundarpichai/status/1578162216335179778
@sundarpichai,And adding a link to Phenaki as well,480,41,38,https://twitter.com/sundarpichai/status/1578234460122001408
@sundarpichai,Big congrats to @DeepMind on their,2K,74,254,https://twitter.com/sundarpichai/status/1578179981347201024
@sundarpichai,"Excited to launch Pixel 7 and Pixel 7 Pro with our next generation Google Tensor G2 chip, which brings state-of-the-art",8.5K,403,813,https://twitter.com/sundarpichai/status/1578039662211653632
@sundarpichai,"Hurricane Ian continues to devastate communities in the Southeast US. Grateful to the first responders who are helping. We've activated SOS alerts to provide emergency information, and Google + our employees are supporting relief efforts.",2.4K,148,119,https://twitter.com/sundarpichai/status/1575568543843696640
@sundarpichai,"Just an amazing sporting moment, thanks",66K,634,5K,https://twitter.com/sundarpichai/status/1573499105694740480
@sundarpichai,Excited to opensource TensorStore - hope it further accelerates scientific research,2.8K,87,334,https://twitter.com/sundarpichai/status/1573475910186979328
@sundarpichai,"This week, we shared how we're partnering with the",548,90,48,https://twitter.com/sundarpichai/status/1573426250101948416
@sundarpichai,"To continue helping Ukrainians impacted by the war, we're launching Google Career Certificates in Ukraine and offering free scholarships + support services. Plus, an update on our work with",1.1K,296,112,https://twitter.com/sundarpichai/status/1573051021898571776
@sundarpichai,Congrats to Demis and John on this huge honor. Great to see,1.3K,95,107,https://twitter.com/sundarpichai/status/1572991327410655232
@sundarpichai,Many thanks to the,1.3K,422,134,https://twitter.com/sundarpichai/status/1572247858060853253
@sundarpichai,Excited to partner with,2.6K,748,349,https://twitter.com/sundarpichai/status/1569737428197588995
@sundarpichai,Sending our deepest condolences to the people of the UK and around the world mourning the passing of Queen Elizabeth II. Her steadfast leadership and public service have been a constant through many of our lifetimes. She will be missed.,6.7K,864,354,https://twitter.com/sundarpichai/status/1567959901195886595
@sundarpichai,New,5K,415,649,https://twitter.com/sundarpichai/status/1567582643642068992
@sundarpichai,As we shared at,992,1.7K,115,https://twitter.com/sundarpichai/status/1562904117843922944
@sundarpichai,"Proud to celebrate 15 years in Singapore! We've grown from a few dozen to 3,000+ Googlers, and continue to invest in Cloud, AI, digital skills training, online safety education, sustainability + more.",2.4K,371,198,https://twitter.com/sundarpichai/status/1561933993020313603
@sundarpichai,"One year after open-sourcing its AlphaFold Protein Structure Database, @DeepMind and",2.5K,167,398,https://twitter.com/sundarpichai/status/1552617696335761408
@sundarpichai,Sharing a few,1.8K,129,186,https://twitter.com/sundarpichai/status/1552493574939234305
@sundarpichai,Lots of new features rolling out on Chromebooks including video editing tools in,1.1K,81,110,https://twitter.com/sundarpichai/status/1552462080296423424
@sundarpichai,Great new partnership with,2.1K,264,267,https://twitter.com/sundarpichai/status/1549501266883096576
@sundarpichai,Excited to launch a Quantum Virtual Machine which emulates the experience and results of programming one of our quantum computers. It will make it easier for researchers to prototype new algorithms and help students learn how to program a quantum computer.,2.6K,93,501,https://twitter.com/sundarpichai/status/1549448858282774528
@sundarpichai,Exciting milestone for,1.4K,171,135,https://twitter.com/sundarpichai/status/1548165018843131906
@sundarpichai,I've seen firsthand how computer science education can help kids build the skills they'll need for the future. Happy to join in support for computer science to be in every K-12 classroom across the country.,1.3K,94,158,https://twitter.com/sundarpichai/status/1546912946860609536
@sundarpichai,Stunning image and an incredible moment for science and humanity. Can't wait to see more tomorrow:),3.6K,119,283,https://twitter.com/sundarpichai/status/1546635593685164033
@sundarpichai,Excited we're partnering with,2.2K,82,259,https://twitter.com/sundarpichai/status/1534670676778311680
@sundarpichai,"We're sharing more helpful improvements on Pixel, including easier access to vaccine cards, at-a-glance air quality alerts, more translation options in chat, and better audio quality in Meet. Plus the ability to make your own music and video cut-ups:)",1.5K,220,113,https://twitter.com/sundarpichai/status/1533928451882700800
@sundarpichai,Exciting to see,971,289,132,https://twitter.com/sundarpichai/status/1531643845791711232
@sundarpichai,"While in Warsaw, Poland in March, I announced our Ukraine Support Fund to help Ukrainian entrepreneurs maintain and grow their businesses in a time of war. Today we're welcoming the 1st recipients who will receive financing + mentoring from",1.2K,174,120,https://twitter.com/sundarpichai/status/1531533504562929664
@sundarpichai,"Thousands of schools in Ukraine have been forced to close due to the war. To help, we're working with",2.6K,305,383,https://twitter.com/sundarpichai/status/1528995629686747136
@sundarpichai,"We're introducing new accessibility tools like alt-text for images in Gmail and Multi-pin on Google Meet. Also expanding our Project Euphonia research, which helps people with speech impairments be better understood, to French, Hindi, Japanese and Spanish.",1.3K,203,174,https://twitter.com/sundarpichai/status/1527406822499688448
@sundarpichai,So much fun to meet,5.4K,241,259,https://twitter.com/sundarpichai/status/1525329430406520833
@sundarpichai,Always fun to go super deep on our products on The Vergecast. Chatted with,1.7K,122,129,https://twitter.com/sundarpichai/status/1525264223843909632
@sundarpichai,It was so great to be back on Stanford campus:) Thank you Archana Sohmshetty and,1.4K,194,123,https://twitter.com/sundarpichai/status/1519538796303319040
@sundarpichai,Proud to welcome Tánaiste,2.2K,97,169,https://twitter.com/sundarpichai/status/1519505511267246081
@sundarpichai,"Proud of the progress we've made to help build a carbon-free future, including supporting our partners as they address climate change and building products that make it easier for people to make sustainable choices.",1.3K,165,152,https://twitter.com/sundarpichai/status/1517402386741964800
@sundarpichai,"Excited to open our first product development center in Africa later this year. We're hiring engineers, product managers, UX designers and researchers in Nairobi who want to build helpful products and services for people in Africa and around the world.",5.1K,271,2.1K,https://twitter.com/sundarpichai/status/1516425703427825667
@sundarpichai,"Happy Easter to all who celebrate around the world. Wishing you a day full of joy, gratitude and renewal - hope you're able to share it with those you love.",6.9K,205,324,https://twitter.com/sundarpichai/status/1515651302075744262
@sundarpichai,"Chag Sameach to everyone observing Passover! I hope you'll enjoy the comforts of food, tradition, and community as you celebrate.",2.4K,110,118,https://twitter.com/sundarpichai/status/1515105119829864451
@sundarpichai,"We're announcing plans to invest ~$9.5B in communities across the US and create 12K+ new jobs at Google in 2022. This builds on the hundreds of billions in economic activity Google helped provide last year for US businesses, creators, nonprofits and more.",2.2K,181,298,https://twitter.com/sundarpichai/status/1514229224755716096
@sundarpichai,Proud to co-chair a new,1K,98,98,https://twitter.com/sundarpichai/status/1513865406510817284
@sundarpichai,"As the number and severity of cybersecurity challenges increase, we look forward to welcoming",1.2K,162,199,https://twitter.com/sundarpichai/status/1501160312715694081
@sundarpichai,Happy International Women's Day! Our animated,1.7K,104,235,https://twitter.com/sundarpichai/status/1501108871577755648
@sundarpichai,"Reducing food waste is an important way we can limit carbon emissions and keep our planet healthy. We're pledging to cut Google's food waste in half, and send zero food waste to landfill by 2025.",1.9K,90,266,https://twitter.com/sundarpichai/status/1501062381417349121
@sundarpichai,With our latest version of,1.5K,83,205,https://twitter.com/sundarpichai/status/1501047366740164610
@sundarpichai,Proud to reaffirm our commitment to Central & Eastern Europe by investing ~$700M into the growth of our Warsaw office. We're also opening our spaces to support Ukrainian refugees in Poland and providing $10M to orgs delivering humanitarian aid there.,3K,99,293,https://twitter.com/sundarpichai/status/1500979586267418625
@sundarpichai,"As the war and humanitarian crisis in Ukraine escalates, we're taking more actions to help: SOS alerts, protecting users from cyber attacks, disrupting disinfo campaigns + more. We're also providing $15M in donations and in-kind support for relief efforts.",5.6K,502,758,https://twitter.com/sundarpichai/status/1498712628071321601
@sundarpichai,"Finally saw the psg-real highlights, that Mbappe finish at the end!!",4K,192,186,https://twitter.com/sundarpichai/status/1493842654735466497
@sundarpichai,New helpful AI-powered features coming to smart canvas in,861,86,114,https://twitter.com/sundarpichai/status/1493685073744326670
@sundarpichai,"Excited about Chrome OS Flex, a new version designed to run on old PCs and Macs to bring the same speed, security and simplicity of Chrome OS to existing hardware. Early access for now, but look forward to seeing feedback!",1.8K,103,302,https://twitter.com/sundarpichai/status/1493654845579882497
@sundarpichai,"Over the last 5 years, Googlers and",1.4K,92,111,https://twitter.com/sundarpichai/status/1488876612787474436
@sundarpichai,"Happy Year of the Tiger - wishing everyone good health, strength, and happiness! (And check out ""Lunar New Year"" on Google Search for a festive surprise:)",4K,162,339,https://twitter.com/sundarpichai/status/1488381239321006082
@sundarpichai,Technology can be a powerful enabler for opportunity at every age. That’s why we're proud to support,1.2K,174,128,https://twitter.com/sundarpichai/status/1486345007481044995
@sundarpichai,"In June 2020 we pledged to help 10 million people and businesses in Europe, the Middle East and Africa find jobs, digitize & grow by the end of 2021. Excited to announce that we surpassed our goal, thanks to our many partners along the way!",1.3K,93,117,https://twitter.com/sundarpichai/status/1486280693189472256
@sundarpichai,Exciting to see all the recent momentum,2K,115,128,https://twitter.com/sundarpichai/status/1486072399262932992
@sundarpichai,We can learn a lot about our environment just by listening to the birds. New,1.6K,115,191,https://twitter.com/sundarpichai/status/1485694110769897477
@sundarpichai,Thank you to guest artist Olivia Fields for today's,1.4K,187,124,https://twitter.com/sundarpichai/status/1483121516384456707
@sundarpichai,"As part of our commitment to the UK’s growth & success, we're excited to purchase our Central Saint Giles office in London and invest in creating a more flexible future workplace. Looking forward to having space for 10,000 Googlers across our UK sites!",2.1K,206,230,https://twitter.com/sundarpichai/status/1481869551054692352
@sundarpichai,Today we're sharing research from,1.3K,73,194,https://twitter.com/sundarpichai/status/1481764183217618945
@sundarpichai,Securing the open source software ecosystem is a critical step in keeping people and their information safe online. Glad we could share recommendations with the,968,67,136,https://twitter.com/sundarpichai/status/1481716953525809153
@sundarpichai,Wishing you the very best ahead,24K,300,1.4K,https://twitter.com/sundarpichai/status/1465380836983726080
@sundarpichai,Happy Hanukkah to everyone who is celebrating! Search for “Hanukkah” on Google for a virtual celebration:),1.4K,232,108,https://twitter.com/sundarpichai/status/1465100457563414528
@sundarpichai,"What a legacy, one of my favorites to watch ever!",71K,912,6.5K,https://twitter.com/sundarpichai/status/1461603223333076992
@sundarpichai,At,2.1K,540,224,https://twitter.com/sundarpichai/status/1461214788638285829
@sundarpichai,"To celebrate the heritage and history of Indigenous communities across the Americas, we're partnering with 40+ cultural institutions to bring stories of Indigenous art and culture to a new",1K,102,94,https://twitter.com/sundarpichai/status/1461103836358230016
@sundarpichai,Great to sit down (in person!) with,600,57,56,https://twitter.com/sundarpichai/status/1461072106221830146
@sundarpichai,"Proud to announce the Digital Future Initiative in Australia - a A$1B commitment in infrastructure, research, and partnerships to help more Australians access the benefits of technology & lead the next wave of global innovations.",1.2K,221,176,https://twitter.com/sundarpichai/status/1460383837913956353
@sundarpichai,Thank you to our guest artist & Army veteran Steven Tette for today's,1.3K,160,115,https://twitter.com/sundarpichai/status/1458814674867081216
@sundarpichai,Great to sit down (in person!) with,600,57,56,https://twitter.com/sundarpichai/status/1461072106221830146
@sundarpichai,Big congrats to the recipients of our,1.8K,185,177,https://twitter.com/sundarpichai/status/1457738501156311042
@sundarpichai,Happy Diwali to everyone celebrating the festival of lights! (Look for the,11K,513,885,https://twitter.com/sundarpichai/status/1456127065871110145
@sundarpichai,Proud to partner with,945,91,93,https://twitter.com/sundarpichai/status/1455945516672434184
@sundarpichai,"In 2019 we committed to making Google Career Certificates available in 100+ community colleges to help students grow their careers. Starting today, the Google Career Certificates program will be free for all community colleges to add to their curriculum",1.3K,150,205,https://twitter.com/sundarpichai/status/1454185182899019781
@sundarpichai,"Our new Bay View campus will run on 90% carbon-free energy, with a mix of solar, wind, and geothermal. This is part of our moonshot to run 24/7 carbon-free by 2030. Thanks",2.1K,85,169,https://twitter.com/sundarpichai/status/1450216137560498176
@sundarpichai,"As world leaders, industry, and civil society come together for the Malmö Int’l Forum on Holocaust Remembrance and Combating Antisemitism, we join in support with commitments to combat antisemitism online and raise authoritative info across our products.",896,88,103,https://twitter.com/sundarpichai/status/1448313250391609347
