UserId,Tweets,Likes,Comments,Retweets,Tweet_Url
@sundarpichai,We're proud to support accessible & inclusive housing as part of our commitment to Bay Area housing: we're making a $5.3M investment in,1.2K,68,115,https://twitter.com/sundarpichai/status/1189189205085188096
@sundarpichai,"Since 2001, we’ve been proud to be a part of Atlanta’s growing tech sector. Today we’re excited to break ground on a bigger office, and to announce a $1M Impact Challenge for Georgia to support orgs working to create opportunity for people across the state",1.5K,60,169,https://twitter.com/sundarpichai/status/1188856653153570816
@sundarpichai,"In honor of First Responders Day, we salute all of the first responders who help others in need every day. Especially thankful today for the firefighters risking their lives battling the wildfires across California to keep us all safe.",2.8K,56,276,https://twitter.com/sundarpichai/status/1188668602699767809
@sundarpichai,Don's impact on the beginnings of Silicon Valley and the entire tech industry will not be soon forgotten. Thoughts are with his family and the entire Sequoia team. May he rest in peace.,1.2K,66,117,https://twitter.com/sundarpichai/status/1187862151991455745
@sundarpichai,Thanks,1.1K,45,139,https://twitter.com/sundarpichai/status/1187019315507130368
@sundarpichai,"Excited about what quantum computing means for the future - it gives us another way to speak the language of the universe and better understand the world, not just in 1s and 0s but in all of its states: beautiful, complex, and with limitless possibility.",4.7K,122,1.4K,https://twitter.com/sundarpichai/status/1186931593815846912
@sundarpichai,Very proud that our,5K,124,1.5K,https://twitter.com/sundarpichai/status/1186927307631411207
@sundarpichai,Very inspiring to see the historic,1.9K,53,178,https://twitter.com/sundarpichai/status/1185269011182804994
@sundarpichai,Very excited to introduce our latest family of,4.8K,343,750,https://twitter.com/sundarpichai/status/1184129106843033603
@sundarpichai,Today we’re kicking off our 3rd,1.5K,96,164,https://twitter.com/sundarpichai/status/1181247609379282944
@sundarpichai,Building on the privacy & security features discussed at,1.7K,84,266,https://twitter.com/sundarpichai/status/1179467784524308485
@sundarpichai,Heartbreaking to see the devastation that,1.6K,36,137,https://twitter.com/sundarpichai/status/1171168686490546176
@sundarpichai,"In April, we open-sourced MLIR, which enables machine learning models to be consistently represented & executed on hardware. Today we’re contributing the project to the LLVM Foundation to further help the standardization & advancement of ML globally.",3.7K,90,669,https://twitter.com/sundarpichai/status/1171108352077623296
@sundarpichai,"Excited to see the first Chromebook Enterprise devices on sale today, built in partnership with",3.4K,157,495,https://twitter.com/sundarpichai/status/1166388216691220480
@sundarpichai,"Starting today, our lightweight search app",3.1K,179,606,https://twitter.com/sundarpichai/status/1163846171690803200
@sundarpichai,Inspiring to see such a breakthrough. +1 to research and science!,3K,111,408,https://twitter.com/sundarpichai/status/1162075579652300801
@sundarpichai,Proud that,1.5K,171,161,https://twitter.com/sundarpichai/status/1153700528896917505
@sundarpichai,Also had a fun afternoon with 4H’ers,2.8K,81,184,https://twitter.com/sundarpichai/status/1139674783153455104
@sundarpichai,Amazing day in Oklahoma yesterday where we announced the expansion of our data center in Mayes County and our,1.7K,41,117,https://twitter.com/sundarpichai/status/1139669084973326336
@sundarpichai,"This morning in Oklahoma, we announced a $600 million investment to expand our data center in Pryor and a $6M grant to",4.5K,209,519,https://twitter.com/sundarpichai/status/1139221388806500353
@sundarpichai,At,3K,187,606,https://twitter.com/sundarpichai/status/1130490994745585665
@sundarpichai,"This Global Accessibility Awareness Day, we're announcing updates to Live Transcribe, a tool that provides real-time transcriptions on Android. It'll soon show sound events - like a knock on the door - and enable transcripts to be saved on device.",1.6K,93,312,https://twitter.com/sundarpichai/status/1129072404020506626
@sundarpichai,"In 2018, our search and advertising tools helped generate $335 billion in economic activity for millions of US businesses, nonprofits & publishers. We’re proud to support local businesses across the country to use the power of the web to grow and thrive.",1.7K,80,245,https://twitter.com/sundarpichai/status/1127933381147222018
@sundarpichai,is a wrap and a big thanks to all who joined us in person and online! Was so glad I got to meet some of you at Shoreline - I’m inspired by your stories and can’t wait to see what you build next:),4K,85,347,https://twitter.com/sundarpichai/status/1126665655598632960
@sundarpichai,"has now helped train 10M people in digital skills across Europe, Middle East & Africa since 2017. It's a great milestone and we will continue our work helping people learn new digital skills, find jobs and grow their businesses.",1.5K,50,208,https://twitter.com/sundarpichai/status/1126518236663697408
@sundarpichai,"coming to NYC: for the next five months, our new classroom space in Chelsea will be open for anyone to learn digital skills to find jobs, advance their career, and grow their business",1.3K,53,192,https://twitter.com/sundarpichai/status/1115305499140866050
@sundarpichai,"Gmail turns 15 today, no joke:) Thank you to our 1.5B+ users around the world for all of your support!",10K,366,1.5K,https://twitter.com/sundarpichai/status/1112732084794060801
@sundarpichai,"Congrats to Geoff Hinton, Yoshua Bengio & Yann LeCun on winning this year's Turing Award. Their groundbreaking work on deep neural networks has transformed not just computing and AI, but nearly every other scientific field today",3K,72,585,https://twitter.com/sundarpichai/status/1110894725358182400
@sundarpichai,This morning at,4.5K,178,959,https://twitter.com/sundarpichai/status/1108074296058929152
@sundarpichai,"The new Lookout app helps blind or visually impaired people by verbally describing the words, objects, people, etc that are around them. Very proud to see our",2.7K,111,579,https://twitter.com/sundarpichai/status/1105875629474377728
@sundarpichai,"At I/O last year, gave an update on our",2.4K,64,440,https://twitter.com/sundarpichai/status/1105141950804484096
@sundarpichai,"Earlier this week, we launched",5.5K,172,789,https://twitter.com/sundarpichai/status/1103985641702883328
@sundarpichai,In Mumbai today and happy to celebrate,3.8K,70,352,https://twitter.com/sundarpichai/status/1103945008648867840
@sundarpichai,"TensorFlow Privacy, using techniques based on  differential privacy, will make it easier for developers to train ML models with privacy and better protect users' data in their AI development.",1.5K,51,282,https://twitter.com/sundarpichai/status/1103387226686345217
@sundarpichai,Glad the transmission was received:) See you at Shoreline Amphitheatre May 7-9 for this year's I/O!,6K,201,1.2K,https://twitter.com/sundarpichai/status/1088935342382534656
@sundarpichai,Thrilled to celebrate the opening of our new,3.3K,84,261,https://twitter.com/sundarpichai/status/1087856611371114496
@sundarpichai,So happy to be back in Germany! First stop was a chat with the students,4.7K,89,309,https://twitter.com/sundarpichai/status/1087783470225448960
@sundarpichai,"Great discussion with leaders from across Central & Eastern Europe about the region’s potential as Digital Challengers. Google is committed to supporting them: we're investing $20M by 2020 in programs & training to help people grow their skills, careers and businesses.",3.1K,70,331,https://twitter.com/sundarpichai/status/1087473107529416704
@sundarpichai,"Today our doodle honors the life and work of Dr. Martin Luther King, Jr. Special thanks to guest artist Xia Gordon (",2.2K,47,248,https://twitter.com/sundarpichai/status/1087367261151588353
@sundarpichai,Great summary of our Research and AI work in 2018 from,1.8K,67,194,https://twitter.com/sundarpichai/status/1085407150078332928
@sundarpichai,So great to have,1.2K,58,105,https://twitter.com/sundarpichai/status/1082509102486499328
@sundarpichai,Nice in depth look from the Times on,1.5K,65,206,https://twitter.com/sundarpichai/status/1082177147962241024
@sundarpichai,"The First Step Act is an important moment in reforming our criminal justice system to ensure it’s equal, consistent and fair for everyone. Google &",1.8K,100,211,https://twitter.com/sundarpichai/status/1075834333087158272
@sundarpichai,"In Sept, a fire struck the National Museum of Brazil, home to one of the largest collections of natural history in the world. An estimated 20M pieces were lost. Through partnership w/",2K,99,284,https://twitter.com/sundarpichai/status/1073320240417714176
@sundarpichai,"In a year of ups and downs, the world searched for ""good"" more than ever before. Here’s to all the good moments from 2018 and all the people who searched for them.",7.5K,241,1.5K,https://twitter.com/sundarpichai/status/1072764372160675840
@sundarpichai,We're thankful for all of the first responders who continue to battle the wildfires in California and help those who were displaced. There's much more to be done and we’ll stay engaged in support of recovery efforts.,2.4K,81,207,https://twitter.com/sundarpichai/status/1065723327078064128
@sundarpichai,Thank you to all veterans for your service and for the sacrifices you've made to protect our freedom. Our doodle today honors you and your stories.,4.5K,119,338,https://twitter.com/sundarpichai/status/1061668887094210560
@sundarpichai,We are mobilizing to support those impacted by the,3.3K,88,296,https://twitter.com/sundarpichai/status/1060995507240103936
@sundarpichai,"We’re announcing our AI for Social Good program, applying",4.4K,151,1.3K,https://twitter.com/sundarpichai/status/1056969127569448960
@sundarpichai,Happy 10th birthday,11K,256,2K,https://twitter.com/sundarpichai/status/1054467514191749122
@sundarpichai,Making information universally accessible and useful is as core to who we are today as it was when we began 20 years ago - lots of enhancements coming to Google Search,1.9K,70,355,https://twitter.com/sundarpichai/status/1044349894188654592
@sundarpichai,We're using AI to create more accurate forecasting models to predict when and where floods will occur - proud to partner w/ India’s Central Water Commission as the first region to roll out early flood warnings in Search,5.4K,132,1.3K,https://twitter.com/sundarpichai/status/1044290104263491584
@sundarpichai,Our thoughts are with those impacted by this month's catastrophic storms.,1.4K,57,200,https://twitter.com/sundarpichai/status/1042105743216791553
@sundarpichai,We've activated our SOS Alert for,2K,79,331,https://twitter.com/sundarpichai/status/1040065034037092353
@sundarpichai,"We’re committed to helping transitioning service members & veterans find work through a new job search feature that matches their military skills to job openings, and with a grant to",2.1K,105,357,https://twitter.com/sundarpichai/status/1034199293425381376
@sundarpichai,is one of my favorite traditions,4.2K,89,406,https://twitter.com/sundarpichai/status/1010024927372558336
@sundarpichai,Grateful for the work these great organizations do to make a difference,1.2K,25,136,https://twitter.com/sundarpichai/status/1009661673362239488
@sundarpichai,"The stories and images of families being separated at the border are gut-wrenching. Urging our government to work together to find a better, more humane way that is reflective of our values as a nation.",7.7K,163,1.4K,https://twitter.com/sundarpichai/status/1009168033976279040
@sundarpichai,Congrats to,826,17,92,https://twitter.com/sundarpichai/status/1010237308719656960
@sundarpichai,Grateful for the work these great organizations do to make a difference,1.2K,25,136,https://twitter.com/sundarpichai/status/1009661673362239488
@sundarpichai,Excited that we'll be opening a new,4.4K,173,1.2K,https://twitter.com/sundarpichai/status/1006916142382735365
@sundarpichai,"Looking forward to the updated Search experience for soccer, just in time for the World Cup:)  Excited we’re bringing more products and updates to users in Brazil and beyond",1.1K,42,128,https://twitter.com/sundarpichai/status/1005248979066474496
@sundarpichai,"Today we opened our first Google digital hub in Brittany, France to help make digital skills training more accessible to everyone",1.8K,50,276,https://twitter.com/sundarpichai/status/1005215853179047936
@sundarpichai,Today we’re sharing our AI principles and practices. How AI is developed and used will have a significant impact on society for many years to come. We feel a deep responsibility to get this right.,9.1K,225,3.4K,https://twitter.com/sundarpichai/status/1004800469405876226
@sundarpichai,Great to see this work between the teams to improve battery life and brightness use cases on Android!,1.1K,20,195,https://twitter.com/sundarpichai/status/993967367267893248
@sundarpichai,"I believe there’s more quality journalism being produced than ever before, and we’re excited to introduce a newly redesigned",2.6K,94,548,https://twitter.com/sundarpichai/status/993915636169388032
@sundarpichai,Almost show time! See you soon,3.9K,65,531,https://twitter.com/sundarpichai/status/993894079975931905
@sundarpichai,"Tried out Google Station last time I was in India, and am happy that we're rolling out this service in Mexico to provide better access to information for more people",1.4K,47,233,https://twitter.com/sundarpichai/status/973641661052891136
@sundarpichai,Here's to others discovering new planets with machine learning as well!,1.7K,34,323,https://twitter.com/sundarpichai/status/972659536812113920
@sundarpichai,On this,1.5K,33,227,https://twitter.com/sundarpichai/status/971758229112827905
@sundarpichai,"There's nothing quite like the color explosion in India during Holi, see pics in this article from",3.4K,103,516,https://twitter.com/sundarpichai/status/969471902686130177
@sundarpichai,"We're sharing resources for everyone to learn more about AI, including a ""Machine Learning Crash Course"" which over 18K Googlers have enrolled in!",3.7K,71,1.2K,https://twitter.com/sundarpichai/status/969003071131938817
@sundarpichai,"AI offers us the potential for new, less invasive tests for heart health - predicting cardiovascular results from retinal images with computer vision - encouraging early results!",2.4K,69,715,https://twitter.com/sundarpichai/status/965833106992390145
@sundarpichai,"Important change to improve security - Beginning in July 2018 with the release of Chrome 68, Chrome will mark all HTTP sites as “not secure”",2.6K,103,879,https://twitter.com/sundarpichai/status/961862155132743681
@sundarpichai,Added to calendar:),2.3K,51,217,https://twitter.com/sundarpichai/status/960902941832986624
@sundarpichai,Just tried it:),3.4K,79,237,https://twitter.com/sundarpichai/status/960324132662665218
@sundarpichai,At,2K,58,683,https://twitter.com/sundarpichai/status/953640124813795328
@sundarpichai,"There are 150,000 open positions in IT support & predicted to grow faster than most other occupations through 2026 - we've worked with",3.4K,119,1.2K,https://twitter.com/sundarpichai/status/953319823840223232
@sundarpichai,Thank you,935,32,98,https://twitter.com/sundarpichai/status/952966545969262593
@sundarpichai,"Impact of ML/AI on Healthcare, Robotics and other fields, nice summary from",805,25,157,https://twitter.com/sundarpichai/status/951956104010874880
@sundarpichai,"Images are still too big and slow to load on phones, so we're hosting a competition to see how much smaller and faster you can make them. Are you the next Pied Piper?:)",4.2K,74,1.1K,https://twitter.com/sundarpichai/status/951153401772953600
