UserId,Tweets,Likes,Comments,Retweets,Tweet_Url
@theapplehub,"What if Apple rebranded the iPhone as the Apple Phone?

Apple stopped using the ‘i’ prefix on new products many years ago",554,60,42,https://twitter.com/theapplehub/status/1722897218846257540
@theapplehub,"Apple reportedly aims to launch new MacBook Pro models with OLED displays in 2026

Would you wait for an OLED MacBook Pro?

Source: Jeff Pu",1.1K,77,52,https://twitter.com/theapplehub/status/1722839266638840090
@theapplehub,Black Titanium or Black?,3K,131,138,https://twitter.com/theapplehub/status/1722701445223637348
@theapplehub,iOS 17 beta 2 is out!,1K,35,54,https://twitter.com/theapplehub/status/1722681391824126244
@theapplehub,"The iPhone 15 Plus is a nearly perfect phone!

If only it had 120Hz…",6.4K,251,310,https://twitter.com/theapplehub/status/1722474031415484687
@theapplehub,Space Black is disappointing…,3.8K,194,138,https://twitter.com/theapplehub/status/1722434926505787564
@theapplehub,November Apple Buyer's Guide (Part 2),262,4,28,https://twitter.com/theapplehub/status/1722366992093765709
@theapplehub,"Apple has named Taylor Swift as Apple Music's Artist of the Year! 

Swift is the No. 1 most-streamed female artist in Apple Music history",1.4K,48,146,https://twitter.com/theapplehub/status/1722323507437326361
@theapplehub,Full story:,99,1,9,https://twitter.com/theapplehub/status/1722146868757750086
@theapplehub,Midnight or Space Black?,6.7K,455,396,https://twitter.com/theapplehub/status/1722098267956314336
@theapplehub,iOS 17.1.1 is now available!,3.8K,99,326,https://twitter.com/theapplehub/status/1722009889994953135
@theapplehub,Which Apple Watch are you using?,3.7K,707,201,https://twitter.com/theapplehub/status/1721723956921774405
@theapplehub,"Apple has confirmed there won’t be a new 27” iMac with Apple Silicon 

Did you want to see Apple release a larger iMac?

Source:",1.1K,52,84,https://twitter.com/theapplehub/status/1721586112265961855
@theapplehub,Who’s old enough to remember this?,6.7K,323,513,https://twitter.com/theapplehub/status/1721439828750029282
@theapplehub,New features coming to your iPhone with iOS 17.2,5.3K,102,517,https://twitter.com/theapplehub/status/1721338329348882839
@theapplehub,"Type ""Let it snow"" in the Apple Store app",2K,35,210,https://twitter.com/theapplehub/status/1721321123877687543
@theapplehub,"Are you planning to buy the $3,500 Vision Pro headset next year?",5.8K,624,489,https://twitter.com/theapplehub/status/1721183611679109297
@theapplehub,"Type ""Let it snow"" in the Apple Store app",2K,35,210,https://twitter.com/theapplehub/status/1721321123877687543
@theapplehub,What’s your battery health?,2.8K,924,380,https://twitter.com/theapplehub/status/1721098653295956100
@theapplehub,"For the first time since 2009, Apple will not release new iPads this year",4.3K,143,306,https://twitter.com/theapplehub/status/1721020725166063973
@theapplehub,Imagine we get a 32” iMac Pro in 2024,2.3K,67,134,https://twitter.com/theapplehub/status/1720959967174574184
@theapplehub,"The evolution of Apple’s IDs

Touch ID - fingerprint scanner
Face ID - facial recognition
Optic ID - iris scanner

Which one would you rather use?",11K,494,957,https://twitter.com/theapplehub/status/1720641501036974386
@theapplehub,"The iPhone X was released six years ago today

Did you have one?",3.7K,409,341,https://twitter.com/theapplehub/status/1720440963678830868
@theapplehub,I think it’s time for a new Pro design,7.8K,250,517,https://twitter.com/theapplehub/status/1720395077410050112
@theapplehub,"Apple made $22.3 billion in revenue from services, an all-time record!

How many of Apple’s services do you subscribe to?",1.7K,257,142,https://twitter.com/theapplehub/status/1720277935855448324
@theapplehub,Apple made $43.8 billion in revenue from the iPhone in Q4 2023,2.7K,182,245,https://twitter.com/theapplehub/status/1720242569727365388
@theapplehub,What iPhone are you currently using?,9.9K,3.7K,736,https://twitter.com/theapplehub/status/1719948974055129197
@theapplehub,"Apple has removed the Apple Music Voice Plan that was priced at $4.99 per month!

The Voice Plan allowed users to access the entire music catalog exclusively using Siri",1.8K,60,128,https://twitter.com/theapplehub/status/1719810721272500520
@theapplehub,Which Control Center design is the best?,12K,763,2K,https://twitter.com/theapplehub/status/1719666757219353025
@theapplehub,"The iPhone 16 models will reportedly feature a new capacitive “Capture Button”

Its function is currently unclear. Does the iPhone need another button?

Source: Instant Digital (Weibo)",1.9K,146,149,https://twitter.com/theapplehub/status/1719547824172392738
@theapplehub,Will you buy a new MacBook Pro or iMac with M3?,1.8K,166,102,https://twitter.com/theapplehub/status/1719489091169886323
@theapplehub,Space Gray or Space Black?,5.8K,431,406,https://twitter.com/theapplehub/status/1719326105189130652
@theapplehub,The,5.6K,90,407,https://twitter.com/theapplehub/status/1719240573700497840
@theapplehub,RIP Touch Bar 2016-2023,3.6K,262,274,https://twitter.com/theapplehub/status/1719197288537657697
@theapplehub,"Apple has introduced the next family of chips for the Mac starting with the M3, M3 Pro and M3 Max. These are the first 3nm chips and pack the largest upgrades since the M1",1.8K,40,231,https://twitter.com/theapplehub/status/1719163203949928475
@theapplehub,Space Black is stunning!!,10K,123,1.2K,https://twitter.com/theapplehub/status/1719159529630499055
@theapplehub,"Apple has officially killed the 13"" MacBook Pro with Touch Bar!",1.1K,46,92,https://twitter.com/theapplehub/status/1719157150650708137
@theapplehub,That's it! What did you think of the event?,9.3K,264,223,https://twitter.com/theapplehub/status/1719149992580141545
@theapplehub,"This is the new iMac 24"" with M3 starting at $1,299!",1.9K,48,312,https://twitter.com/theapplehub/status/1719149448432107974
@theapplehub,"Apple introduces the new iMac 24"" with M3!",1.6K,28,186,https://twitter.com/theapplehub/status/1719148769693032622
@theapplehub,"This is the new 14"" and 16"" MacBook Pro with M3 chips, now starting at $1,599!",2.8K,67,565,https://twitter.com/theapplehub/status/1719148643629056189
@theapplehub,The new MacBook Pro now comes in Space Black!,3.9K,61,485,https://twitter.com/theapplehub/status/1719147552447316024
@theapplehub,"Apple introduces the new 14"" and 16"" MacBook Pro, now starting with an M3 chip!",1.3K,37,161,https://twitter.com/theapplehub/status/1719145865951260794
@theapplehub,These are the new features of the M3 chips,1.8K,25,323,https://twitter.com/theapplehub/status/1719145307962069409
@theapplehub,"Apple introduces the M3, M3 Pro and M3 Max chips",4.7K,48,392,https://twitter.com/theapplehub/status/1719143744614899958
@theapplehub,"""Good evening""",3.2K,38,150,https://twitter.com/theapplehub/status/1719143067192819961
@theapplehub,The,2.1K,49,168,https://twitter.com/theapplehub/status/1719112188869361773
@theapplehub,The iPhone can run console-level games,7.9K,207,797,https://twitter.com/theapplehub/status/1719089700965892563
@theapplehub,The iPhone can run console-level games,7.9K,207,797,https://twitter.com/theapplehub/status/1719089700965892563
@theapplehub,"The original AirPods Pro were released 4 years ago today

Did you own a pair?",2.7K,291,162,https://twitter.com/theapplehub/status/1719008095056306515
@theapplehub,See what happens when you like this post,172K,600,1.9K,https://twitter.com/theapplehub/status/1718885246350033337
@theapplehub,"Which of these iPhones had the best design?

iPhone 4
iPhone 6
iPhone X
iPhone 12",6.4K,1.2K,601,https://twitter.com/theapplehub/status/1718668799212503130
@theapplehub,These are the,2.5K,128,311,https://twitter.com/theapplehub/status/1718621784378077383
@theapplehub,The iPhone can run console-level games,7.9K,207,797,https://twitter.com/theapplehub/status/1719089700965892563
@theapplehub,"Loving the iPhone 15 Pro Max camera so far!

It’s truly impressive",1.5K,29,60,https://twitter.com/theapplehub/status/1718545984438088053
@theapplehub,Less than two days to go!,3.9K,169,210,https://twitter.com/theapplehub/status/1718418133097332851
@theapplehub,"The iPhone XR was released 5 years ago around this time 

Did you have one?",4.2K,450,365,https://twitter.com/theapplehub/status/1718085064389689353
@theapplehub,"X has launched new Premium tiers:

Premium+: $16 per month 
Basic: $3 per month

Premium+ has no ads in for you and following tabs. Basic does not get you a blue checkmark

Would you subscribe to these new tiers?",647,92,117,https://twitter.com/theapplehub/status/1717982833845964904
@theapplehub,What to expect at the,4.5K,206,512,https://twitter.com/theapplehub/status/1717946116573204685
@theapplehub,"Elon Musk officially purchased Twitter (now X) for $44 billion one year ago today

Is the platform better or worse now?",4.2K,1K,466,https://twitter.com/theapplehub/status/1717896312887411198
@theapplehub,Apple is reportedly developing new low-cost 12” and 13” MacBook models that could be sold for $700 or less,3.1K,183,331,https://twitter.com/theapplehub/status/1717817649491833306
@theapplehub,Has your iPhone’s battery life improved with iOS 17.1?,8K,952,448,https://twitter.com/theapplehub/status/1717688883733999808
@theapplehub,"New Apple Music features in iOS 17.2:

- Favorite songs playlist 
- Collaborative playlists with friends",3.9K,77,501,https://twitter.com/theapplehub/status/1717607848451141873
@theapplehub,iOS 17.2 features the Journal app!,7.2K,176,648,https://twitter.com/theapplehub/status/1717602477682696336
@theapplehub,iOS 17.2 beta 1 is out!,1.2K,39,101,https://twitter.com/theapplehub/status/1717595948841672889
@theapplehub,The iPhone lineup 10 years ago vs now,8.3K,122,735,https://twitter.com/theapplehub/status/1717437005225918709
@theapplehub,Apple is reportedly considering releasing a low-cost MacBook to boost sales,4.5K,422,382,https://twitter.com/theapplehub/status/1717367454689857909
@theapplehub,"These are the new features and changes in iOS 17.1!

Which one is your favorite?",3.4K,77,550,https://twitter.com/theapplehub/status/1717251453302329766
@theapplehub,"These are the new features and changes in iOS 17.1!

Which one is your favorite?",3.4K,77,550,https://twitter.com/theapplehub/status/1717251453302329766
@theapplehub,"iOS 17.1 is now available! 

The new update adds new features for Apple Music, AirDrop over cellular, and more

Will you update?",4.6K,180,473,https://twitter.com/theapplehub/status/1717225365012467739
@theapplehub,iOS 17.1 today?,3.6K,164,222,https://twitter.com/theapplehub/status/1717208725944242538
@theapplehub,"Apple One prices have also gone up:

Individual: $19.95 per month (up from $16.95)
Family: $25.95 per month (up from $22.95)
Premier: $37.95 per month (up from $32.95)",127,11,27,https://twitter.com/theapplehub/status/1717189193062039651
@theapplehub,"Apple has officially launched Apple Pay Later in the U.S., which allows users to split purchases into four payments over six weeks with zero interest and no fees",5.2K,158,528,https://twitter.com/theapplehub/status/1716919666436939949
@theapplehub,Apple now expected to announce the first M3 Macs next week including a new 24” iMac and 14”/16” MacBook Pro models!,4.1K,130,487,https://twitter.com/theapplehub/status/1716877061565132948
@theapplehub,Apple hints new Macs are coming next week at the,3.5K,82,388,https://twitter.com/theapplehub/status/1716855253243674652
@theapplehub,It’s official! Apple will announce new products at the,13K,304,1.7K,https://twitter.com/theapplehub/status/1716847573724725707
@theapplehub,iOS 17.1 will be available in the next few hours!,5.5K,243,505,https://twitter.com/theapplehub/status/1716786619234033897
@theapplehub,Apple hints new Macs are coming next week at the,3.5K,82,388,https://twitter.com/theapplehub/status/1716855253243674652
@theapplehub,The Home Button was first introduced on the original iPhone in 2007 and became an iconic symbol. It was replaced by a home indicator on the iPhone X in 2017.,2.3K,121,231,https://twitter.com/theapplehub/status/1716656914195738629
@theapplehub,"Apple could send invites for the next Apple Event tomorrow!

New Macs are expected to launch next week

Source:",2.5K,37,238,https://twitter.com/theapplehub/status/1716576097482182803
@theapplehub,Apple hints new Macs are coming next week at the,3.5K,82,388,https://twitter.com/theapplehub/status/1716855253243674652
@theapplehub,"The original iPod was released 22 years ago today!

Advertised as ""1,000 songs in your pocket,"" it featured a click wheel, 5GB of storage, and was priced at $399

Did you ever own an iPod?",1.7K,100,240,https://twitter.com/theapplehub/status/1716543755736793226
@theapplehub,"The iPhone 12 and iPhone 12 Pro were released 3 years ago today

Did you own one?",5.5K,606,430,https://twitter.com/theapplehub/status/1716504034692178031
@theapplehub,"If the iPhone 15 Pro were available in more colors..

Which color would you pick?",3.7K,437,346,https://twitter.com/theapplehub/status/1716143749447991517
@theapplehub,Would you buy a red iPhone 15 Pro?,9.2K,676,500,https://twitter.com/theapplehub/status/1715962698025120205
@theapplehub,"iOS 17.1 is expected to launch this week, likely on or before October 24!

Do you like these new features?",5K,133,497,https://twitter.com/theapplehub/status/1715930793938411683
@theapplehub,Would you like this front design on the iPhone 16 Pro?,11K,1.4K,801,https://twitter.com/theapplehub/status/1715658319917191620
@theapplehub,My first world problem,2.4K,152,199,https://twitter.com/theapplehub/status/1715551047123603641
@theapplehub,"iOS 17.1 is expected to launch this week, likely on or before October 24!

Do you like these new features?",5K,133,497,https://twitter.com/theapplehub/status/1715930793938411683
@theapplehub,"Apple will begin implementing generative AI features on the iPhone as early as next year, possibly with iOS 18!

Apple has previously been rumored to be testing a chatbot similar to ChatGPT

Would you like to see this happen?

Source: Jeff Pu",4.4K,195,416,https://twitter.com/theapplehub/status/1715289964282605831
@theapplehub,"Apple is reportedly working on a larger iPad Air with a 12.9” display!

Unlike the 12.9” iPad Pro, this larger iPad Air would feature an LCD display instead of mini-LED

Would you buy one?

Source:",1.8K,135,209,https://twitter.com/theapplehub/status/1715242755172217213
@theapplehub,"AirTag 2 has reportedly been delayed until 2025

Source:",1.5K,47,170,https://twitter.com/theapplehub/status/1714689469004345705
@theapplehub,"A foldable iPad is reportedly in ""intensive development"" and could be announced in late 2024

Would you buy a foldable iPad?

Source:",4.6K,366,487,https://twitter.com/theapplehub/status/1714651772042793122
@theapplehub,"Everything Apple released in 2023:

14"" and 16"" MacBook Pro (M2 Pro/Max)
Mac mini (M2/M2 Pro)
HomePod (2nd gen)
iPhone 14/14 Plus in Yellow
15"" MacBook Air (M2)
Mac Studio (M2 Max/Ultra)
Mac Pro (M2 Ultra)
Apple Watch Series 9
Apple Watch Ultra 2
iPhone 15/15 Plus
iPhone 15…",3.8K,118,399,https://twitter.com/theapplehub/status/1714534234596221359
@theapplehub,"X is testing a new program in New Zealand and the Philippines that will require new, unverified accounts to pay $1 a year to post 

How do you feel about this?",1.9K,368,403,https://twitter.com/theapplehub/status/1714443640037404965
@theapplehub,Apple's weirdest design choices,8.8K,155,854,https://twitter.com/theapplehub/status/1714298117544366188
@theapplehub,"We now have three Apple Pencil models! 

The new Apple Pencil with USB-C is cheaper but lacks a few features from the Apple Pencil (2nd gen)",755,47,155,https://twitter.com/theapplehub/status/1714271299168768192
@theapplehub,Wallpaper link,330,11,32,https://twitter.com/theapplehub/status/1714154934873325794
@theapplehub,New Apple products are expected to launch this week!,7.2K,280,571,https://twitter.com/theapplehub/status/1713740068760994300
@theapplehub,Apple’s animations can’t be topped,8.1K,112,531,https://twitter.com/theapplehub/status/1713464590988722316
@theapplehub,The iPhone 7 had one of the best color lineups ever!,6.8K,216,506,https://twitter.com/theapplehub/status/1713312019536122195
@theapplehub,"The iPhone 4S was released 12 years ago today

Did you own one?",6.9K,571,768,https://twitter.com/theapplehub/status/1713241158942708209
@theapplehub,"iOS 17.1 is expected to launch by October 24!

The new update includes new Apple Music features such as favoriting music, support for AirDrop over the internet, and more

Source:",3.5K,109,365,https://twitter.com/theapplehub/status/1712913930384036216
@theapplehub,Apple updated the AirPods Pro (2nd gen) with a new USB-C charging case last month. No further AirPods updates are expected this year…,592,11,71,https://twitter.com/theapplehub/status/1712883132205355295
@theapplehub,"Imagine the upcoming iPad Pro with these features:

OLED display
Thinner bezels
Dynamic Island
Titanium body
M3 chip
Action Button 

Would you buy this?",7K,597,575,https://twitter.com/theapplehub/status/1712689600257458628
@theapplehub,What new features would you like to see in iOS 18 next year?,7.6K,1.3K,476,https://twitter.com/theapplehub/status/1712392933239066957
@theapplehub,We’ve come a long way since the original iPhone,12K,208,1.2K,https://twitter.com/theapplehub/status/1712023916238258601
@theapplehub,"The Apple Watch Series 10 is unlikely to feature any “significant innovative experiences”

Apple is working on new features such as a MicroLED display and blood glucose monitoring, however, these features could be at least two years away

Would you be disappointed if the Apple…",3.2K,205,193,https://twitter.com/theapplehub/status/1711824851303104813
@theapplehub,iOS 17.1 beta 3 is now available!,2.7K,117,217,https://twitter.com/theapplehub/status/1711793839093227895
@theapplehub,"iPhone 15 Plus vs iPhone 15 Pro Max

The iPhone 15 Plus is a pretty great value this year",4.5K,114,433,https://twitter.com/theapplehub/status/1711601586739527939
@theapplehub,"iPhone 15 vs iPhone 15 Pro

Which one would you pick?",7.1K,339,601,https://twitter.com/theapplehub/status/1711381734422647207
@theapplehub,"Pink and Green look really nice! Blue and Yellow.. not so much 

Which one is your favorite?",2.9K,188,244,https://twitter.com/theapplehub/status/1711205490821394855
@theapplehub,The black color on the iPhone 15 is stunning!,11K,291,583,https://twitter.com/theapplehub/status/1710888468002361406
@theapplehub,"Which iPhone 15 Pro color is your favorite?

Black Titanium
White Titanium
Natural Titanium
Blue Titanium",9.4K,835,870,https://twitter.com/theapplehub/status/1710828082909856188
@theapplehub,"Apple is reportedly working on two new versions of the iPad Air, one of which could be a larger model

Would you buy a larger iPad Air? 

Source:",2.3K,190,206,https://twitter.com/theapplehub/status/1710201642963063202
@theapplehub,"New iPads are coming soon including a new iPad mini and iPad (11th gen) with faster chips 

Are you interested in a new iPad mini?

Source:",2.9K,211,236,https://twitter.com/theapplehub/status/1710090236083290385
@theapplehub,"X/Twitter is planning to add more premium tiers including a cheaper and more expensive option with no ads

Would you subscribe to any of these tiers?

Source:",2K,541,473,https://twitter.com/theapplehub/status/1710070960165106151
@theapplehub,Does anyone remember that other app?,12K,630,595,https://twitter.com/theapplehub/status/1710043794098548902
@theapplehub,"Honoring Steve Jobs, who passed away 12 years ago today",15K,169,2K,https://twitter.com/theapplehub/status/1709938172216697332
@theapplehub,"For me: the ecosystem and iOS 

With that said, I would like to try other smartphones out there such as the Pixel",1K,46,30,https://twitter.com/theapplehub/status/1709726173473673267
@theapplehub,Jump scare,2.8K,104,193,https://twitter.com/theapplehub/status/1709634572672278685
@theapplehub,Apple has released iOS 17.0.3 with fix for iPhone 15 Pro overheating issue,7K,383,901,https://twitter.com/theapplehub/status/1709626836618219915
@theapplehub,Which of these do you subscribe to?,4.6K,959,467,https://twitter.com/theapplehub/status/1709333825103524321
@theapplehub,Heads up: Your iPhone will receive a test emergency alert from FEMA and the FCC tomorrow at 11:20 a.m. PDT (U.S. only),2.1K,68,268,https://twitter.com/theapplehub/status/1709280489067213072
@theapplehub,"The new ringtones are back in iOS 17.1 beta 2!

Apple previously removed the new ringtones in iOS 17.1 beta 1",1.3K,93,108,https://twitter.com/theapplehub/status/1709263608226738219
@theapplehub,iOS 17.1 beta 2 is now available!,2.9K,184,234,https://twitter.com/theapplehub/status/1709259004105601425
@theapplehub,"Not impressed with the iPhone 15 Pro Max battery life so far. I usually have to charge it twice a day..

Definitely an upgrade coming from an iPhone 14 Pro but was hoping for better",11K,939,958,https://twitter.com/theapplehub/status/1709053552302477784
@theapplehub,The iPad mini was last updated two years ago in September 2021 and is…,7.1K,201,737,https://twitter.com/theapplehub/status/1708958168125178342
@theapplehub,Should Apple launch its own search engine?,12K,1.4K,815,https://twitter.com/theapplehub/status/1708654344865001573
@theapplehub,The iPhone 5 has aged so well. Truly iconic,18K,369,1.3K,https://twitter.com/theapplehub/status/1708628246810734779
@theapplehub,Have you experienced battery drain in iOS 17?,39K,4.2K,2.3K,https://twitter.com/theapplehub/status/1708555049977438369
@theapplehub,Natural Titanium or Sierra Blue?,8.4K,474,540,https://twitter.com/theapplehub/status/1708391123973288372
@theapplehub,It’s small features like these that makes me appreciate Apple even more,11K,216,707,https://twitter.com/theapplehub/status/1708224313533583541
@theapplehub,"Apple will release a software update soon to fix the iPhone 15 Pro overheating issues!

Apple also says some third-party apps are “causing them to overload the system”

Source:",6.8K,276,612,https://twitter.com/theapplehub/status/1708164538640806367
@theapplehub,"We’ve come a long way since the first Pro iPhone 

If you have an iPhone 12 or older, you should consider upgrading to the iPhone 15 series",14K,773,1.7K,https://twitter.com/theapplehub/status/1708010406340665448
@theapplehub,"The iPhone 15 is a bigger upgrade this year compared to last year’s iPhone 14

Would you consider upgrading to an iPhone 15 or iPhone 15 Plus?",5.3K,285,611,https://twitter.com/theapplehub/status/1707981402233524493
@theapplehub,Would you be interested in an iPhone 16 Ultra?,5K,506,260,https://twitter.com/theapplehub/status/1707854117308403906
@theapplehub,"Tim Cook on using the Vision Pro:

“When you’ve tried it, it’s an aha moment, and you only have a few of those in a lifetime”

Would you buy a Vision Pro headset next year?

Source:",1.8K,162,84,https://twitter.com/theapplehub/status/1707781013018145028
@theapplehub,Apple needs to add this to all iPhones…,9.6K,282,721,https://twitter.com/theapplehub/status/1707767452506140937
@theapplehub,Do you prefer the Mute Switch or Action Button?,12K,1.1K,723,https://twitter.com/theapplehub/status/1707587338329788528
@theapplehub,Natural Titanium was the right move,8.4K,246,430,https://twitter.com/theapplehub/status/1707441281646133265
@theapplehub,"The development of the Apple Car has “lost all visibility” and unless Apple adopts an acquisition strategy, it’s unlikely it will enter mass production in the next few years 

Would you like to see Apple release a car in the future?

Source:",2K,122,109,https://twitter.com/theapplehub/status/1707409915705544902
@theapplehub,Also new in iOS 17.1,3.7K,81,331,https://twitter.com/theapplehub/status/1707129329996775672
@theapplehub,New in iOS 17.1,3.3K,75,322,https://twitter.com/theapplehub/status/1707118904085197200
@theapplehub,Apple has removed every new ringtone introduced in iOS 17 in the iOS 17.1 beta,9.6K,481,695,https://twitter.com/theapplehub/status/1707113276017189229
@theapplehub,Also new in iOS 17.1,3.7K,81,331,https://twitter.com/theapplehub/status/1707129329996775672
@theapplehub,New in iOS 17.1,8.1K,278,879,https://twitter.com/theapplehub/status/1707108456468209791
@theapplehub,New in iOS 17.1,8.1K,278,879,https://twitter.com/theapplehub/status/1707108456468209791
@theapplehub,iOS 17.1 beta 1 is now available!,1.8K,98,152,https://twitter.com/theapplehub/status/1707098843748393102
@theapplehub,These guys are in for a big surprise once they find out the devices are bricked and tracked,58K,991,4.6K,https://twitter.com/theapplehub/status/1707013342915891410
@theapplehub,"5x optical zoom on iPhone 15 Pro Max

What do you guys think?",4.3K,128,332,https://twitter.com/theapplehub/status/1706918943276007558
@theapplehub,The iPhone 15 Pro Max camera is truly impressive!,14K,174,1.1K,https://twitter.com/theapplehub/status/1706877934240518390
@theapplehub,These guys are in for a big surprise once they find out the devices are bricked and tracked,58K,991,4.6K,https://twitter.com/theapplehub/status/1707013342915891410
@theapplehub,"5x optical zoom on iPhone 15 Pro Max

What do you guys think?",4.3K,128,332,https://twitter.com/theapplehub/status/1706918943276007558
@theapplehub,"iOS 17.0.2 is now available!

This update was previously only available for iPhone 15 models",7.5K,326,697,https://twitter.com/theapplehub/status/1706758077574414762
@theapplehub,"macOS Sonoma is now available for these devices:

iMac (2019 or later)
iMac Pro (2017)
Mac Pro (2019 or later)
Mac Studio (2022 or later)
MacBook Air (2018 or later)
Mac mini (2018 or later)
MacBook Pro (2018 or later)

What is your favorite new feature?",2.9K,143,422,https://twitter.com/theapplehub/status/1706715572522844623
@theapplehub,The new screen savers in macOS Sonoma are stunning!,11K,195,1.3K,https://twitter.com/theapplehub/status/1706711049704288743
