UserId_Url,UserId,Tweet_Url,Date-Time,Tweets,,Comments,Retweets,Likes,Impressions
https://twitter.com/AndroidPolice,@AndroidPolice,https://twitter.com/AndroidPolice/status/1717826165681917996,Oct 27,Samsung has suddenly decided to charge $30 more for the Galaxy S23 FE while third-party retailers continue to sell it for cheaper,https://t.co/pAXtCIPXWg,1,14,,7K
https://twitter.com/AndroidPolice,@AndroidPolice,https://twitter.com/AndroidPolice/status/1717663705805042068,Oct 27,These new Chromebook Plus models are already seeing major discounts,https://t.co/XsxBnG0Z5g,1,1,18,7.3K
https://twitter.com/AndroidPolice,@AndroidPolice,https://twitter.com/AndroidPolice/status/1717647785585992004,Oct 27,Trade in ANY phone in any condition and get a minimum $200 towards the new OnePlus Open foldable,https://t.co/OMKgL43z1l,1,3,33,9.2K
https://twitter.com/AndroidPolice,@AndroidPolice,https://twitter.com/AndroidPolice/status/1717625128962388169,Oct 27,Should you buy the more premium Fitbit Charge 6 or save yourself some money with the Mi Band 7? Here's how they stack up side-by-side.,https://t.co/ChyijHXGNF,1,1,15,7.2K
https://twitter.com/AndroidPolice,@AndroidPolice,https://twitter.com/AndroidPolice/status/1717621400419070295,Oct 27,"The latest foldable to hit the market is officially available, and here's where you can get it",https://t.co/XpII9fsQ52,3,10,,6.8K
https://twitter.com/AndroidPolice,@AndroidPolice,https://twitter.com/AndroidPolice/status/1717606311406305651,Oct 26,Google’s new search feature can help you detect AI-generated images,https://t.co/u944KuYgS2,6,47,,8.5K
https://twitter.com/AndroidPolice,@AndroidPolice,https://twitter.com/AndroidPolice/status/1717581043580944502,Oct 26,"While it's still early, we can already tell that the best Black Friday Chromebook deals will sell out early again this year",https://t.co/thYQU3qcl5,1,17,,7.3K
https://twitter.com/AndroidPolice,@AndroidPolice,https://twitter.com/AndroidPolice/status/1717547512054047153,Oct 26,The best places to shop for the new,https://t.co/rRowNTw8fl,1,1,6,6.9K
https://twitter.com/AndroidPolice,@AndroidPolice,https://twitter.com/AndroidPolice/status/1717540532308656484,Oct 26,Does Instagram tattle on screenshoters?,https://t.co/gG4lNOgKiw,1,5,59,12K
https://twitter.com/AndroidPolice,@AndroidPolice,https://twitter.com/AndroidPolice/status/1717535600494940490,Oct 26,Google Maps is starting to roll out new colors and its incredible Immersive View for Routes on Android and iOS,https://t.co/9ZJfqRQBXH,1,5,93,12K
https://twitter.com/AndroidPolice,@AndroidPolice,https://twitter.com/AndroidPolice/status/1717530795022205102,Oct 26,Temporary Cloud Backup will roll out as a part of One UI 6,https://t.co/Ksf4XbQMOQ,1,12,,7.6K
https://twitter.com/AndroidPolice,@AndroidPolice,https://twitter.com/AndroidPolice/status/1717525689711112678,Oct 26,Here’s everything new in Chrome 119,https://t.co/IuMp5lzHxi,1,2,26,9.2K
https://twitter.com/AndroidPolice,@AndroidPolice,https://twitter.com/AndroidPolice/status/1717520575504032060,Oct 26,Modern foldables like the new OnePlus Open are far more durable than their earliest iterations — and it shows,https://t.co/BNteYTCeF3,4,16,,6.9K
https://twitter.com/AndroidPolice,@AndroidPolice,https://twitter.com/AndroidPolice/status/1717515481354055845,Oct 26,Gmail's emoji picker finally caught up with the times and added different skin tones,https://t.co/3h3feXOpBH,2,1,38,7.1K
https://twitter.com/AndroidPolice,@AndroidPolice,https://twitter.com/AndroidPolice/status/1717510146107085290,Oct 26,Third time's the charm as the Exynos modem inside the Pixel 8 has finally fixed the cellular issues of its predecessors,https://t.co/cN6e1yivxM,3,4,90,11K
https://twitter.com/AndroidPolice,@AndroidPolice,https://twitter.com/AndroidPolice/status/1717504940422082874,Oct 26,"Following PayDay: Crime Wars' second closure in early October, let's speculate on what went wrong",https://t.co/Qn6hXs3JKb,1,8,,6.2K
https://twitter.com/AndroidPolice,@AndroidPolice,https://twitter.com/AndroidPolice/status/1717486619681292777,Oct 26,Google Photos wants to keep your library clean and tidy with photo stacks,https://t.co/9hx6cQcO6L,2,4,76,11K
https://twitter.com/AndroidPolice,@AndroidPolice,https://twitter.com/AndroidPolice/status/1717451489482825849,Oct 26,Honor teased the Magic 6 at the ongoing Snapdragon Summit,https://t.co/DKrVhvAZ93,1,18,,6.5K
https://twitter.com/AndroidPolice,@AndroidPolice,https://twitter.com/AndroidPolice/status/1717320427989533100,Oct 26,Chrome 120 for desktop allows pinning useful Side Panels right beside the address bar,https://t.co/xGF4cWiqcS,2,4,23,7.5K
https://twitter.com/AndroidPolice,@AndroidPolice,https://twitter.com/AndroidPolice/status/1717301588505624656,Oct 26,"At this price, the TicWatch Pro 5 should absolutely be on your smartwatch radar",https://t.co/XIwQbe6WyT,1,1,22,8.2K
https://twitter.com/AndroidPolice,@AndroidPolice,https://twitter.com/AndroidPolice/status/1717291461429940607,Oct 26,Samsung's One UI 6 update is almost ready for prime time,https://t.co/J91mbSDjLw,2,20,,7.2K
https://twitter.com/AndroidPolice,@AndroidPolice,https://twitter.com/AndroidPolice/status/1717278948608893209,Oct 26,"For $7, there's no reason not to pick up this Lisen USB-C fast-charging cable 3-pack",https://t.co/zo3KJAt9mx,3,16,,6.6K
https://twitter.com/AndroidPolice,@AndroidPolice,https://twitter.com/AndroidPolice/status/1717272887143342237,Oct 26,Home Assistant now integrates with Android's smart home device controls,https://t.co/TUmxNzNymP,1,3,40,7.7K
https://twitter.com/AndroidPolice,@AndroidPolice,https://twitter.com/AndroidPolice/status/1717247509129576498,Oct 26,Branch supercharges Nova Search with an even longer list of app integrations in the latest beta,https://t.co/DY4lKPUW4R,3,1,35,8.1K
https://twitter.com/AndroidPolice,@AndroidPolice,https://twitter.com/AndroidPolice/status/1717240971396538600,Oct 25,Google may let you alter images while in Files with its Photos editing tool,https://t.co/bw6OThX0Tz,1,4,39,7.2K
https://twitter.com/AndroidPolice,@AndroidPolice,https://twitter.com/AndroidPolice/status/1717236429678313701,Oct 25,"Edge's Chrome survey is the ex that asks, ""Why are you moving on?""",https://t.co/0BIy6GIxLI,4,2,23,7.4K
https://twitter.com/AndroidPolice,@AndroidPolice,https://twitter.com/AndroidPolice/status/1717218805787533334,Oct 25,"You always answer when your mom calls. For everyone else, you can now let your Pixel ask if their call is urgent",https://t.co/45DWWi846W,2,32,,6.8K
https://twitter.com/AndroidPolice,@AndroidPolice,https://twitter.com/AndroidPolice/status/1717200584510521582,Oct 25,"Bose's QuietComfort Ultra Earbuds put the user experience first, but are they built to be waterproof like their predecessors?",https://t.co/yognPDs3ce,1,2,15,6.5K
https://twitter.com/AndroidPolice,@AndroidPolice,https://twitter.com/AndroidPolice/status/1717195042702467562,Oct 25,"If you're looking for a great robovac with mopping capability, the Roborock Q8 Max series has you covered",https://t.co/6bQYHypvh4,10,,,5.8K
https://twitter.com/AndroidPolice,@AndroidPolice,https://twitter.com/AndroidPolice/status/1717181896612892783,Oct 25,Motorola's wraparound concept phone seamlessly morphs into a wearable device,https://t.co/qzeOADVS5L,4,6,53,9K
https://twitter.com/AndroidPolice,@AndroidPolice,https://twitter.com/AndroidPolice/status/1717171394323038402,Oct 25,"Do Arlo Essential devices require a base station, or are they optional?",https://t.co/BxvuCIOUgg,1,13,,5.9K
https://twitter.com/AndroidPolice,@AndroidPolice,https://twitter.com/AndroidPolice/status/1717157039976177667,Oct 25,"Google's third-generation Tensor SoC is here in the Pixel 8 and 8 Pro. Here's all the news, features, and specs you need to know about.",https://t.co/DGkiUmGtLO,3,31,,7K
https://twitter.com/AndroidPolice,@AndroidPolice,https://twitter.com/AndroidPolice/status/1717148995665998013,Oct 25,YouTube Music is rolling out AI-driven cover designs for your playlists,https://t.co/Yul1IOSfKi,1,4,38,6.9K
https://twitter.com/AndroidPolice,@AndroidPolice,https://twitter.com/AndroidPolice/status/1717126531493798059,Oct 25,"Proton’s new password manager service now allows effortless credential sharing, with one small caveat",https://t.co/O00k8saFXV,2,6,26,8.4K
https://twitter.com/AndroidPolice,@AndroidPolice,https://twitter.com/AndroidPolice/status/1717121551944888430,Oct 25,Google Bard's new update makes it better at summarizing emails and dealing with images,https://t.co/fGTZPXwVts,1,3,39,7.8K
https://twitter.com/AndroidPolice,@AndroidPolice,https://twitter.com/AndroidPolice/status/1717086980364706146,Oct 25,The OnePlus 12 will feature a brighter display than the Google Pixel 8 Pro,https://t.co/i0uM8TwAxU,5,42,,9.4K
https://twitter.com/AndroidPolice,@AndroidPolice,https://twitter.com/AndroidPolice/status/1716959509799641240,Oct 25,An update could finally bring Look and Talk to Pixel Tablets,https://t.co/Gv4yJtSGgk,2,3,34,8.2K
https://twitter.com/AndroidPolice,@AndroidPolice,https://twitter.com/AndroidPolice/status/1716941502654333320,Oct 25,"WhatsApp drops support for Android 4.4, and it's been a long timing coming for the app on KitKat",https://t.co/sy2OzbVLfV,3,8,37,9K
https://twitter.com/AndroidPolice,@AndroidPolice,https://twitter.com/AndroidPolice/status/1716937720956596731,Oct 25,Xiaomi had some surprising news to share at Qualcomm's Snapdragon Summit today,https://t.co/SGn4wzuOgJ,2,2,39,9.2K
https://twitter.com/AndroidPolice,@AndroidPolice,https://twitter.com/AndroidPolice/status/1716933297060667881,Oct 25,Google Play Games for PC bridges the gap between mobile and desktop gaming with two popular/new titles,https://t.co/6N4IQop2Mh,1,29,,6.9K
https://twitter.com/AndroidPolice,@AndroidPolice,https://twitter.com/AndroidPolice/status/1716923430270910534,Oct 25,"With Snapdragon Seamless, future Qualcomm-powered devices will speak to each other like they're all from the same manufacturer — even if they aren't",https://t.co/0zEsLIxpYB,1,3,29,7.2K
https://twitter.com/AndroidPolice,@AndroidPolice,https://twitter.com/AndroidPolice/status/1716915568014434400,Oct 25,1Password has detected suspicious activity linked to the Okta data breach,https://t.co/Y7Oxhjq04E,1,3,28,8K
https://twitter.com/AndroidPolice,@AndroidPolice,https://twitter.com/AndroidPolice/status/1716898939478139238,Oct 25,"The Snapdragon 8 Gen 3 is official, as Qualcomm looks to go all-in on generative AI in next year's Android flagships",https://t.co/rfdLsVZS0U,1,1,28,6.7K
https://twitter.com/AndroidPolice,@AndroidPolice,https://twitter.com/AndroidPolice/status/1716894482015092874,Oct 25,"Cases can be sturdy, stylish, or sleek, but if they're slippery, what's the point? (We're looking at YOU, Google!)",https://t.co/azD1iRln6K,3,23,,6.1K
https://twitter.com/AndroidPolice,@AndroidPolice,https://twitter.com/AndroidPolice/status/1716881180849590417,Oct 24,"Google Photos is getting smarter with… you guessed it, generative AI",https://t.co/YfpmKh34py,3,12,99,10K
https://twitter.com/AndroidPolice,@AndroidPolice,https://twitter.com/AndroidPolice/status/1716850057574592831,Oct 24,Samsung's Galaxy S24 is tipped to unleash a new wave of AI-powered features to outdo the Pixel 8,https://t.co/XCrNd1MGDr,1,3,42,7.8K
https://twitter.com/AndroidPolice,@AndroidPolice,https://twitter.com/AndroidPolice/status/1716829182255317031,Oct 24,Google Assistant isn't just for setting timers.,https://t.co/2uyq9ngcKK,2,31,,7K
https://twitter.com/AndroidPolice,@AndroidPolice,https://twitter.com/AndroidPolice/status/1716819661038497863,Oct 24,WhatsApp is working on supercharging channels with support for voice messages and stickers,https://t.co/VD9aSkBnoN,4,31,,7.1K
https://twitter.com/AndroidPolice,@AndroidPolice,https://twitter.com/AndroidPolice/status/1716813743974486483,Oct 24,Anker’s magnetic phone grip and kickstand is down to just $13,https://t.co/lc4zcdPyUR,8,,,5.8K
https://twitter.com/AndroidPolice,@AndroidPolice,https://twitter.com/AndroidPolice/status/1716794296714600453,Oct 24,Xiaomi is building hype for the Xiaomi 14 series just days before its launch,https://t.co/7Ss53aH4ip,1,2,30,7.2K
https://twitter.com/AndroidPolice,@AndroidPolice,https://twitter.com/AndroidPolice/status/1716787902129082395,Oct 24,"The Apple Watch Series 9 might not work with Android, but it's still worth taking a look to see if the grass is greener on the other side. Our review:",https://t.co/bjICq2BVG1,3,4,36,10K
https://twitter.com/AndroidPolice,@AndroidPolice,https://twitter.com/AndroidPolice/status/1716782908537507980,Oct 24,"Most of the Pixel 8's new features are great. This one, not so much",https://t.co/5nzXei4j7N,1,26,,6.8K
https://twitter.com/AndroidPolice,@AndroidPolice,https://twitter.com/AndroidPolice/status/1716774237266960885,Oct 24,The recent addition of Wear OS backups is both joyous and frustrating,https://t.co/gKU0OZuhl4,3,26,,6.9K
https://twitter.com/AndroidPolice,@AndroidPolice,https://twitter.com/AndroidPolice/status/1716764587188490620,Oct 24,"The Bose QuietComfort Ultra Earbuds are expensive at $300, but can they justify that price against Samsung's Galaxy Buds 2 Pro?",https://t.co/gaHQRydXu6,2,12,,6.7K
https://twitter.com/AndroidPolice,@AndroidPolice,https://twitter.com/AndroidPolice/status/1716764263916716231,Oct 24,The latest Chrome Canary version finally fixes the last few issues with its transparent navigation bar,https://t.co/DewqZwwg0V,3,33,,7.2K
https://twitter.com/AndroidPolice,@AndroidPolice,https://twitter.com/AndroidPolice/status/1716751352691364345,Oct 24,"Share your boarding passes and event tickets on Google Wallet, once it's rolled out",https://t.co/gA08vcztm5,2,2,35,8.1K
https://twitter.com/AndroidPolice,@AndroidPolice,https://twitter.com/AndroidPolice/status/1716722467870269674,Oct 24,"The Google Pixel 8 finally gets the latest Android 14 QPR1 build, a week after the rest of the lineup",https://t.co/d7lH7O5obL,3,9,77,11K
https://twitter.com/AndroidPolice,@AndroidPolice,https://twitter.com/AndroidPolice/status/1716651034674675940,Oct 24,Google keeps its promise of bringing the new text formatting options to your older notes as well,https://t.co/XkVlBLbTMb,5,78,,10K
https://twitter.com/AndroidPolice,@AndroidPolice,https://twitter.com/AndroidPolice/status/1716636855536427086,Oct 24,Google is tweaking Android’s emergency call feature to limit false alarms,https://t.co/G3YbfCVSI0,9,62,,10K
https://twitter.com/AndroidPolice,@AndroidPolice,https://twitter.com/AndroidPolice/status/1716617881985945915,Oct 24,At just over $50 the Earfun Air Pro 3 prove you can get good earbuds at an affordable price,https://t.co/f9qBQwNcaX,1,12,,7.8K
https://twitter.com/AndroidPolice,@AndroidPolice,https://twitter.com/AndroidPolice/status/1716598474454847947,Oct 24,"Speed meets affordability with 30% off Anker's 533 PowerCore 30W 10,000mAh power bank",https://t.co/w0My02hirT,24,,,7.6K
https://twitter.com/AndroidPolice,@AndroidPolice,https://twitter.com/AndroidPolice/status/1716583124803739802,Oct 24,Japan is accusing Google of violating its antimonopoly act and stifling competition,https://t.co/EZZLCrwVUf,3,36,,10K
https://twitter.com/AndroidPolice,@AndroidPolice,https://twitter.com/AndroidPolice/status/1716565179540832757,Oct 24,OnePlus could finally add some long-missing features to the OnePlus 12,https://t.co/UI8ZgPwQ6D,2,30,,8.1K
https://twitter.com/AndroidPolice,@AndroidPolice,https://twitter.com/AndroidPolice/status/1716497644304867603,Oct 23,Not sure which Motorola phones have wireless charging?,https://t.co/sPA1ZGVgjM,1,14,,7.2K
https://twitter.com/AndroidPolice,@AndroidPolice,https://twitter.com/AndroidPolice/status/1716491931214139526,Oct 23,Want a budget tablet? Samsung’s latest offering might just be the right pick for you,https://t.co/QO29LCM0M2,3,12,,7.2K
https://twitter.com/AndroidPolice,@AndroidPolice,https://twitter.com/AndroidPolice/status/1716487822956253463,Oct 23,Xiaomi sets a launch date for its next flagship series and MIUI replacement,https://t.co/IH7FBM4hT0,1,22,,8K
https://twitter.com/AndroidPolice,@AndroidPolice,https://twitter.com/AndroidPolice/status/1716470326291296324,Oct 23,A gaming keyboard without the bulk. Sleek and slim for the win,https://t.co/UtsTQTlUYx,2,1,19,7.5K
https://twitter.com/AndroidPolice,@AndroidPolice,https://twitter.com/AndroidPolice/status/1716466193437970757,Oct 23,WhatsApp is working on letting users hide their locked chats from the list of conversations,https://t.co/bOKaFtPLQO,3,40,,8.1K
https://twitter.com/AndroidPolice,@AndroidPolice,https://twitter.com/AndroidPolice/status/1716440454877569270,Oct 23,"Google may not officially support reading your body temperature yet, but here’s how to interpret current results",https://t.co/mklG9Zm1sS,2,42,,8.4K
https://twitter.com/AndroidPolice,@AndroidPolice,https://twitter.com/AndroidPolice/status/1716425887871062478,Oct 23,"Google's third-generation Tensor SoC is here in the Pixel 8 and 8 Pro. Here's all the news, features, and specs you need to know about.",https://t.co/VwEaJ2Kx7d,3,7,83,13K
https://twitter.com/AndroidPolice,@AndroidPolice,https://twitter.com/AndroidPolice/status/1716402899780026835,Oct 23,Let's investigate how the Galaxy Watch 6 and Pixel Watch 2 stack up side-by-side,https://t.co/3GqAa8VqTY,2,4,47,11K
https://twitter.com/AndroidPolice,@AndroidPolice,https://twitter.com/AndroidPolice/status/1716199620215226473,Oct 23,The Asus Chromebook Plus CX34 is everything you could want in a $400 laptop (except a touchscreen),https://t.co/kRVdi85UhY,4,33,,12K
https://twitter.com/AndroidPolice,@AndroidPolice,https://twitter.com/AndroidPolice/status/1716124178745594043,Oct 22,"Google Assistant is always a tap — or voice command — away, but how often do you actually use it on your phone?",https://t.co/HDrBRBmRaH,16,6,90,17K
https://twitter.com/AndroidPolice,@AndroidPolice,https://twitter.com/AndroidPolice/status/1716113365884453362,Oct 22,"I lived in the Bose QuietComfort Ultra for a week, and I can never go back",https://t.co/4Jg19oK0fS,1,3,44,12K
https://twitter.com/AndroidPolice,@AndroidPolice,https://twitter.com/AndroidPolice/status/1716057458274124173,Oct 22,"Now that the new Pixel 8 has been released, how does the phone's wireless charging perform? Will it support the Qi2 standard?",https://t.co/BKpyq4LCCJ,2,8,66,13K
https://twitter.com/AndroidPolice,@AndroidPolice,https://twitter.com/AndroidPolice/status/1716021231252656202,Oct 22,Instagram hops onboard with the themed icon trend a whole year after Android 13 brought dynamic theming,https://t.co/2jCyvFW1jm,5,9,129,17K
https://twitter.com/AndroidPolice,@AndroidPolice,https://twitter.com/AndroidPolice/status/1715719923962421589,Oct 21,Looking for some Halloween games? Here are the best of the best,https://t.co/JaZuLutHvq,2,36,,10K
https://twitter.com/AndroidPolice,@AndroidPolice,https://twitter.com/AndroidPolice/status/1715709700161896842,Oct 21,Google has updated the foldable and tablet versions of the Gmail app with a renewed focus on multitasking,https://t.co/74L0p6xbnZ,45,,,9.9K
https://twitter.com/AndroidPolice,@AndroidPolice,https://twitter.com/AndroidPolice/status/1715696695005094260,Oct 21,Forget about the future of wireless charging if you buy a Pixel 8 Pro,https://t.co/2eQUfkUBLB,3,4,63,13K
https://twitter.com/AndroidPolice,@AndroidPolice,https://twitter.com/AndroidPolice/status/1715684486933799158,Oct 21,"The Google Pixel 8 has a new local multi-language dictation model, and it's pretty good",https://t.co/jCsRVpBZ1j,4,66,,10K
https://twitter.com/AndroidPolice,@AndroidPolice,https://twitter.com/AndroidPolice/status/1715676376148103503,Oct 21,"New installs of Brave Browser on Windows are coming bundled with the company's VPN services, even if you didn't ask for it",https://t.co/gr1sJlhU7i,2,8,48,11K
https://twitter.com/AndroidPolice,@AndroidPolice,https://twitter.com/AndroidPolice/status/1715659271117930768,Oct 21,YouTube Music integration on HomePod is limited to Premium subscribers,https://t.co/feTE4YeVHr,5,19,,9.7K
https://twitter.com/AndroidPolice,@AndroidPolice,https://twitter.com/AndroidPolice/status/1715646099380117576,Oct 21,Google Messages might finally ditch the QR code hassle and let you text from the web without scanning,https://t.co/3vLg0KXPsz,3,9,77,11K
https://twitter.com/AndroidPolice,@AndroidPolice,https://twitter.com/AndroidPolice/status/1715554988221428047,Oct 21,Apple's Wallet might need to watch its back with Google's rapid advancements,https://t.co/CfN3DIrTpu,2,3,60,10K
https://twitter.com/AndroidPolice,@AndroidPolice,https://twitter.com/AndroidPolice/status/1715547440588189857,Oct 21,Google's RCS begging invades the app store... that Apple doesn't care about,https://t.co/0RHYp87jID,1,7,69,12K
https://twitter.com/AndroidPolice,@AndroidPolice,https://twitter.com/AndroidPolice/status/1715538734517490119,Oct 21,Comment pausing on YouTube may help you manage video feedback,https://t.co/Qb4wbfmZRR,1,3,42,11K
https://twitter.com/AndroidPolice,@AndroidPolice,https://twitter.com/AndroidPolice/status/1715504653465473513,Oct 21,"If you’re looking for a new smartwatch at a great price, start here",https://t.co/swSjmq5h3i,1,13,,8.7K
https://twitter.com/AndroidPolice,@AndroidPolice,https://twitter.com/AndroidPolice/status/1715471150145245620,Oct 21,"New Pixel, new accessories, and a ton of background work to ensure perfection",https://t.co/7n3YZkh3Kr,1,20,,7.9K
https://twitter.com/AndroidPolice,@AndroidPolice,https://twitter.com/AndroidPolice/status/1715454623882838440,Oct 21,"Before you buy Samsung's latest watches, let's make sure you get the best deal on it",https://t.co/crtlLlbRzX,10,,,7.3K
https://twitter.com/AndroidPolice,@AndroidPolice,https://twitter.com/AndroidPolice/status/1715443448185081962,Oct 21,Both of these high-end Bose earbuds deliver best-in-class sound quality and active noise cancelling,https://t.co/k31DXBpTyX,11,,,7.5K
https://twitter.com/AndroidPolice,@AndroidPolice,https://twitter.com/AndroidPolice/status/1715436199161032753,Oct 21,Google Photos will back up RAW images by default and eat your data,https://t.co/65OixJMsQN,2,4,67,11K
https://twitter.com/AndroidPolice,@AndroidPolice,https://twitter.com/AndroidPolice/status/1715427652201279938,Oct 20,Safely surf the web at a ridiculously cheap price with Surfshark's insane VPN deal,https://t.co/IpXKe0wEIv,2,11,,7.2K
https://twitter.com/AndroidPolice,@AndroidPolice,https://twitter.com/AndroidPolice/status/1715420236218835290,Oct 20,Not sure if a particular file type works with ChromeOS?,https://t.co/kavBhdrcCP,3,15,,8.1K
https://twitter.com/AndroidPolice,@AndroidPolice,https://twitter.com/AndroidPolice/status/1715404772742685050,Oct 20,Use these keyboard shortcuts to make your Chromebook experience quicker and more efficient,https://t.co/ww19nWylpG,1,2,24,9.2K
https://twitter.com/AndroidPolice,@AndroidPolice,https://twitter.com/AndroidPolice/status/1715391471208091773,Oct 20,This article is sponsored by OnePlus,https://t.co/mCZBFs82QQ,18,,,6.6K
https://twitter.com/AndroidPolice,@AndroidPolice,https://twitter.com/AndroidPolice/status/1715383470132719777,Oct 20,The $250 Jabra Elite 10 are super comfortable and sound nice to boot,https://t.co/bjHKWCE8DJ,10,,,6.7K
https://twitter.com/AndroidPolice,@AndroidPolice,https://twitter.com/AndroidPolice/status/1715382787404927346,Oct 20,How will the Google Pixel 8's screen perform? Does the new Pixel improve on its predecessor's refresh rate?,https://t.co/7hWTYixHxm,3,21,,7.2K
https://twitter.com/AndroidPolice,@AndroidPolice,https://twitter.com/AndroidPolice/status/1715376788996562972,Oct 20,"It's still early days for the Pixel 8a, but we've already started to hear rumors about Google's next midrange phone",https://t.co/A8mcX5jGyV,1,33,,9.1K
https://twitter.com/AndroidPolice,@AndroidPolice,https://twitter.com/AndroidPolice/status/1715365610417250504,Oct 20,"Samsung's latest Fan Edition tablet comes in two sizes, but which one should you buy?",https://t.co/iYtFhmMHJg,11,,,6.6K
https://twitter.com/AndroidPolice,@AndroidPolice,https://twitter.com/AndroidPolice/status/1715357186249908429,Oct 20,Google starts marketing Play Games Beta content to PC users through its website,https://t.co/ww2AgksGeW,1,21,,7.6K
https://twitter.com/AndroidPolice,@AndroidPolice,https://twitter.com/AndroidPolice/status/1715348659582165498,Oct 20,Google has dethroned Samsung as the update king. Should Samsung return to Exynos in order to compete?,https://t.co/E6KTHgdUBC,10,3,59,12K
https://twitter.com/AndroidPolice,@AndroidPolice,https://twitter.com/AndroidPolice/status/1715330925679014228,Oct 20,Google says a combination of new sensors and improved AI algorithms help improve heart rate tracking on the Pixel Watch 2,https://t.co/5TpiqUh1sE,1,2,31,7.9K
https://twitter.com/AndroidPolice,@AndroidPolice,https://twitter.com/AndroidPolice/status/1715317728611872871,Oct 20,"FCC opens 6GHz band for low power devices, ushering in a new era of wireless connectivity",https://t.co/dj8mwQE7Wp,4,36,,8.2K
https://twitter.com/AndroidPolice,@AndroidPolice,https://twitter.com/AndroidPolice/status/1715293497492754670,Oct 20,Samsung's next Galaxy Watches might soon sport fancy Micro LED screens,https://t.co/FNnuBhmsTk,2,28,,8.6K
https://twitter.com/AndroidPolice,@AndroidPolice,https://twitter.com/AndroidPolice/status/1715170536685212086,Oct 20,Finally plugging a massive corporate data loophole,https://t.co/kwDxJGlQhb,2,35,,7.9K
https://twitter.com/AndroidPolice,@AndroidPolice,https://twitter.com/AndroidPolice/status/1715154693473640689,Oct 20,Get a free $10 Amazon gift card with Galaxy Buds FE purchase for a limited time,https://t.co/bLCdVqed3o,9,,,7.3K
https://twitter.com/AndroidPolice,@AndroidPolice,https://twitter.com/AndroidPolice/status/1715148988502962235,Oct 20,How safe the OnePlus Open around water — let's find out!,https://t.co/CwTI9pBAJI,17,,,7.3K
