UserId_Url,UserId,Tweet_Url,Date-Time,Tweets,,Comments,Retweets,Likes,Impressions
https://twitter.com/AndroidPolice,@AndroidPolice,https://twitter.com/AndroidPolice/status/1712800360148914668,Oct 13,"Good mid-range earbuds with no real faults, the JBL Vibe 200s come at an entry-level price for the rest of October Prime Day",https://t.co/UBu2vNgVnb,6,,,5.5K
https://twitter.com/AndroidPolice,@AndroidPolice,https://twitter.com/AndroidPolice/status/1712790826009453029,Oct 13,We reviewed this discounted tech at Android Police so you spend wisely on Prime Day,https://t.co/tstvzZcfJj,1,21,,7.4K
https://twitter.com/AndroidPolice,@AndroidPolice,https://twitter.com/AndroidPolice/status/1712782804835082474,Oct 13,Turn the music up and save big on Beats headphones and earbuds during Prime Big Deal Days,https://t.co/C2hJHfsknk,5,,,5.8K
https://twitter.com/AndroidPolice,@AndroidPolice,https://twitter.com/AndroidPolice/status/1712775805963530545,Oct 13,Have you noticed your Pixel Watch taking longer to charge than initially advertised?,https://t.co/TjnpDMZvs2,6,31,,8K
https://twitter.com/AndroidPolice,@AndroidPolice,https://twitter.com/AndroidPolice/status/1712768897412161942,Oct 13,Honor's third foldable of the year is here,https://t.co/n4RVVfIFVs,3,13,,6.5K
https://twitter.com/AndroidPolice,@AndroidPolice,https://twitter.com/AndroidPolice/status/1712761282565144948,Oct 13,Amazon’s Fall Prime Day deals on Roomba robot vacuums let you upgrade your home cleaning game for cheap,https://t.co/FCNjK5I3M5,1,7,,5.9K
https://twitter.com/AndroidPolice,@AndroidPolice,https://twitter.com/AndroidPolice/status/1712753718142157022,Oct 13,Save over 70% on Norton 360 Deluxe software to keep your tech safe,https://t.co/Hgo4u9R8kR,7,,,5.2K
https://twitter.com/AndroidPolice,@AndroidPolice,https://twitter.com/AndroidPolice/status/1712679761019863314,Oct 13,"Whether it is to keep an eye on your home while away or to check in on your roses, this $55 Ring Video Doorbell deal is the way to go",https://t.co/kT2nL5UqWi,12,,,6.7K
https://twitter.com/AndroidPolice,@AndroidPolice,https://twitter.com/AndroidPolice/status/1712674227923402881,Oct 13,Amazon Prime Big Deal Days brings Roku's cheapest streaming devices to an even better price,https://t.co/GmoANowvxF,7,,,6.5K
https://twitter.com/AndroidPolice,@AndroidPolice,https://twitter.com/AndroidPolice/status/1712668556712710595,Oct 13,Have some fun finding the Spigen case and magnetic accessories that will take your Pixel 8’s looks and functionality to the next level,https://t.co/XnujWlwR4j,1,27,,7.4K
https://twitter.com/AndroidPolice,@AndroidPolice,https://twitter.com/AndroidPolice/status/1712662995451416912,Oct 13,Pixel 8 and Pixel 8 Pro step bodly into Android 14 QPR1 Beta,https://t.co/4D99pin6aA,25,,,6.9K
https://twitter.com/AndroidPolice,@AndroidPolice,https://twitter.com/AndroidPolice/status/1712657266640294400,Oct 13,Microsoft's suite of essential apps is at its best price yet for the next four days,https://t.co/GQUJGrDdMM,14,,,6.6K
https://twitter.com/AndroidPolice,@AndroidPolice,https://twitter.com/AndroidPolice/status/1712651929422110742,Oct 13,"The Google Pixel 8 looks set to impress with a wealth of great features, but how does it handle wireless charging?",https://t.co/zgNBxY8Zc6,1,2,28,7.4K
https://twitter.com/AndroidPolice,@AndroidPolice,https://twitter.com/AndroidPolice/status/1712646797611442239,Oct 13,Avoid bloat by deleting preinstalled apps,https://t.co/IIx3issytP,1,1,29,7.3K
https://twitter.com/AndroidPolice,@AndroidPolice,https://twitter.com/AndroidPolice/status/1712641312573227286,Oct 13,The foldable market is about to get a new entrant soon,https://t.co/7c2WjwSNuW,2,13,,6.4K
https://twitter.com/AndroidPolice,@AndroidPolice,https://twitter.com/AndroidPolice/status/1712635779963297887,Oct 13,The Google Pixel 8 Pro thankfully has a smaller screen density than its predecessor,https://t.co/69Hs68BTDV,2,31,,8.3K
https://twitter.com/AndroidPolice,@AndroidPolice,https://twitter.com/AndroidPolice/status/1712630373706854739,Oct 13,Two high-end camera features and an external display mode didn’t make it to the Pixel 8 series,https://t.co/6SyUTCnWpu,18,,,6K
https://twitter.com/AndroidPolice,@AndroidPolice,https://twitter.com/AndroidPolice/status/1712624786159829454,Oct 13,Some people are seeing a new 'Enable location permissions' task in Opinion Rewards,https://t.co/FBHuyzH2hl,1,1,25,6.9K
https://twitter.com/AndroidPolice,@AndroidPolice,https://twitter.com/AndroidPolice/status/1712619611374354690,Oct 13,"While it may be sacrilege, no Android tablet can touch the 10.2-inch iPad at this price",https://t.co/zAo2dEvK3V,8,,,5.4K
https://twitter.com/AndroidPolice,@AndroidPolice,https://twitter.com/AndroidPolice/status/1712614424333156522,Oct 13,These are the smartphone accessories people are buying for Prime Day — and you still have time to snag them!,https://t.co/DjyE53ABXR,6,,,5.1K
https://twitter.com/AndroidPolice,@AndroidPolice,https://twitter.com/AndroidPolice/status/1712607439873306964,Oct 13,A splash of color and design tweaks coming to your Android Chrome browser,https://t.co/3To3DjzMBT,3,19,,6.1K
https://twitter.com/AndroidPolice,@AndroidPolice,https://twitter.com/AndroidPolice/status/1712599083402047537,Oct 13,Google’s new ringtone collection for Pixel devices brings the vibe we’ve all been craving,https://t.co/xqdSKBLErI,1,38,,6.6K
https://twitter.com/AndroidPolice,@AndroidPolice,https://twitter.com/AndroidPolice/status/1712591356575600739,Oct 13,The development of the tab grouping feature was first spotted in Chrome 119,https://t.co/Kx053vzssx,16,,,5.9K
https://twitter.com/AndroidPolice,@AndroidPolice,https://twitter.com/AndroidPolice/status/1712582635984171076,Oct 13,A redesigned WhatsApp UI is slowly reaching beta testers,https://t.co/FMri2N8kJd,1,2,28,7.6K
https://twitter.com/AndroidPolice,@AndroidPolice,https://twitter.com/AndroidPolice/status/1712562839825604900,Oct 13,Sony’s incredible XM4 ANC headphones are $100 cheaper for Prime Day,https://t.co/aQ5ztR3sWd,10,,,5.6K
https://twitter.com/AndroidPolice,@AndroidPolice,https://twitter.com/AndroidPolice/status/1712540232740966418,Oct 13,OnePlus provides solid alternatives to the Google and Samsung devices that flood the Android market every here — here are the best OnePlus Phone deals,https://t.co/iHv9LbcsVn,23,,,6.1K
https://twitter.com/AndroidPolice,@AndroidPolice,https://twitter.com/AndroidPolice/status/1712519049165373924,Oct 12,Add a Google Nest Video Doorbell to your home at a great price this holiday season,https://t.co/s6hhu5PgyQ,7,,,5.1K
https://twitter.com/AndroidPolice,@AndroidPolice,https://twitter.com/AndroidPolice/status/1712499105493049362,Oct 12,This Govee LED smart light strip is the cheapest way to get smart lights this Prime Day,https://t.co/ZwggyNr6e6,2,10,,5K
https://twitter.com/AndroidPolice,@AndroidPolice,https://twitter.com/AndroidPolice/status/1712491101515382907,Oct 12,We’ve spotted YouTube’s background glow effect on fullscreen videos,https://t.co/7siT0NMRkx,3,20,,6.9K
https://twitter.com/AndroidPolice,@AndroidPolice,https://twitter.com/AndroidPolice/status/1712485884027961407,Oct 12,Vanilla Android may learn a data SIM switching trick from other popular Android ROMs,https://t.co/XrILFE2jNa,3,5,40,9.1K
https://twitter.com/AndroidPolice,@AndroidPolice,https://twitter.com/AndroidPolice/status/1712480030872469524,Oct 12,Amazon isn't the only big deal around. Walmart's Holiday Kickoff sales event has some tasty deals on just about everything imaginable.,https://t.co/mHq3APpUPd,14,,,5K
https://twitter.com/AndroidPolice,@AndroidPolice,https://twitter.com/AndroidPolice/status/1712472647869858042,Oct 12,Real bargain hunters know there are plenty of amazing deals for under $50,https://t.co/sLvpdq6gOX,6,,,5.1K
https://twitter.com/AndroidPolice,@AndroidPolice,https://twitter.com/AndroidPolice/status/1712464734430343583,Oct 12,The Pixel Troubleshooting app for the Pixel 8 is your one-stop shop for fixing common battery and network troubles,https://t.co/6BLVC9zj7L,2,5,31,7.2K
https://twitter.com/AndroidPolice,@AndroidPolice,https://twitter.com/AndroidPolice/status/1712459219100946579,Oct 12,Launch day discounts on the Motorola Edge shave $100 off the retail price,https://t.co/pjAwQaCFBI,5,,,5.1K
https://twitter.com/AndroidPolice,@AndroidPolice,https://twitter.com/AndroidPolice/status/1712453265969885263,Oct 12,October Prime Day is bringing the price of the Galaxy Tab A8 down to just $160,https://t.co/KuUsbkPY7q,6,,,4.6K
https://twitter.com/AndroidPolice,@AndroidPolice,https://twitter.com/AndroidPolice/status/1712447533270609953,Oct 12,Juggling your reminders and tasks between Android and iOS? This workaround will make them work together,https://t.co/w88JC0R8Wf,1,17,,5.4K
https://twitter.com/AndroidPolice,@AndroidPolice,https://twitter.com/AndroidPolice/status/1712441604177383568,Oct 12,"The new WhatsApp beta for Android contains a new Event option, allowing Community groups to create a chat-based event",https://t.co/I5ZNl7abSw,1,1,13,5.4K
https://twitter.com/AndroidPolice,@AndroidPolice,https://twitter.com/AndroidPolice/status/1712436171484102928,Oct 12,Android 14 for Nothing Phone 2 will bring Nothing OS 2.5 with several improvements,https://t.co/YULSQujwaQ,1,1,18,6K
https://twitter.com/AndroidPolice,@AndroidPolice,https://twitter.com/AndroidPolice/status/1712430156520767944,Oct 12,Check out these voice controlled smart thermostats that monitors your home temperature for less,https://t.co/mIJXLJ2uQU,1,10,,5.4K
https://twitter.com/AndroidPolice,@AndroidPolice,https://twitter.com/AndroidPolice/status/1712424442381353045,Oct 12,Google is making it easy to transfer your eSIM between Pixels,https://t.co/gkA5zin9Xv,2,2,37,7.1K
https://twitter.com/AndroidPolice,@AndroidPolice,https://twitter.com/AndroidPolice/status/1712418514374410675,Oct 12,These sub-$90 noise-cancelling Sony WF-C700N earbuds are among the best last-minute October Prime Day deals,https://t.co/I74PlehaEQ,6,,,5.3K
https://twitter.com/AndroidPolice,@AndroidPolice,https://twitter.com/AndroidPolice/status/1712412944355479630,Oct 12,"Android users love them, and new iPhone users need them. Thankfully, UGreen has up to 40% off its best accessories.",https://t.co/CB8MZAIjl3,10,,,5.8K
https://twitter.com/AndroidPolice,@AndroidPolice,https://twitter.com/AndroidPolice/status/1712407748430688614,Oct 12,"PopSockets look great, and they make it easier to hold your phone, too. That's a win, so enjoy this Prime Day deal that's up to 24% off",https://t.co/AGFqlyXW5G,7,,,4.8K
https://twitter.com/AndroidPolice,@AndroidPolice,https://twitter.com/AndroidPolice/status/1712402305457221693,Oct 12,Google might gatekeep the new Assistant with Bard to its phones at first,https://t.co/2tgkNzLe25,7,3,57,10K
https://twitter.com/AndroidPolice,@AndroidPolice,https://twitter.com/AndroidPolice/status/1712396638172467627,Oct 12,Don't pay hundreds of dollars for Pixel or Galaxy earbuds when you can snag Jabra Elite headphones for half the price,https://t.co/QRCblN7X0U,2,7,,5.4K
https://twitter.com/AndroidPolice,@AndroidPolice,https://twitter.com/AndroidPolice/status/1712390599788077291,Oct 12,The Backbone One is the Android game controller deal we were waiting for this Prime Day,https://t.co/CLqdf6jw3T,6,,,5K
https://twitter.com/AndroidPolice,@AndroidPolice,https://twitter.com/AndroidPolice/status/1712384566915194970,Oct 12,Save 70% on the Treblab WX8 during October Prime Day,https://t.co/ClCjfnuhYu,1,9,,5.4K
https://twitter.com/AndroidPolice,@AndroidPolice,https://twitter.com/AndroidPolice/status/1712367243676258388,Oct 12,Expand your smart home on the cheap with TP-Link Kasa smart plugs down to almost half price,https://t.co/Rx4VEY0ecp,1,10,,5.5K
https://twitter.com/AndroidPolice,@AndroidPolice,https://twitter.com/AndroidPolice/status/1712264685850947906,Oct 12,"Between allergies, air pollution, wildfires, and flu season, you'd be crazy not to have one",https://t.co/t53w8MBhNC,1,11,,6.6K
https://twitter.com/AndroidPolice,@AndroidPolice,https://twitter.com/AndroidPolice/status/1712259370874995049,Oct 12,Only a few hours remain to snag some of these brand-name tech gadgets and accessories at staggering Prime Big Deal Days discounts,https://t.co/TLqfaIM5H3,6,,,6.3K
https://twitter.com/AndroidPolice,@AndroidPolice,https://twitter.com/AndroidPolice/status/1712251798025613392,Oct 12,A longtime camera mode is about to be phased out when the Google Pixel 8 releases,https://t.co/aF0skFYa6Z,2,20,,7.6K
https://twitter.com/AndroidPolice,@AndroidPolice,https://twitter.com/AndroidPolice/status/1712241096191848501,Oct 12,"The minimalistic Magic Vs2 will feel more like an affordable, pocketable tablet",https://t.co/WTlwrk8Iqk,2,10,,5.3K
https://twitter.com/AndroidPolice,@AndroidPolice,https://twitter.com/AndroidPolice/status/1712224546344841594,Oct 12,This 50%-off Prime deal on the Sony XB910Ns puts premium ANC headphones well within reach,https://t.co/uvnn2u5Jdr,1,11,,5.7K
https://twitter.com/AndroidPolice,@AndroidPolice,https://twitter.com/AndroidPolice/status/1712215471720677560,Oct 12,Check out these low low prices that are still available as Prime Day comes to an end,https://t.co/Bkp30OkpdL,9,,,5.3K
https://twitter.com/AndroidPolice,@AndroidPolice,https://twitter.com/AndroidPolice/status/1712196616826859634,Oct 12,Google is working quickly to restore a Nest feature it previously removed because of Sonos' lawsuit,https://t.co/Q8O0QfMxjM,1,13,,5.8K
https://twitter.com/AndroidPolice,@AndroidPolice,https://twitter.com/AndroidPolice/status/1712187772075733391,Oct 12,Customers will supposedly start being notified of the changes on October 17,https://t.co/ayDUVlmlHz,3,7,24,10K
https://twitter.com/AndroidPolice,@AndroidPolice,https://twitter.com/AndroidPolice/status/1712177393593426388,Oct 12,HDR images are crisper and more vibrant with greater contrast,https://t.co/RCeKHQ6tq7,4,30,,7.2K
https://twitter.com/AndroidPolice,@AndroidPolice,https://twitter.com/AndroidPolice/status/1712164572168077512,Oct 11,Keyboard deals that a professional writer recommends,https://t.co/UjB7JIPR0t,1,12,,5.8K
https://twitter.com/AndroidPolice,@AndroidPolice,https://twitter.com/AndroidPolice/status/1712157508121325766,Oct 11,The Samsung Frame TV is heavily discounted across all sizes this Prime Day,https://t.co/iCJAa5ZMkK,2,6,,4.9K
https://twitter.com/AndroidPolice,@AndroidPolice,https://twitter.com/AndroidPolice/status/1712152828712489415,Oct 11,The Google Pixel Watch 2 is what we hoped the first-gen Pixel Watch would be,https://t.co/RYBn7GK4Tg,1,2,21,5.3K
https://twitter.com/AndroidPolice,@AndroidPolice,https://twitter.com/AndroidPolice/status/1712152826627907707,Oct 11,"In our Pixel 8 review, it becomes clear Google has fixed almost every gripe",https://t.co/uNmPMBA17b,2,33,,7.2K
https://twitter.com/AndroidPolice,@AndroidPolice,https://twitter.com/AndroidPolice/status/1712152824375635978,Oct 11,"The Pixel 8 Pro levels up Google's smartphone experience, but you'll have to be ready to pay for it",https://t.co/OepsS4vzUP,2,30,,6.3K
https://twitter.com/AndroidPolice,@AndroidPolice,https://twitter.com/AndroidPolice/status/1712150640988651706,Oct 11,"Make your lights brighter, bolder, and more smarter with Philips Hue and these excellent Prime Day deals",https://t.co/a40QlX0fA5,2,1,4,4.5K
https://twitter.com/AndroidPolice,@AndroidPolice,https://twitter.com/AndroidPolice/status/1712144175582355865,Oct 11,"Don't sleep on the sales happening outside of Amazon's Prime Big Deal Days, you'll be surprised at what you find.",https://t.co/i4fn3rmy5w,2,8,,5.3K
https://twitter.com/AndroidPolice,@AndroidPolice,https://twitter.com/AndroidPolice/status/1712127877800444385,Oct 11,Apple AirPods (2nd generation) drop $40 in price for Fall savings on Prime Day,https://t.co/wuGalqWFkj,7,,,4.7K
https://twitter.com/AndroidPolice,@AndroidPolice,https://twitter.com/AndroidPolice/status/1712121636395127045,Oct 11,Great sound and features at a ridiculously reasonable price,https://t.co/aQbWCksTNp,5,,,4.8K
https://twitter.com/AndroidPolice,@AndroidPolice,https://twitter.com/AndroidPolice/status/1712117665534218546,Oct 11,"The Samsung Galaxy Buds 2 were a great deal yesterday, and are irresistible now they're another $10 cheaper",https://t.co/06ozgOlGdL,11,,,5.4K
https://twitter.com/AndroidPolice,@AndroidPolice,https://twitter.com/AndroidPolice/status/1712112238939480486,Oct 11,"Google just announced the Pixel 8, so there aren't any deals on it right now. But in about 45 days, you'll have much better luck.",https://t.co/edPKNPRFXc,4,35,,7.6K
https://twitter.com/AndroidPolice,@AndroidPolice,https://twitter.com/AndroidPolice/status/1712107114804523499,Oct 11,These smart garage door openers are available at unbeatable discounts for Prime Day,https://t.co/9EpILSZsXc,1,7,,4.8K
https://twitter.com/AndroidPolice,@AndroidPolice,https://twitter.com/AndroidPolice/status/1712102745094647922,Oct 11,Clean up with up to 45% off these Roborock vacuums,https://t.co/Y1LOxYJKnm,4,,,4.6K
https://twitter.com/AndroidPolice,@AndroidPolice,https://twitter.com/AndroidPolice/status/1712059759380119647,Oct 11,Gmail's emoji reactions will give you an easy and quick way to react to emails,https://t.co/TLd43meg7e,2,18,,5.6K
https://twitter.com/AndroidPolice,@AndroidPolice,https://twitter.com/AndroidPolice/status/1712054304398270911,Oct 11,Enpass can generate a single passkey for you to use across multiple devices,https://t.co/QKc2apZpGg,5,17,,5.9K
https://twitter.com/AndroidPolice,@AndroidPolice,https://twitter.com/AndroidPolice/status/1712049079000199315,Oct 11,"Monitor people, packages, and everything in between",https://t.co/UPFW1Lil4E,5,,,5.1K
https://twitter.com/AndroidPolice,@AndroidPolice,https://twitter.com/AndroidPolice/status/1712042808456949888,Oct 11,The OnePlus Open is an open book thanks to leaked renders,https://t.co/ALN2RAnCwr,1,15,,5.7K
https://twitter.com/AndroidPolice,@AndroidPolice,https://twitter.com/AndroidPolice/status/1712035559919501513,Oct 11,"The JBL Go 3 is one of the best portable speakers around, and now it's half price",https://t.co/KEZIW1XDgo,2,3,,5.3K
https://twitter.com/AndroidPolice,@AndroidPolice,https://twitter.com/AndroidPolice/status/1711975019771830718,Oct 11,Amazon is knocking $60 off the Nest Cam for Prime Day,https://t.co/0QvzBgiSyq,1,10,,6.2K
https://twitter.com/AndroidPolice,@AndroidPolice,https://twitter.com/AndroidPolice/status/1711969865399972321,Oct 11,You’re basically getting double the storage for less than the price of the 256GB Galaxy Z Flip 5,https://t.co/KohOCv803w,9,,,5.8K
https://twitter.com/AndroidPolice,@AndroidPolice,https://twitter.com/AndroidPolice/status/1711964889130951112,Oct 11,Snag a true adventurer's wearable at an unbeatable price during Amazon Prime Big Deal Days,https://t.co/B7Jp09rdpG,1,1,9,6.7K
https://twitter.com/AndroidPolice,@AndroidPolice,https://twitter.com/AndroidPolice/status/1711960158274834726,Oct 11,How often can Sega discontinue support for its paid mobile games before gamers cut the company off?,https://t.co/16JpqqZ5ca,10,,,6.1K
https://twitter.com/AndroidPolice,@AndroidPolice,https://twitter.com/AndroidPolice/status/1711902214015390152,Oct 11,At over 40% off Anker's nifty magnetic wireless portable charger is a must-have,https://t.co/DkE2bCDLus,14,,,6.3K
https://twitter.com/AndroidPolice,@AndroidPolice,https://twitter.com/AndroidPolice/status/1711898183771574281,Oct 11,"One of this Prime Day’s most practical, affordable deals",https://t.co/4JGWXztaU5,1,9,,6K
https://twitter.com/AndroidPolice,@AndroidPolice,https://twitter.com/AndroidPolice/status/1711893472905425131,Oct 11,Sony’s latest and greatest WF-10000 XM5 earbuds see their first drop in price,https://t.co/32VDJYa68K,7,,,5.6K
https://twitter.com/AndroidPolice,@AndroidPolice,https://twitter.com/AndroidPolice/status/1711880064361447765,Oct 11,Google's great wired indoor Nest security camera just got a big discount for Prime Day,https://t.co/hdLf04a8H4,1,11,,5.4K
https://twitter.com/AndroidPolice,@AndroidPolice,https://twitter.com/AndroidPolice/status/1711868261145411647,Oct 11,Google Pixel Watch 2 stock is rapidly drying up,https://t.co/VFC0rhJet0,31,,,6.5K
https://twitter.com/AndroidPolice,@AndroidPolice,https://twitter.com/AndroidPolice/status/1711863054290305202,Oct 11,The Amazon Prime Big Deal Days sale is slashing $70 on the asking price of the TicWatch Pro 5,https://t.co/D7UWnHVVjb,7,,,5.2K
https://twitter.com/AndroidPolice,@AndroidPolice,https://twitter.com/AndroidPolice/status/1711858173366157539,Oct 11,It's Android 14 beta time for the Samsung Galaxy Z Flip 5 now,https://t.co/TXghNgC67y,2,13,,5.3K
https://twitter.com/AndroidPolice,@AndroidPolice,https://twitter.com/AndroidPolice/status/1711835342624395601,Oct 11,"The Moto G Play might not have flagship hardware, but it's unbeatable value at this price",https://t.co/kcn3GFNTPx,6,,,5.1K
https://twitter.com/AndroidPolice,@AndroidPolice,https://twitter.com/AndroidPolice/status/1711830507518820470,Oct 11,Ready to save 20% on TerraMaster's impressive T6-423? Now's the time!,https://t.co/YxQSefkNsU,7,,,5.1K
https://twitter.com/AndroidPolice,@AndroidPolice,https://twitter.com/AndroidPolice/status/1711825121264988264,Oct 11,"Google didn't reinvent the wheel with the Pixel Watch 2, and that's okay",https://t.co/xkNvS33LFZ,3,37,,6.6K
https://twitter.com/AndroidPolice,@AndroidPolice,https://twitter.com/AndroidPolice/status/1711820537377271832,Oct 11,Get bass you can feel in your gut for just $250 this Prime Day,https://t.co/xFrubKLlAQ,7,,,5.2K
https://twitter.com/AndroidPolice,@AndroidPolice,https://twitter.com/AndroidPolice/status/1711813960284905980,Oct 11,Skip smartwatch battery anxiety and save up to 33% on these impressive Amazfit wearables,https://t.co/sHlADj6MJ7,1,8,,5.8K
https://twitter.com/AndroidPolice,@AndroidPolice,https://twitter.com/AndroidPolice/status/1711810051009126629,Oct 10,Save $100 on the new OnePlus Buds Pro 2 with Prime Day 2.0,https://t.co/5jLX434fAH,10,,,5K
https://twitter.com/AndroidPolice,@AndroidPolice,https://twitter.com/AndroidPolice/status/1711804887380512771,Oct 10,"Sony's SRS-XB13 offers booming sound in a small package, and it's at its best price yet during Prime Day",https://t.co/fxd9gEcMM4,6,5K,,
https://twitter.com/AndroidPolice,@AndroidPolice,https://twitter.com/AndroidPolice/status/1711791420573434023,Oct 10,See dead-to-toe and from the sky whoever is at your front door with the Ring Video Doorbell Pro 2 for $100 less on Prime Day,https://t.co/aahS6FtHsP,8,,,5K
https://twitter.com/AndroidPolice,@AndroidPolice,https://twitter.com/AndroidPolice/status/1711782405172818046,Oct 10,You can get the Google Pixel Tablet for $409 this Prime Day,https://t.co/nD7EBjuMp3,1,32,,6.4K
https://twitter.com/AndroidPolice,@AndroidPolice,https://twitter.com/AndroidPolice/status/1711770653609579007,Oct 10,Add a Google Nest Video Doorbell to your home at a great price this holiday season,https://t.co/qnQu7Wuwe0,1,10,,4.8K
https://twitter.com/AndroidPolice,@AndroidPolice,https://twitter.com/AndroidPolice/status/1711758153841311923,Oct 10,"Google's Pixel 7a is now a no-brainer at $400, making it one of the best values on the market",https://t.co/6o9VBuLUHL,1,1,36,6.2K
https://twitter.com/AndroidPolice,@AndroidPolice,https://twitter.com/AndroidPolice/status/1711753486235275551,Oct 10,Get the Pixel Buds Pro for $80 off before they get even better with new software updates,https://t.co/huJK22b43L,1,20,,5.6K
https://twitter.com/AndroidPolice,@AndroidPolice,https://twitter.com/AndroidPolice/status/1711748321528676366,Oct 10,Motorola's flagship Razr+ is getting a big discount for Prime Big Deal Days,https://t.co/wpN2dqB1H6,9,,,5K
https://twitter.com/AndroidPolice,@AndroidPolice,https://twitter.com/AndroidPolice/status/1711743584699888121,Oct 10,The Google Pixel Buds A-Series are on sale with a remarkable 40% discount for Amazon Prime Big Deal Days,https://t.co/3xbsR9cmif,1,17,,5.1K
https://twitter.com/AndroidPolice,@AndroidPolice,https://twitter.com/AndroidPolice/status/1711735836872466485,Oct 10,Google has just artificially limited the pro camera controls to the Pixel 8 Pro,https://t.co/pheNAw7Esw,8,10,103,12K
https://twitter.com/AndroidPolice,@AndroidPolice,https://twitter.com/AndroidPolice/status/1711730828802130408,Oct 10,"The Samsung Galaxy A54 is one of our favorite mid-range phones, and you can get it for just $330 during Prime Day",https://t.co/0ERnsY08IH,19,,,5.2K
https://twitter.com/AndroidPolice,@AndroidPolice,https://twitter.com/AndroidPolice/status/1711729153064452494,Oct 10,Move over Pixel 8 — Motorola's affordable Razr is on its way to the US for a surprisingly low price,https://t.co/dFHRUxlc6z,2,3,14,8.3K
https://twitter.com/AndroidPolice,@AndroidPolice,https://twitter.com/AndroidPolice/status/1711722887286038922,Oct 10,"5 years ago this week, Google announced the death of Google+, and these 5 fantastic features are still missing from modern social media",https://t.co/40lPuPP1Qy,1,20,73,13K
https://twitter.com/AndroidPolice,@AndroidPolice,https://twitter.com/AndroidPolice/status/1711720777941135406,Oct 10,Save on,https://t.co/PdJrxTHQlz,8,,,4.5K
https://twitter.com/AndroidPolice,@AndroidPolice,https://twitter.com/AndroidPolice/status/1711718200973414599,Oct 10,"The Pixel Watch is still a great smartwatch even with a new model out, and it can be yours for just $210",https://t.co/a8ISuRZJIs,15,,,5.1K
https://twitter.com/AndroidPolice,@AndroidPolice,https://twitter.com/AndroidPolice/status/1711713213518119314,Oct 10,Multiple outdoor security cameras for less than $200? Yes please,https://t.co/2rzYekRXT5,7,,,4.6K
https://twitter.com/AndroidPolice,@AndroidPolice,https://twitter.com/AndroidPolice/status/1711708143468568583,Oct 10,The Motorola MA1 gets a sweet $20 discount for Prime Day,https://t.co/uw0lOQ166Y,1,3,15,6.4K
https://twitter.com/AndroidPolice,@AndroidPolice,https://twitter.com/AndroidPolice/status/1711703099515994545,Oct 10,Catch these,https://t.co/fW4Mz9TJ3C,5,,,5.1K
