UserId_Url,UserId,Tweet_Url,Date-Time,Tweets,,Comments,Retweets,Likes,Impressions
https://twitter.com/AndroidPolice,@AndroidPolice,https://twitter.com/AndroidPolice/status/1715142176407998641,Oct 20,Google Assistant's multilingual magic will soon land on the Pixel 7 series,https://t.co/YA0mDVjMve,2,3,40,7.9K
https://twitter.com/AndroidPolice,@AndroidPolice,https://twitter.com/AndroidPolice/status/1715138388678897911,Oct 20,Screenshots of Xiaomi's new HyperOS have started to surface,https://t.co/liU56SW1R3,3,17,,7.2K
https://twitter.com/AndroidPolice,@AndroidPolice,https://twitter.com/AndroidPolice/status/1715133522099265871,Oct 20,Google Play Protect has rolled out enhancements to better protect against malware on Android devices,https://t.co/QuzLhknJbl,8,43,,10K
https://twitter.com/AndroidPolice,@AndroidPolice,https://twitter.com/AndroidPolice/status/1715128891747004567,Oct 20,"The Samsung Galaxy Z Flip 5 might go old school with the Retro Edition according to a leak, but it's just a new coat of paint",https://t.co/GtTYIAyde8,2,9,,7.2K
https://twitter.com/AndroidPolice,@AndroidPolice,https://twitter.com/AndroidPolice/status/1715123049773543885,Oct 20,This Ring doorbell flash deal is too good to pass up,https://t.co/Zn1xyCrjvg,3,,,6.4K
https://twitter.com/AndroidPolice,@AndroidPolice,https://twitter.com/AndroidPolice/status/1715118025777578275,Oct 20,All the things we dislike most about Google's latest smartwatch,https://t.co/DOPGvtmDgz,2,21,,8.4K
https://twitter.com/AndroidPolice,@AndroidPolice,https://twitter.com/AndroidPolice/status/1714968407135707328,Oct 19,You can now log into two WhatsApp accounts on your phone,https://t.co/p5zILOEkMh,10,80,,11K
https://twitter.com/AndroidPolice,@AndroidPolice,https://twitter.com/AndroidPolice/status/1714955240850473126,Oct 19,What’s the difference between Google TV and Android TV?,https://t.co/iTHvN8be1s,6,30,erence-between-google-tv-and-android-tv/?utm_term=Autofeed&utm_medium=Social&utm_source=Twitter#Echobox=1697712019,7.9K
https://twitter.com/AndroidPolice,@AndroidPolice,https://twitter.com/AndroidPolice/status/1714765287822643521,Oct 19,A changing alliance in the shadow of ARM's evolving revenue structure,https://t.co/cgZyw1WHwU,1,17,,8.2K
https://twitter.com/AndroidPolice,@AndroidPolice,https://twitter.com/AndroidPolice/status/1714758466961576054,Oct 19,Foldable phones might miss out on Google Wallet's digital ID feature,https://t.co/iHG7nNbB2s,1,8,45,11K
https://twitter.com/AndroidPolice,@AndroidPolice,https://twitter.com/AndroidPolice/status/1714755328225534258,Oct 19,Self-destructing voice notes cannot be restored for relistening after they have been dismissed,https://t.co/NnQ6Y8YZ8f,1,4,23,8K
https://twitter.com/AndroidPolice,@AndroidPolice,https://twitter.com/AndroidPolice/status/1714749803349913716,Oct 19,Get two lifetimes worth of Microsoft Office Professional 2021 for a fraction of the price of one,https://t.co/mE3QpYWuPU,14,,,7.9K
https://twitter.com/AndroidPolice,@AndroidPolice,https://twitter.com/AndroidPolice/status/1714747034350027196,Oct 19,"From Maps to Chrome, Google reaffirms its commitment to building a digital realm for everyone",https://t.co/J1oSB8tVBi,1,18,,8.1K
https://twitter.com/AndroidPolice,@AndroidPolice,https://twitter.com/AndroidPolice/status/1714740182350512469,Oct 19,Google describes the update as allowing you to connect your watch to multiple phones,https://t.co/PT8U2ygqa3,4,5,50,9.6K
https://twitter.com/AndroidPolice,@AndroidPolice,https://twitter.com/AndroidPolice/status/1714735083083460878,Oct 19,Picking your default emoji skin tone and gender expression on Gboard is now as easy as it should have been all along,https://t.co/7ILfrqHuYQ,3,3,34,8.5K
https://twitter.com/AndroidPolice,@AndroidPolice,https://twitter.com/AndroidPolice/status/1714725129366769969,Oct 19,Don’t miss this awesome deal on a 3-pack of Anker USB-C chargers,https://t.co/fHLxyte3kF,14,,,7.5K
https://twitter.com/AndroidPolice,@AndroidPolice,https://twitter.com/AndroidPolice/status/1714701110085144953,Oct 18,Want that next Galaxy phone for a lower price; here are the best Samsung phone deals!,https://t.co/1JjV1lYbL4,1,1,15,8.3K
https://twitter.com/AndroidPolice,@AndroidPolice,https://twitter.com/AndroidPolice/status/1714693017922060404,Oct 18,"With Fitbit built in, the Pixel Watch 2 holds its own as a fitness tracker",https://t.co/jgWELD4QsR,2,1,20,7.7K
https://twitter.com/AndroidPolice,@AndroidPolice,https://twitter.com/AndroidPolice/status/1714676356141728039,Oct 18,Instagram's tracking days are numbered as Meta simplifies privacy controls,https://t.co/pCfaQP0HVC,1,4,33,8.5K
https://twitter.com/AndroidPolice,@AndroidPolice,https://twitter.com/AndroidPolice/status/1714663714262011937,Oct 18,Save big and stay protected with one of our favorite VPNs,https://t.co/VeitKOg7MS,14,,,6.6K
https://twitter.com/AndroidPolice,@AndroidPolice,https://twitter.com/AndroidPolice/status/1714658265072627975,Oct 18,JLabs' JBuds Mini offer decent sound quality and battery life in a rather tiny package,https://t.co/kKEkOJ3iSg,12,,,6.1K
https://twitter.com/AndroidPolice,@AndroidPolice,https://twitter.com/AndroidPolice/status/1714653834549633142,Oct 18,Taking screenshots on your Pixel Watch won’t be a pain anymore,https://t.co/mD7ImfNd4Z,20,,,6.7K
https://twitter.com/AndroidPolice,@AndroidPolice,https://twitter.com/AndroidPolice/status/1714646323125801015,Oct 18,Google Wallet now allows creating passes directly using a photo of a QR or barcode,https://t.co/T9glV88Ybb,3,1,50,9.9K
https://twitter.com/AndroidPolice,@AndroidPolice,https://twitter.com/AndroidPolice/status/1714634951096737994,Oct 18,"Google wants Gmail to be like iMessage, one step at a time",https://t.co/3Sq8yEHvFQ,3,7,73,13K
https://twitter.com/AndroidPolice,@AndroidPolice,https://twitter.com/AndroidPolice/status/1714628142260765075,Oct 18,Which color reflects your personality best?,https://t.co/S7XIB4bMJG,1,17,,7.9K
https://twitter.com/AndroidPolice,@AndroidPolice,https://twitter.com/AndroidPolice/status/1714616390286545220,Oct 18,A retrospective on Nokia's failed experiment with the N-Gage handheld gaming phone,https://t.co/Rh6VeTCqCf,4,21,,7.6K
https://twitter.com/AndroidPolice,@AndroidPolice,https://twitter.com/AndroidPolice/status/1714612979168145792,Oct 18,Black Friday in October? That’s when Best Buy plans to kick off its biggest deals of the season,https://t.co/8FdruxxOo9,1,7,,7K
https://twitter.com/AndroidPolice,@AndroidPolice,https://twitter.com/AndroidPolice/status/1714598810536587494,Oct 18,Which do you need more? Kickass cameras or full feature support?,https://t.co/xCynm8ubyN,2,13,,7.9K
https://twitter.com/AndroidPolice,@AndroidPolice,https://twitter.com/AndroidPolice/status/1714593347627631088,Oct 18,Here's everything you need to know about Samsung DeX for Motorola phones,https://t.co/wJ2AcVCeMI,1,4,24,9.1K
https://twitter.com/AndroidPolice,@AndroidPolice,https://twitter.com/AndroidPolice/status/1714589640320004503,Oct 18,Google is backpedaling on some Fitbit app changes in response to user complaints,https://t.co/aG8CiTWGlv,4,68,,11K
https://twitter.com/AndroidPolice,@AndroidPolice,https://twitter.com/AndroidPolice/status/1714585986049380749,Oct 18,Google’s first smartwatch is getting better with the latest update,https://t.co/zVIBp4hNfD,2,5,27,8.7K
https://twitter.com/AndroidPolice,@AndroidPolice,https://twitter.com/AndroidPolice/status/1714582352247087276,Oct 18,Google could consider making ChromeOS Flex official for obsolete Chromebooks,https://t.co/FN85r6WflP,5,30,,7.9K
https://twitter.com/AndroidPolice,@AndroidPolice,https://twitter.com/AndroidPolice/status/1714578575200862589,Oct 18,Google starts selling standalone Pixel Buds Pro charging cases,https://t.co/HInyEAJg1C,2,42,,9.6K
https://twitter.com/AndroidPolice,@AndroidPolice,https://twitter.com/AndroidPolice/status/1714547798358524260,Oct 18,YouTube is unleashing a plethora of new features it has been testing out,https://t.co/ffTn02rtly,1,4,45,10K
https://twitter.com/AndroidPolice,@AndroidPolice,https://twitter.com/AndroidPolice/status/1714403500421968304,Oct 18,Android's upcoming security measures promise a safer browsing experience,https://t.co/OxdGyQlANV,2,21,,8K
https://twitter.com/AndroidPolice,@AndroidPolice,https://twitter.com/AndroidPolice/status/1714391136939192597,Oct 18,Is the Pixel Watch 2 or the Fitbit Sense 2 the better high-end Fitbit experience?,https://t.co/emoqKMxNFF,1,23,,8.2K
https://twitter.com/AndroidPolice,@AndroidPolice,https://twitter.com/AndroidPolice/status/1714385046889468063,Oct 18,"Samsung's newest flip phone is available to buy, and there are tons of ways to save already",https://t.co/WGxsdtcUGb,1,11,,7K
https://twitter.com/AndroidPolice,@AndroidPolice,https://twitter.com/AndroidPolice/status/1714369598986789151,Oct 18,Google finally syncs alarms and Do Not Disturb across Pixel phones and watches,https://t.co/0vbY4UdvBU,3,5,70,9.5K
https://twitter.com/AndroidPolice,@AndroidPolice,https://twitter.com/AndroidPolice/status/1714365809022115977,Oct 18,"Originally announced in October 2022, Netflix makes good on delivering cloud gaming to the US",https://t.co/PTh7V16nlR,5,,,6.9K
https://twitter.com/AndroidPolice,@AndroidPolice,https://twitter.com/AndroidPolice/status/1714362037533384997,Oct 18,Google Password Manager could take the effort out of switching to passkeys,https://t.co/9yaEwIkhzZ,1,3,36,8.3K
https://twitter.com/AndroidPolice,@AndroidPolice,https://twitter.com/AndroidPolice/status/1714346917503664223,Oct 17,The Anker 511 USB-C charger is a no-brainer at this price,https://t.co/T7d20bg3Ww,8,,,6.3K
https://twitter.com/AndroidPolice,@AndroidPolice,https://twitter.com/AndroidPolice/status/1714340272320987237,Oct 17,"The Pixel 8 and Pixel 8 Pro cost $100 more than their predecessors, but Google's improvements make them worth it anyway",https://t.co/0Ajub4MSoC,1,26,,7.1K
https://twitter.com/AndroidPolice,@AndroidPolice,https://twitter.com/AndroidPolice/status/1714299076131361101,Oct 17,"Save 45% on a pair of earbuds that are compact, clear, and waterproof",https://t.co/ST5sRtu43d,10,,,6K
https://twitter.com/AndroidPolice,@AndroidPolice,https://twitter.com/AndroidPolice/status/1714288231691464837,Oct 17,"Get deals on Google's Pixel devices — phones, tablets, and headphones",https://t.co/qAEFgMb08c,3,21,,7.2K
https://twitter.com/AndroidPolice,@AndroidPolice,https://twitter.com/AndroidPolice/status/1714276481470464215,Oct 17,"Without third-party cookies, you will have to use a different file-sharing flow than what you are used to",https://t.co/iujafFfhjW,2,15,,6.5K
https://twitter.com/AndroidPolice,@AndroidPolice,https://twitter.com/AndroidPolice/status/1714273152031973827,Oct 17,Your Pixel Watch 2 packs plenty of safety features that you likely don't know about,https://t.co/jc0iOldflE,5,30,,6.6K
https://twitter.com/AndroidPolice,@AndroidPolice,https://twitter.com/AndroidPolice/status/1714265501617078490,Oct 17,"Pixel 6 users, be cautious of updating to Android 14 for now",https://t.co/AsexoSHMqB,7,8,39,11K
https://twitter.com/AndroidPolice,@AndroidPolice,https://twitter.com/AndroidPolice/status/1714253922750099476,Oct 17,"The Pixel 8 and 8 have great cameras, but by favorite photo feature from the Pixels of old is gone forever",https://t.co/dgLkJfK6Yb,2,8,55,12K
https://twitter.com/AndroidPolice,@AndroidPolice,https://twitter.com/AndroidPolice/status/1714250759494099041,Oct 17,Here’s how Google wants to protect children and teens online without overbearing mandated age checks,https://t.co/t530B2FVGt,3,21,,6.8K
https://twitter.com/AndroidPolice,@AndroidPolice,https://twitter.com/AndroidPolice/status/1714235076383322205,Oct 17,OnePlus is creating hype for its first foldable ahead of its launch later this week,https://t.co/awIGqHIho2,2,1,23,8.8K
https://twitter.com/AndroidPolice,@AndroidPolice,https://twitter.com/AndroidPolice/status/1714227905964687683,Oct 17,AOD color variation issues are plaguing some Pixel 8 Pros in the wild,https://t.co/xACdmzyze5,3,8,54,12K
https://twitter.com/AndroidPolice,@AndroidPolice,https://twitter.com/AndroidPolice/status/1714189955822412161,Oct 17,HyperOS will eventually arrive on older Xiaomi phones and tablets,https://t.co/qOH5NTu4ka,9,55,,10K
https://twitter.com/AndroidPolice,@AndroidPolice,https://twitter.com/AndroidPolice/status/1714048644440068328,Oct 17,The dynamic nature of roads requires Google Maps to be on its toes,https://t.co/ZNPTWveRc2,3,21,,7.2K
https://twitter.com/AndroidPolice,@AndroidPolice,https://twitter.com/AndroidPolice/status/1714045216494141458,Oct 17,Rooted users can even get a sneak peek into the Play Store's future interface,https://t.co/afi6o47O4o,1,23,,7.1K
https://twitter.com/AndroidPolice,@AndroidPolice,https://twitter.com/AndroidPolice/status/1714028300400566388,Oct 17,Ever wanted to rock a custom ROM on your wrist?,https://t.co/R0l76IKeSa,2,5,47,9.2K
https://twitter.com/AndroidPolice,@AndroidPolice,https://twitter.com/AndroidPolice/status/1714020534063690215,Oct 17,Does the Pixel 8 or the Pixel 7a give you the best bang for your buck?,https://t.co/VgDMaTM6UR,14,,,6.7K
https://twitter.com/AndroidPolice,@AndroidPolice,https://twitter.com/AndroidPolice/status/1714003539742146808,Oct 17,The weather feature has been available on Maps for iOS for 4 years,https://t.co/yFCWNrwDn5,2,3,53,10K
https://twitter.com/AndroidPolice,@AndroidPolice,https://twitter.com/AndroidPolice/status/1713998039419949335,Oct 17,This goes well beyond the usual 'Safari feels snappier' memes,https://t.co/uKKzEInntJ,2,34,,7.9K
https://twitter.com/AndroidPolice,@AndroidPolice,https://twitter.com/AndroidPolice/status/1713985737832509895,Oct 17,Get more storage for less money,https://t.co/RyH5ItC5fo,1,9,,6.5K
https://twitter.com/AndroidPolice,@AndroidPolice,https://twitter.com/AndroidPolice/status/1713978749056667807,Oct 16,"WhatsApp announces passkey support for logins, just like your favorite password managers",https://t.co/IpsfsMtHT4,1,2,36,8.3K
https://twitter.com/AndroidPolice,@AndroidPolice,https://twitter.com/AndroidPolice/status/1713960006599524641,Oct 16,The Google Pixel 8 creeps closer to polished desktop mode support on Android with display output support via USB-C,https://t.co/nj2ZTZqETW,4,58,,8.5K
https://twitter.com/AndroidPolice,@AndroidPolice,https://twitter.com/AndroidPolice/status/1713933934302560487,Oct 16,A powerful and portable Bluetooth speaker with a boombox form factor that's easy on the wallet,https://t.co/TO29XzmZNj,2,3,19,7.3K
https://twitter.com/AndroidPolice,@AndroidPolice,https://twitter.com/AndroidPolice/status/1713930476958740825,Oct 16,The best VPNs all have great deals for fall!,https://t.co/ytKwD0lFrf,3,11,,6.6K
https://twitter.com/AndroidPolice,@AndroidPolice,https://twitter.com/AndroidPolice/status/1713918939137241270,Oct 16,"Sonos makes some amazing gear, and the Sonos Move 2 and Sonos Roam are two of its best battery-powered speakers",https://t.co/WWogMwIrNg,1,1,8,6.5K
https://twitter.com/AndroidPolice,@AndroidPolice,https://twitter.com/AndroidPolice/status/1713910149478285658,Oct 16,"The Samsung Galaxy Tab S9 FE+'s IP68 rating not only makes it water-resistant, but it's also one of the most durable tabs out there!",https://t.co/6oCUITZK5o,11,,,6.2K
https://twitter.com/AndroidPolice,@AndroidPolice,https://twitter.com/AndroidPolice/status/1713903613754454321,Oct 16,Some Wear OS 4 watches don't properly display Gboard in a few apps,https://t.co/EU7SBA0HLS,26,,,7.8K
https://twitter.com/AndroidPolice,@AndroidPolice,https://twitter.com/AndroidPolice/status/1713883961338831208,Oct 16,Can’t access Google Messages when screen sharing? You’re not alone,https://t.co/ySDjwsoFwK,1,2,33,8K
https://twitter.com/AndroidPolice,@AndroidPolice,https://twitter.com/AndroidPolice/status/1713877777462460684,Oct 16,This is how Google’s flagship phones from 2022 and 2023 compare,https://t.co/dIPxaQB5MJ,22,,,7.4K
https://twitter.com/AndroidPolice,@AndroidPolice,https://twitter.com/AndroidPolice/status/1713865301253673370,Oct 16,Google’s smart reply isn’t just for solo chats anymore,https://t.co/FxfSwGiZ2B,15,,,7.1K
https://twitter.com/AndroidPolice,@AndroidPolice,https://twitter.com/AndroidPolice/status/1713852477756366863,Oct 16,"After Chrome, Google Photos is the second major app to add support for Android 14's share sheet",https://t.co/0JPkD097zt,3,8,73,11K
https://twitter.com/AndroidPolice,@AndroidPolice,https://twitter.com/AndroidPolice/status/1713671330560704870,Oct 16,We gave the Pixel 8 Pro a 9/10 in our review over 6 days. Hear what exactly went into that number in our latest AP podcast,https://t.co/n9prZ81BRn,7,69,,11K
https://twitter.com/AndroidPolice,@AndroidPolice,https://twitter.com/AndroidPolice/status/1713628190952824873,Oct 16,If you're buying a Samsung Galaxy S23 you'll have a few colors to choose from,https://t.co/pqMk1OWqUd,3,19,,8.8K
https://twitter.com/AndroidPolice,@AndroidPolice,https://twitter.com/AndroidPolice/status/1713592294018810161,Oct 15,"The Pixel 8 is finally here, and we want to know what you think of Google's AI-powered camera features",https://t.co/6la4BpqZtW,3,52,,10K
https://twitter.com/AndroidPolice,@AndroidPolice,https://twitter.com/AndroidPolice/status/1713559661159276974,Oct 15,The new Fan Edition joins the S23 family with the same durability,https://t.co/4jfVeQTsM9,1,23,,8.8K
https://twitter.com/AndroidPolice,@AndroidPolice,https://twitter.com/AndroidPolice/status/1713551854603231454,Oct 15,"Worried about losing your S23 Ultra's S Pen? Fear not, as a replacement is just a few clicks away",https://t.co/16ocRuep9Y,1,15,,8.5K
https://twitter.com/AndroidPolice,@AndroidPolice,https://twitter.com/AndroidPolice/status/1713534260718580072,Oct 15,From voice commands to image interactions: how the new Google Assistant could change the game,https://t.co/L7XiIRFkgn,1,1,41,9.4K
https://twitter.com/AndroidPolice,@AndroidPolice,https://twitter.com/AndroidPolice/status/1713527416679776764,Oct 15,Your ears are in for a treat with the Pixel 8's forthcoming lossless USB audio,https://t.co/qSBog0TkP9,5,14,101,14K
https://twitter.com/AndroidPolice,@AndroidPolice,https://twitter.com/AndroidPolice/status/1713518799385760016,Oct 15,"Dollar for dollar, the Samsung S23 FE and A54 are neck and neck — the right choice depends on how many dollars you want to spend",https://t.co/MZOLpu67w6,2,15,,9.1K
https://twitter.com/AndroidPolice,@AndroidPolice,https://twitter.com/AndroidPolice/status/1713511813730480418,Oct 15,Do you prefer neutral or pops of color?,https://t.co/leUSDXS0t9,6,2,40,9.8K
https://twitter.com/AndroidPolice,@AndroidPolice,https://twitter.com/AndroidPolice/status/1713500997375377580,Oct 15,UI elements in the Google Contacts app could soon become easier to reach,https://t.co/oPzFWiJ3k0,2,1,27,10K
https://twitter.com/AndroidPolice,@AndroidPolice,https://twitter.com/AndroidPolice/status/1713486487650529363,Oct 15,"Students, researchers, and earth-enjoyers are all using the free Google Earth Pro. Here's how it works",https://t.co/xyoFKyRyy3,1,6,37,12K
https://twitter.com/AndroidPolice,@AndroidPolice,https://twitter.com/AndroidPolice/status/1713371858513379723,Oct 15,Google Pixel 8 series enjoys a cleaner status bar with the Google One VPN hogging less space,https://t.co/eedLwHScO0,2,4,53,12K
https://twitter.com/AndroidPolice,@AndroidPolice,https://twitter.com/AndroidPolice/status/1713358896675312112,Oct 15,A new leak has revealed real-world images of the upcoming Oppo Find N3 ahead of its October 19 launch,https://t.co/Eo4VDGCcgf,1,19,,8.7K
https://twitter.com/AndroidPolice,@AndroidPolice,https://twitter.com/AndroidPolice/status/1713328396615184571,Oct 15,But is the pricier Pixel 8 model Pro enough to justify the price hike?,https://t.co/5vhJlvoJVV,1,4,43,10K
https://twitter.com/AndroidPolice,@AndroidPolice,https://twitter.com/AndroidPolice/status/1713296477290651752,Oct 15,Showcase the best of your Galaxy S23 FE with these fun new colors,https://t.co/JcPMg4hQOz,3,18,,9.6K
https://twitter.com/AndroidPolice,@AndroidPolice,https://twitter.com/AndroidPolice/status/1713260218375680105,Oct 14,You won’t find these Pixel 8 features on any other Android phone,https://t.co/oZWb1wJvUw,5,55,,10K
https://twitter.com/AndroidPolice,@AndroidPolice,https://twitter.com/AndroidPolice/status/1713222332053934483,Oct 14,Forget gaming on your phone. Jump up to a tablet with games that looks great on a bigger screen!,https://t.co/RXCP5SrZsf,2,23,,8.5K
https://twitter.com/AndroidPolice,@AndroidPolice,https://twitter.com/AndroidPolice/status/1713190540072685921,Oct 14,"Charging smartwatches has become a mess, and wearables need to take a cue from smartphones in standardization",https://t.co/RXekEya9p3,3,5,51,10K
https://twitter.com/AndroidPolice,@AndroidPolice,https://twitter.com/AndroidPolice/status/1713174314822824436,Oct 14,"If you just bought a Pixel 8, you'll be waiting for Google to introduce some cool new features",https://t.co/iipWbjguYV,1,6,68,12K
https://twitter.com/AndroidPolice,@AndroidPolice,https://twitter.com/AndroidPolice/status/1713156665212596363,Oct 14,Accurately record your daily steps with some of these pedometer and step counter apps on iOS and Android,https://t.co/WfcnW8DWW0,3,21,,9.3K
https://twitter.com/AndroidPolice,@AndroidPolice,https://twitter.com/AndroidPolice/status/1713139838956732846,Oct 14,"As the Google Pixel 8 begins reaching customers, one user claims its Face Unlock system has been fooled by their sibling",https://t.co/Ckmnlk2VLS,6,7,75,16K
https://twitter.com/AndroidPolice,@AndroidPolice,https://twitter.com/AndroidPolice/status/1713042401361596511,Oct 14,The Discover feed currently in testing cannot be disabled by users,https://t.co/jDYAKNlWXc,2,4,42,10K
https://twitter.com/AndroidPolice,@AndroidPolice,https://twitter.com/AndroidPolice/status/1713029389972091131,Oct 14,Did your phone just break? Finally fed up with that failing battery? Here are the best deals to buy yourself a better one,https://t.co/xKfww2jLJ5,3,21,,8.4K
https://twitter.com/AndroidPolice,@AndroidPolice,https://twitter.com/AndroidPolice/status/1713016447750885411,Oct 14,"Generate AI images all you want, Google’s got your back",https://t.co/DfXZkL50IH,1,1,34,8.6K
https://twitter.com/AndroidPolice,@AndroidPolice,https://twitter.com/AndroidPolice/status/1713003248594935874,Oct 14,Google Pixel 8 Pro survives JerryRigEverything’s torture test with clenched antenna lines,https://t.co/mwngx0DMe3,2,10,111,14K
https://twitter.com/AndroidPolice,@AndroidPolice,https://twitter.com/AndroidPolice/status/1712990724545716425,Oct 14,Renders of Xiaomi’s next flagship phone have leaked online,https://t.co/EuMzcBmH2K,2,12,,7.2K
https://twitter.com/AndroidPolice,@AndroidPolice,https://twitter.com/AndroidPolice/status/1712977455588204880,Oct 14,Google Drive is working on a new layout for large-screen devices,https://t.co/pyve5EZXxQ,4,70,,9.3K
https://twitter.com/AndroidPolice,@AndroidPolice,https://twitter.com/AndroidPolice/status/1712964309502861667,Oct 14,The Google Play Store’s dark theme has gotten even darker,https://t.co/gJNXnbsR8Q,1,4,65,10K
https://twitter.com/AndroidPolice,@AndroidPolice,https://twitter.com/AndroidPolice/status/1712951471904309470,Oct 14,Need help with your Pixel phone? Ask Google Assistant,https://t.co/9Dwc2jRgzO,2,3,34,8.2K
https://twitter.com/AndroidPolice,@AndroidPolice,https://twitter.com/AndroidPolice/status/1712933588977508516,Oct 14,Google last redesigned its Home app back in May 2023,https://t.co/dhTLPVzEVJ,1,47,,7.8K
https://twitter.com/AndroidPolice,@AndroidPolice,https://twitter.com/AndroidPolice/status/1712927735947952254,Oct 14,Don’t miss our round up of the top Chromebook discounts available right now,https://t.co/ik7EFHLw4a,9,,,6.4K
https://twitter.com/AndroidPolice,@AndroidPolice,https://twitter.com/AndroidPolice/status/1712916418843345181,Oct 14,"Save yourself time and your dog the trauma of the noisy, scary vacuum with these little robots",https://t.co/Mg774zw6JU,1,1,11,6.3K
https://twitter.com/AndroidPolice,@AndroidPolice,https://twitter.com/AndroidPolice/status/1712904127431241819,Oct 14,The Jabra Elite 7 Pro's are 43% off — get them now before Prime Day ends!,https://t.co/SIbtxgKCyA,1,15,,6.4K
https://twitter.com/AndroidPolice,@AndroidPolice,https://twitter.com/AndroidPolice/status/1712893215504789708,Oct 13,Have your pick from 15 of the best Prime Day deals that are still live on Amazon,https://t.co/o0DEf9Mkbp,1,1,16,7.7K
https://twitter.com/AndroidPolice,@AndroidPolice,https://twitter.com/AndroidPolice/status/1712882590514897296,Oct 13,"Amazon has thousands of deals, and these are the ones that Android Police readers are enjoying the most",https://t.co/01s7zQt0DP,1,16,,6.2K
https://twitter.com/AndroidPolice,@AndroidPolice,https://twitter.com/AndroidPolice/status/1712860613196521660,Oct 13,"I tested the Continuity Camera clone in Android 14, and it's not as good as the original yet",https://t.co/0D2ao2oAWY,23,,,5.6K
https://twitter.com/AndroidPolice,@AndroidPolice,https://twitter.com/AndroidPolice/status/1712859320721768491,Oct 13,"With these Kindles hitting their best prices yet this Prime Day, you'll definitely want to read into this.",https://t.co/nEVNaLzcvD,7,,,5.3K
https://twitter.com/AndroidPolice,@AndroidPolice,https://twitter.com/AndroidPolice/status/1712846403003617451,Oct 13,Bone conduction headphones can be great for swimming — but these ones aren't,https://t.co/tJ5wfh9H9Z,13,,,5.6K
https://twitter.com/AndroidPolice,@AndroidPolice,https://twitter.com/AndroidPolice/status/1712831983993159878,Oct 13,Amazon's Prime Big Deal Days isn't the only event in town. These sales are only available at Best Buy.,https://t.co/2TQa74PKOo,14,,,6.4K
https://twitter.com/AndroidPolice,@AndroidPolice,https://twitter.com/AndroidPolice/status/1712809668689408358,Oct 13,Save nearly 40% on these feature-packed wireless headphones,https://t.co/AHLAHFZ2Od,1,13,,6.4K
