UserId_Url,UserId,Tweet_Url,,Tweets,,Comments,Retweets,Likes,Impressions,,,
https://twitter.com/androidcentral,@androidcentral,https://twitter.com/androidcentral/status/1714981443204493364,Oct 19,Repping the Kingdom as QB1 in the new NFL Pro Era II VR game,https://t.co/0P6ZiffgL8,1,15,,8K,,,
https://twitter.com/androidcentral,@androidcentral,https://twitter.com/androidcentral/status/1714971403194085830,Oct 19,"The Motorola Razr ""Minus"" has one big plus, and that's the price",https://t.co/e95bdQoN9V,1,2,18,9.4K,,,
https://twitter.com/androidcentral,@androidcentral,https://twitter.com/androidcentral/status/1714929866078896465,Oct 19,"As Samsung's foldable fanfare fades, Oppo's Find N3 and Find N3 Flip step into the global limelight",https://t.co/J524hosXTP,1,16,,8.9K,,,
https://twitter.com/androidcentral,@androidcentral,https://twitter.com/androidcentral/status/1714770871364067517,Oct 19,Netflix is raising prices... again,https://t.co/urEbId833K,5,8,45,14K,,,
https://twitter.com/androidcentral,@androidcentral,https://twitter.com/androidcentral/status/1714738154156990608,Oct 19,"YouTube adds a ton of features, including a new ""You"" tab, song search, and more",https://t.co/ZTjFiGNpAa,4,33,,11K,,,
https://twitter.com/androidcentral,@androidcentral,https://twitter.com/androidcentral/status/1714732360342593863,Oct 19,Gboard update lets you set your emoji skin tone with one tap,https://t.co/suFqI0iqVk,1,3,36,10K,,,
https://twitter.com/androidcentral,@androidcentral,https://twitter.com/androidcentral/status/1714715978099990725,Oct 19,Google Chrome gains a 'smarter' address bar for searches and bookmarks,https://t.co/fWDdFt3h0F,3,46,,12K,,,
https://twitter.com/androidcentral,@androidcentral,https://twitter.com/androidcentral/status/1714709210577944908,Oct 18,Google Play Store glues the search bar to the top in a new test,https://t.co/b8AAij8Kdj,1,28,,9.9K,,,
https://twitter.com/androidcentral,@androidcentral,https://twitter.com/androidcentral/status/1714706699909570697,Oct 18,New findings reveal the Pixel 8 series actually supports display output,https://t.co/fEiXPv1KDK,5,48,,9.8K,,,
https://twitter.com/androidcentral,@androidcentral,https://twitter.com/androidcentral/status/1714699140536693105,Oct 18,Rumored Galaxy S24 colors point to a bright future,https://t.co/PwhLdtuQad,1,1,26,9.1K,,,
https://twitter.com/androidcentral,@androidcentral,https://twitter.com/androidcentral/status/1714690327309635997,Oct 18,Step streaks and more are coming back to the Fitbit app,https://t.co/9016QuwbBM,1,21,,9.3K,https://t.co/9016QuwbBM,Step streaks and more are coming back to the Fitbit app,User feedback is a catalyst for change.
https://twitter.com/androidcentral,@androidcentral,https://twitter.com/androidcentral/status/1714658875696148847,Oct 18,What is RISC-V and what does it mean for Android and Wear OS?,https://t.co/THkDOn4Pb7,1,39,,9.7K,,,
https://twitter.com/androidcentral,@androidcentral,https://twitter.com/androidcentral/status/1714588160208834965,Oct 18,"X's new $1/year subscription fee aims to curb bots and spam on the platform, and if you're too cheap to shell out, you'll be relegated to the sidelines as a spectator",https://t.co/0uY2Zmq2fl,6,14,48,19K,,,
https://twitter.com/androidcentral,@androidcentral,https://twitter.com/androidcentral/status/1714574596316274854,Oct 18,"After seeing the Pixel Watch 2, I'm glad I didn't buy into the original Pixel Watch",https://t.co/IlLgJfutBj,11,6,66,15K,,,
https://twitter.com/androidcentral,@androidcentral,https://twitter.com/androidcentral/status/1714493538111553855,Oct 18,A new update is rolling out for the Motorola Razr Plus,https://t.co/ZJ9eugGOET,3,34,,11K,,,
https://twitter.com/androidcentral,@androidcentral,https://twitter.com/androidcentral/status/1714453766466937095,Oct 18,More rumors point to a premium Galaxy Watch 'Ultra' with a MicroLED display,https://t.co/mKYwN3lgX5,2,3,40,12K,,,
https://twitter.com/androidcentral,@androidcentral,https://twitter.com/androidcentral/status/1714374984334815671,Oct 18,Garmin activates its dormant heart health sensor in more smartwatches,https://t.co/Jnn7IFssmb,3,26,,9.4K,,,
https://twitter.com/androidcentral,@androidcentral,https://twitter.com/androidcentral/status/1714368686868341225,Oct 18,Wear OS 4 is rolling out now for the original Pixel Watch,https://t.co/g8toShnTZg,9,70,,11K,,,
https://twitter.com/androidcentral,@androidcentral,https://twitter.com/androidcentral/status/1714349085967200299,Oct 18,Future Wear OS watches are getting an important Snapdragon upgrade,https://t.co/ChlS1sNHdg,9,59,,9.8K,,,
https://twitter.com/androidcentral,@androidcentral,https://twitter.com/androidcentral/status/1714330471864103418,Oct 17,Pixel 6 owners face a critical storage bug with Android 14,https://t.co/p0p5FySdTk,1,8,66,15K,,,
https://twitter.com/androidcentral,@androidcentral,https://twitter.com/androidcentral/status/1714328183804223653,Oct 17,"Google adds more accessibility options across Maps, Search, and Chrome",https://t.co/8g29OnJkoW,12,46,,8.7K,,,
https://twitter.com/androidcentral,@androidcentral,https://twitter.com/androidcentral/status/1714287734138007679,Oct 17,"Meta's new smart glasses are targeted towards always-online social media fans, but it's unexpectedly useful for runners and cyclists as a wireless earbud alternative",https://t.co/ISVO6Q9Jhl,1,21,,7.7K,,,
https://twitter.com/androidcentral,@androidcentral,https://twitter.com/androidcentral/status/1714266767231443124,Oct 17,Samsung expands its Batteries Plus partnership for quick in-store repairs,https://t.co/vgc4Rm6dQZ,5,39,,8.9K,https://t.co/vgc4Rm6dQZ,Samsung expands its Batteries Plus partnership for quick in-store repairs,Personally interact with a professional for Galaxy phone and foldable repairs.
https://twitter.com/androidcentral,@androidcentral,https://twitter.com/androidcentral/status/1714178916225523949,Oct 17,"We reviewed Meta's new smart glasses, a massive improvement over its 2021 glasses that still have issues — like the very concept of a subtle camera on your face",https://t.co/bQ9r5qSYLM,2,19,,8.1K,,,
https://twitter.com/androidcentral,@androidcentral,https://twitter.com/androidcentral/status/1713579509826359481,Oct 15,"It's past time for fitness watches to guarantee proper software updates, the same way phones and smartwatches do",https://t.co/Q27r8jMzX1,3,1,28,12K,,,
https://twitter.com/androidcentral,@androidcentral,https://twitter.com/androidcentral/status/1713330872219242935,Oct 15,Threads gains an 'edit' button with no paywall,https://t.co/j1v9azXuNg,3,3,23,7.5K,,,
https://twitter.com/androidcentral,@androidcentral,https://twitter.com/androidcentral/status/1713307394015367637,Oct 15,"Meta knocks it out of the park with the new Quest 3, taking VR gaming and mixed reality to new heights",https://t.co/1y4VsorJqo,1,2,31,11K,,,
https://twitter.com/androidcentral,@androidcentral,https://twitter.com/androidcentral/status/1713301943307645200,Oct 15,"As one of the first Chromebook Plus laptops, the Acer Chromebook Plus 515 is definitely worth a look",https://t.co/veELE4dJw9,3,16,,9.8K,,,
https://twitter.com/androidcentral,@androidcentral,https://twitter.com/androidcentral/status/1713290808177074290,Oct 15,"Despite some odd limitations and a price bump, the Pixel 8 is a great upgrade",https://t.co/56U6oMgZEK,6,54,,11K,,,
https://twitter.com/androidcentral,@androidcentral,https://twitter.com/androidcentral/status/1713284891348009245,Oct 15,These adorable little robot chargers are perfect for anyone looking for a fast charger,https://t.co/ZVh0BQcnqk,4,33,,11K,,,
https://twitter.com/androidcentral,@androidcentral,https://twitter.com/androidcentral/status/1713278180474184020,Oct 15,The Pixel Watch 2 is what the original Pixel Watch should've been,https://t.co/UOHbnWH5sa,2,4,52,11K,,,
https://twitter.com/androidcentral,@androidcentral,https://twitter.com/androidcentral/status/1713258921572311471,Oct 14,The new Pixel 8 Pro takes Google's AI to another level,https://t.co/WN6xz8QN4G,1,5,85,12K,,,
https://twitter.com/androidcentral,@androidcentral,https://twitter.com/androidcentral/status/1713247060625903950,Oct 14,Plenty of people see the Quest 3's mixed reality as just a gimmick. Here's why we're more optimistic,https://t.co/e7N154Wymz,2,23,,9.5K,,,
https://twitter.com/androidcentral,@androidcentral,https://twitter.com/androidcentral/status/1713209306667946362,Oct 14,"With the Pixel 8 series, there is now a clear divide between Google's Android and Google Pixel",https://t.co/9eTPqYYJab,1,10,86,15K,,,
https://twitter.com/androidcentral,@androidcentral,https://twitter.com/androidcentral/status/1712923688054505837,Oct 14,Pixel Watch charging speed recently got a downgrade,https://t.co/i3prQ5e5wP,2,4,44,10K,,,
https://twitter.com/androidcentral,@androidcentral,https://twitter.com/androidcentral/status/1712914884227211729,Oct 14,More Samsung phones get a taste of Android 14 with the One UI 6 beta,https://t.co/4MOcwt7id7,1,5,41,9.7K,,,
https://twitter.com/androidcentral,@androidcentral,https://twitter.com/androidcentral/status/1712911107025781013,Oct 14,Pixel 8 series to receive support for lossless audio via USB in a 'later release',https://t.co/lyH4T4MytR,5,62,,10K,,,
https://twitter.com/androidcentral,@androidcentral,https://twitter.com/androidcentral/status/1712787041551843491,Oct 13,Hear me out (again): Google should release a Pixelbook 2,https://t.co/LjflvvHmB7,3,4,48,10K,,,
https://twitter.com/androidcentral,@androidcentral,https://twitter.com/androidcentral/status/1712694852624765077,Oct 13,"Honor just released its third foldable phone in less than a year, the Magic Vs2, and it's even lighter than the last one",https://t.co/18K45PRW7r,1,27,,8.8K,https://t.co/18K45PRW7r,"Honor's on a roll with foldable phones, and the Magic Vs2 is its latest",Honor is dropping foldable phones like it's hot.
https://twitter.com/androidcentral,@androidcentral,https://twitter.com/androidcentral/status/1712642337082368411,Oct 13,Google makes it easy to control your Pixel Buds with a Chromebook,https://t.co/uXQlbdKxzS,1,30,,8.7K,,,
https://twitter.com/androidcentral,@androidcentral,https://twitter.com/androidcentral/status/1712638310592499876,Oct 13,Google's eSIM migration tool has arrived on the Pixel 8,https://t.co/psOi7qFMAz,5,49,,10K,,,
https://twitter.com/androidcentral,@androidcentral,https://twitter.com/androidcentral/status/1712589484334657925,Oct 13,You can try the new Chromebook Plus features without buying new hardware,https://t.co/nlHl62DHxn,4,28,,8.4K,,,
https://twitter.com/androidcentral,@androidcentral,https://twitter.com/androidcentral/status/1712573132660158720,Oct 13,The OnePlus Open launch is officially set for October 19,https://t.co/gtwbSEGMPV,2,25,,7.6K,https://t.co/gtwbSEGMPV,The OnePlus Open grand reveal set for October 19,Will this device provide a shake-up in the foldable game?
https://twitter.com/androidcentral,@androidcentral,https://twitter.com/androidcentral/status/1712566350839714215,Oct 13,It's about time the Quest got some good VR stealth games,https://t.co/xv7F93zuNZ,14,,,6.7K,https://t.co/xv7F93zuNZ,It's about time the Quest got some good VR stealth games,"It's been a long time coming, but they're finally here."
https://twitter.com/androidcentral,@androidcentral,https://twitter.com/androidcentral/status/1712564076952400052,Oct 13,Google is letting you create images directly in Search with generative AI,https://t.co/HZo33Vdlbt,3,9,61,11K,,,
https://twitter.com/androidcentral,@androidcentral,https://twitter.com/androidcentral/status/1712526557099495585,Oct 12,Pixel 8 and 8 Pro join the Android 14 QPR1 Beta program a week after launch,https://t.co/eff3h8qcrd,1,29,,7.2K,https://t.co/eff3h8qcrd,"Pixel 8, 8 Pro join the Android 14 QPR1 Beta program a week after launch",Out of the box and into a beta.
https://twitter.com/androidcentral,@androidcentral,https://twitter.com/androidcentral/status/1712521079132930441,Oct 12,"Google is adding new features to the Home app based on user feedback, such as widgets for individual device toggles",https://t.co/nifK3y0nxh,1,41,,8.6K,,,
https://twitter.com/androidcentral,@androidcentral,https://twitter.com/androidcentral/status/1712489579742416937,Oct 12,OnePlus made the flip phone we've been waiting for — it's just selling it under another name,https://t.co/IIFdnBIHcx,1,17,,7.1K,,,
https://twitter.com/androidcentral,@androidcentral,https://twitter.com/androidcentral/status/1712472205001728309,Oct 12,OPPO's new Find N3 Flip addresses many shortcomings of the modern flip phone,https://t.co/BNmE65UbAD,2,27,,7.2K,https://t.co/BNmE65UbAD,OPPO Find N3 Flip review: The right stuff,OnePlus needs to follow this example.
https://twitter.com/androidcentral,@androidcentral,https://twitter.com/androidcentral/status/1712453814517682644,Oct 12,iOS users can use Google Password Manager as their default autofill provider on their devices,https://t.co/bgJuqj0z1t,1,15,,6.7K,https://t.co/bgJuqj0z1t,Google has new nifty tools for users who are concerned about their privacy,They include easier access to their browsing history and dark web report on the Google app.
https://twitter.com/androidcentral,@androidcentral,https://twitter.com/androidcentral/status/1712438043716558852,Oct 12,Google is able to return its Nest speaker group features as a U.S. federal judge overturns a previous substantial Sonos patent dispute verdict,https://t.co/P4hDcrB4O7,1,16,,6.8K,https://t.co/P4hDcrB4O7,Google reverses change to Nest speaker groups following Sonos win,Settled but not over.
https://twitter.com/androidcentral,@androidcentral,https://twitter.com/androidcentral/status/1712424135228375278,Oct 12,"Garmin's new $3,000 MARQ Carbon watches make the Epix 2 Pro look thrifty",https://t.co/DRdJq3TOMa,1,22,,8.6K,,,
https://twitter.com/androidcentral,@androidcentral,https://twitter.com/androidcentral/status/1712348641053044842,Oct 12,The Tensor G3 in the Pixel 8 is the best phone chip today,https://t.co/uiVysK9Czu,4,6,84,15K,,,
https://twitter.com/androidcentral,@androidcentral,https://twitter.com/androidcentral/status/1712251914602025222,Oct 12,"Prime Day is almost over, so we're highlighting 20 under-$30 impulse buys pulled straight from our ""Best"" product guides to close out your deal hunting",https://t.co/KbVwBknfRs,2,15,,8.3K,,,
https://twitter.com/androidcentral,@androidcentral,https://twitter.com/androidcentral/status/1712210889485496825,Oct 12,Pixel Buds Pro can now pause your music and switch to transparency mode when you start talking,https://t.co/gxe9oRaFnI,1,32,,7.6K,,,
https://twitter.com/androidcentral,@androidcentral,https://twitter.com/androidcentral/status/1712204036265455637,Oct 12,"Not only can you save $150 on the Lenovo Slim 3i Chromebook, but you'll also get all of the new Chromebook Plus features in the coming weeks.",https://t.co/OUrww5ayvm,1,14,,6.8K,https://t.co/OUrww5ayvm,Save $150 on this Lenovo Chromebook and enjoy all of the new Chromebook Plus features,The Slim 3i Chromebook might just be the best Prime Day deal.
https://twitter.com/androidcentral,@androidcentral,https://twitter.com/androidcentral/status/1712187316914053540,Oct 12,Galaxy S23 series grabs Samsung vulnerability fixes with October 2023 patch,https://t.co/4bhwObhLOY,4,32,,8.8K,,,
https://twitter.com/androidcentral,@androidcentral,https://twitter.com/androidcentral/status/1712154921586266570,Oct 11,"The Pixel Watch 2 might have just taken the title for best Android smartwatch, despite some frustrations",https://t.co/G21qCxaRDH,2,30,,7.5K,,,
https://twitter.com/androidcentral,@androidcentral,https://twitter.com/androidcentral/status/1712153345182282053,Oct 11,"The Pixel has gotten so much better over the years, and the Pixel 8 Pro is easily Google's best phone yet",https://t.co/u6SUPQxk27,1,1,63,8.1K,,,
https://twitter.com/androidcentral,@androidcentral,https://twitter.com/androidcentral/status/1712146566377574602,Oct 11,"The new leaked renders of the OnePlus Open reveal beautiful design, and Hasselblad branding",https://t.co/3kQ7EYfnkc,1,18,,6.9K,,,
https://twitter.com/androidcentral,@androidcentral,https://twitter.com/androidcentral/status/1712117333647299006,Oct 11,Samsung joins Google in pressuring Apple to adopt the RCS standard,https://t.co/cLyF7sjJph,4,15,97,14K,,,
https://twitter.com/androidcentral,@androidcentral,https://twitter.com/androidcentral/status/1712004366708658544,Oct 11,Android Central's top three most recommended USB-C power banks are on sale for as cheap as $12!,https://t.co/GaCNGT8QFt,1,30,,9.9K,,,
https://twitter.com/androidcentral,@androidcentral,https://twitter.com/androidcentral/status/1711839154516984229,Oct 11,Face Unlock on the Pixel 8 has a major advantage over the Pixel 7,https://t.co/mkDPVkExDo,1,2,53,9.2K,,,
https://twitter.com/androidcentral,@androidcentral,https://twitter.com/androidcentral/status/1711832276676247793,Oct 11,I just upgraded my desktop for under $300 with this 4TB Samsung 990 Pro SSD deal,https://t.co/x0Z7oeGNID,1,12,,6.4K,,,
https://twitter.com/androidcentral,@androidcentral,https://twitter.com/androidcentral/status/1711831992893870179,Oct 11,Google Calendar for Wear OS arrives with a mini Schedule view and Tasks,https://t.co/RwOQ7j3k6M,1,26,,7.4K,https://t.co/RwOQ7j3k6M,Google Calendar for Wear OS arrives with a mini Schedule view and Tasks,Staying up-to-date has never been easier.
https://twitter.com/androidcentral,@androidcentral,https://twitter.com/androidcentral/status/1711827879162417394,Oct 11,Assistant with Bard leak surfaces what Google is likely to bring,https://t.co/CJyz5zDwIL,1,10,,6.7K,https://t.co/CJyz5zDwIL,Assistant with Bard leak surfaces what Google is likely to bring,An early glimpse before the beta.
https://twitter.com/androidcentral,@androidcentral,https://twitter.com/androidcentral/status/1711826808696381702,Oct 11,Are you looking for some great Prime Day deals but don't want to break the bank? Here are some of our favorites that you can snag for under $100.,,2,15,,12K,,,
https://twitter.com/androidcentral,@androidcentral,https://twitter.com/androidcentral/status/1711821167051395330,Oct 11,Getting a Pixel 8 this year? Grab one of these incredible Caseborne clear cases and get MagSafe compatibility and two tempered glass protectors in the box for way less on Prime Day,https://t.co/s8Q0p0oJn0,1,22,,7.7K,,,
https://twitter.com/androidcentral,@androidcentral,https://twitter.com/androidcentral/status/1711820903221248441,Oct 11,"The Motorola Razr Plus is my favorite phone this year, and I'm flipping out over this deal",https://t.co/5BCUYJv7q1,8,,,6K,,,
https://twitter.com/androidcentral,@androidcentral,https://twitter.com/androidcentral/status/1711815571590054389,Oct 11,WhatsApp is trialing a new feature to keep your locked chats even more secure,https://t.co/XhlGAFcKfZ,3,19,,6.9K,,,
https://twitter.com/androidcentral,@androidcentral,https://twitter.com/androidcentral/status/1711803298729067002,Oct 10,"Our resident nerd Jerry just had to spend some money on this awesome Prime Day Raspberry Pi gear, check it out!",https://t.co/39zEzWLkZ4,1,17,,6.2K,,,
https://twitter.com/androidcentral,@androidcentral,https://twitter.com/androidcentral/status/1711786216625000724,Oct 10,Prime Day deals under $100 — this is what I'd buy,https://t.co/4NgBrMDt51,14,,,6.1K,,,
https://twitter.com/androidcentral,@androidcentral,https://twitter.com/androidcentral/status/1711748572712943937,Oct 10,First OnePlus Open tease is out hinting at a sooner launch of the first foldable from the company,https://t.co/SBQ47FsRdB,1,17,,6.7K,https://t.co/SBQ47FsRdB,"OnePlus Open officially teased, and the launch is to commence soon","The company says, ""Opening soon."""
https://twitter.com/androidcentral,@androidcentral,https://twitter.com/androidcentral/status/1711734174158098481,Oct 10,"Looking to upgrade to a Meta Quest 3? There's no better time than Prime Day! Plus, some of our favorite Quest 3 accessories are already on sale.",https://t.co/eu6ThJL9M3,1,15,,6.2K,https://t.co/eu6ThJL9M3,These Meta Quest 3 deals are still happening even after Prime Day ended,"Free games, deals on accessories, and more!"
https://twitter.com/androidcentral,@androidcentral,https://twitter.com/androidcentral/status/1711732088448106585,Oct 10,The Motorola Edge 2023 arrives as a mid-range device with a premium aesthetic,https://t.co/Ygm2P0lmFf,1,13,,5.8K,https://t.co/Ygm2P0lmFf,Motorola Edge 2023 arrives as a mid-range device with a premium aesthetic,"Borderless curved edges, vegan leather backing, and more."
https://twitter.com/androidcentral,@androidcentral,https://twitter.com/androidcentral/status/1711729573933588865,Oct 10,The cheaper Motorola Razr 2023 finally comes to the U.S. as an affordable foldable under $700,https://t.co/3w4FWuajlj,19,,,5.1K,,,
https://twitter.com/androidcentral,@androidcentral,https://twitter.com/androidcentral/status/1711716979420110934,Oct 10,Passkeys are now the default method when logging in to your personal Google account,https://t.co/lMwfO5T482,4,6,29,9.6K,https://t.co/lMwfO5T482,Google is making passkeys the default option for personal accounts,Google is giving passwords the boot and nudging users to try passkeys.
https://twitter.com/androidcentral,@androidcentral,https://twitter.com/androidcentral/status/1711657618274505115,Oct 10,"Google's Pixel 8 is raising the stakes with its promise of seven years of software updates, and Samsung is feeling the heat and may have to step up its game",https://t.co/Que3dkPd1S,4,9,53,9.8K,,,
https://twitter.com/androidcentral,@androidcentral,https://twitter.com/androidcentral/status/1711448993790664798,Oct 10,The Pixel 8 is the latest example of Google making AI more fun and accessible,https://t.co/5HzLURUjKL,2,5,48,10K,https://t.co/5HzLURUjKL,"With the Pixel 8, Google just won the AI war",Features are best when everyone wants to use them.
https://twitter.com/androidcentral,@androidcentral,https://twitter.com/androidcentral/status/1711443176827801880,Oct 9,Acer Chromebook Plus 515 review: The Chromebook I'll recommend for most,https://t.co/M4dy7REgip,1,19,,8K,,,
https://twitter.com/androidcentral,@androidcentral,https://twitter.com/androidcentral/status/1711435635351867645,Oct 9,Samsung quietly unwraps the Galaxy Tab A9 series in select markets,https://t.co/AgcJWksyP7,3,6,28,9.6K,https://t.co/AgcJWksyP7,Samsung quietly unwraps the Galaxy Tab A9 series in select markets,"The Galaxy Tab A9 and A9 Plus models are spotted in India, UAE, and Guatemala regions."
https://twitter.com/androidcentral,@androidcentral,https://twitter.com/androidcentral/status/1711430096102580687,Oct 9,"The Pixel 8a appears in leaked renders, adopting Pixel 8 design changes",https://t.co/yuQ897Ibd9,7,56,,9.8K,,,
https://twitter.com/androidcentral,@androidcentral,https://twitter.com/androidcentral/status/1711427783526625569,Oct 9,"After making its way to other Android phones, the refreshed At a Glance widget is making its way to more Pixel handsets",https://t.co/LheQole6b8,2,63,,10K,https://t.co/LheQole6b8,More Pixel phones are finally receiving the redesigned Pixel At a Glance widget,It's never too late for the Pixel phones to join the fray.
https://twitter.com/androidcentral,@androidcentral,https://twitter.com/androidcentral/status/1711413166561763807,Oct 9,"Android's ""lime green"" texts get called out in Drake's new album",https://t.co/UeekHbmvEN,5,4,28,13K,,,
https://twitter.com/androidcentral,@androidcentral,https://twitter.com/androidcentral/status/1711407445417893992,Oct 9,Google says that a budget-friendly Pixel phone is not in the cards,https://t.co/x9UaWc9FT8,6,3,44,11K,,,
https://twitter.com/androidcentral,@androidcentral,https://twitter.com/androidcentral/status/1711397365385511162,Oct 9,Meta Quest 3 review: The best VR headset you can buy,https://t.co/BYLg5FQePf,1,18,,8K,,,
https://twitter.com/androidcentral,@androidcentral,https://twitter.com/androidcentral/status/1711353597802226106,Oct 9,The Pixel Watch 2 is that long-awaited Goldilocks watch that doesn't compromise on smarts *or* fitness,https://t.co/gmDWlFy1fg,3,1,41,10K,,,
https://twitter.com/androidcentral,@androidcentral,https://twitter.com/androidcentral/status/1711080299138834921,Oct 8,Why the Pixel 8's Face Unlock upgrade is a big deal,https://t.co/nd6LZSb27f,3,10,101,20K,,,
https://twitter.com/androidcentral,@androidcentral,https://twitter.com/androidcentral/status/1711035000810803432,Oct 8,The Pixel Watch 2 is the casual fitness watch I've been waiting for,https://t.co/V1FbmcqUnZ,3,37,,12K,,,
https://twitter.com/androidcentral,@androidcentral,https://twitter.com/androidcentral/status/1710745433813774820,Oct 8,The Pixel Watch 2 feels like it's finally ready to replace Fitbit,https://t.co/w80AnFdctL,3,2,31,12K,https://t.co/w80AnFdctL,Google Pixel Watch 2 hands-on: Finally fit to replace Fitbit,"Same looks, much more power under the hood."
https://twitter.com/androidcentral,@androidcentral,https://twitter.com/androidcentral/status/1710724499774079100,Oct 8,These are our first impressions of the new Google Pixel 8 and Pixel 8 Pro,https://t.co/jPxIGUwcLg,2,6,63,14K,https://t.co/jPxIGUwcLg,Google Pixel 8 hands-on: The AI powerhouse phone,Google is leveraging its expertise in AI and packing it into the Pixel 8 series.
https://twitter.com/androidcentral,@androidcentral,https://twitter.com/androidcentral/status/1710672587800404021,Oct 7,"With the Pixel 8, Google just won the AI war",https://t.co/Z0tkIhFNJn,2,3,48,12K,https://t.co/Z0tkIhFNJn,"With the Pixel 8, Google just won the AI war",Features are best when everyone wants to use them.
https://twitter.com/androidcentral,@androidcentral,https://twitter.com/androidcentral/status/1710663683280384069,Oct 7,"Xiaomi's latest MIUI version based on Android 14 is here, and it's beating out the competition",https://t.co/i0Z9A0yZ80,1,4,32,19K,https://t.co/i0Z9A0yZ80,"Xiaomi 13, 13 Pro, and 12T finally pick up their sweet Android 14 upgrade","The latest MIUI version based on Android 14 is rolling out now, beating other Android OEMs to the punch."
