UserId_Url,UserId,Tweet_Url,Date-Time,Tweets,,Comments,Retweets,Likes,Impressions
https://twitter.com/AndroidPolice,@AndroidPolice,https://twitter.com/AndroidPolice/status/1723488554435727453,11h,"Samsung isn't innovating as quickly as its completion in foldable phones, and 2024 could be a shift in the tides",https://t.co/xjXIDp4Mdc,3,2,33,8.2K
https://twitter.com/AndroidPolice,@AndroidPolice,https://twitter.com/AndroidPolice/status/1723441316439187496,14h,Essential Accessibility features for low-vision and hard-of-hearing Android users,https://t.co/a1bov4Erc5,1,18,,6.8K
https://twitter.com/AndroidPolice,@AndroidPolice,https://twitter.com/AndroidPolice/status/1723401236274172137,17h,"Samsung lets you stream mobile games to Galaxy devices with Instant Plays, but there's more to it than meets the eye",https://t.co/zZnWPbcJlj,3,31,,7.6K
https://twitter.com/AndroidPolice,@AndroidPolice,https://twitter.com/AndroidPolice/status/1723343823646974348,21h,"Bugdroid is 15 years old and like all teenagers, there have been changes to its body",https://t.co/L2J8Hi74U6,7,45,,8.1K
https://twitter.com/AndroidPolice,@AndroidPolice,https://twitter.com/AndroidPolice/status/1723324784719606169,22h,"If you're tired of Gmail, there are plenty of other great options available",https://t.co/FptEtKLAyC,6,44,,9.6K
,,,,,,,,,
https://twitter.com/Google,@Google,https://twitter.com/search?q=%23HeyGoogle&src=hashtag_click,#HeyGoogle,Click to Follow Google,,,,,
https://twitter.com/Windows,@Windows,,,Click to Follow Windows,,Makes the everyday easier.,,,
https://twitter.com/Microsoft,@Microsoft,https://twitter.com/MicrosoftHelps,@MicrosoftHelps,Click to Follow Microsoft,,We're on a mission to empower every person and every organization on the planet to achieve more. Support:,,,
https://twitter.com/i/connect_people?user_id=98335997,,,,,,,,,
https://twitter.com/AndroidPolice,@AndroidPolice,https://twitter.com/AndroidPolice/status/1723295217770451337,Nov 11,Want to record a call in FaceTime? We've got all the tricks you need to know first,https://t.co/23nkPhxfdY,3,2,19,7.8K
https://twitter.com/AndroidPolice,@AndroidPolice,https://twitter.com/AndroidPolice/status/1723187478910165202,Nov 11,"Days after Signal introduced public usernames, WhatsApp brings them to channels",https://t.co/vsxAXjBgTe,4,43,,9.2K
https://twitter.com/AndroidPolice,@AndroidPolice,https://twitter.com/AndroidPolice/status/1723164702501449732,Nov 11,"The OnePlus Watch 2 has been leaked, and it looks and sounds like a winner",https://t.co/5yiX4Gq6l3,3,21,,7.9K
https://twitter.com/AndroidPolice,@AndroidPolice,https://twitter.com/AndroidPolice/status/1723147827138732280,Nov 11,Get your holiday shopping done early with these weekend-only tech deals,https://t.co/UkjMCWd0aJ,10,,,6.9K
https://twitter.com/AndroidPolice,@AndroidPolice,https://twitter.com/AndroidPolice/status/1723129388827324537,Nov 11,Gboard beta has a neat new trick up its sleeve when you switch to landscape mode,https://t.co/izHUsvxlds,1,1,55,9.2K
https://twitter.com/AndroidPolice,@AndroidPolice,https://twitter.com/AndroidPolice/status/1723101409913057511,Nov 11,"Black Friday isn't what it used to be, and waiting isn't going to help you this year",https://t.co/nG1iYZfgT0,1,2,33,7.8K
https://twitter.com/AndroidPolice,@AndroidPolice,https://twitter.com/AndroidPolice/status/1723080702231466473,Nov 11,Google Drive for Android will make it easy to filter files by who you share them with,https://t.co/IHwh1xzZTn,18,,,6K
https://twitter.com/AndroidPolice,@AndroidPolice,https://twitter.com/AndroidPolice/status/1723058427646136355,Nov 11,Google asked Netflix to prioritize its payment service on the app in 2017,https://t.co/LLxcFlLYwM,1,13,,6.6K
https://twitter.com/AndroidPolice,@AndroidPolice,https://twitter.com/AndroidPolice/status/1723041177983660542,Nov 10,You will soon be able to subscribe to your favorite podcasts on YouTube Music using an RSS feed URL,https://t.co/MgSaWv5Hpd,4,49,,7K
https://twitter.com/AndroidPolice,@AndroidPolice,https://twitter.com/AndroidPolice/status/1723008400546549858,Nov 10,"ANC, wireless charging, app-enabled equalizer, and more are found on the JLab Epic Air Sport earbuds, but they might not fit if you've got big ears",https://t.co/PMhspJZisH,4,,,5K
https://twitter.com/AndroidPolice,@AndroidPolice,https://twitter.com/AndroidPolice/status/1722991519982887191,Nov 10,"Many people report much better battery life on Android 14, and here is one way Google achieved that",https://t.co/SkrwaoamOS,4,11,126,13K
https://twitter.com/AndroidPolice,@AndroidPolice,https://twitter.com/AndroidPolice/status/1722980696757612710,Nov 10,"Black Friday arrives at Walmart with $99 watches, $29 earbuds and cameras",https://t.co/BSfV3VqKJY,7,,,5.2K
https://twitter.com/AndroidPolice,@AndroidPolice,https://twitter.com/AndroidPolice/status/1722963100356239592,Nov 10,Lists on Google Keep don’t really benefit from the new text formatting options,https://t.co/PnOIsPFnw2,2,21,,6.2K
https://twitter.com/AndroidPolice,@AndroidPolice,https://twitter.com/AndroidPolice/status/1722950485911421435,Nov 10,Qualcomm has called off its partnership with Iridium on Snapdragon Satellite,https://t.co/D60eaSAGZI,27,,,6.8K
https://twitter.com/AndroidPolice,@AndroidPolice,https://twitter.com/AndroidPolice/status/1722920624941629577,Nov 10,This Anker 615 USB power strip is just $35 on Amazon with on-page coupon for Prime members,https://t.co/y0I2aBFpVD,5,,,5.5K
https://twitter.com/AndroidPolice,@AndroidPolice,https://twitter.com/AndroidPolice/status/1722900775808962683,Nov 10,The second open beta of Nothing OS 2.5 is now live for the Phone 2 with a bunch of improvements on board,https://t.co/fyHchsbkL5,2,25,,5.8K
https://twitter.com/AndroidPolice,@AndroidPolice,https://twitter.com/AndroidPolice/status/1722798508304953658,Nov 10,Google offered Fortnite owner Epic Games $147 million to put the game on the Play Store,https://t.co/0FL1iTb5AX,1,22,,7.4K
https://twitter.com/AndroidPolice,@AndroidPolice,https://twitter.com/AndroidPolice/status/1722785299619614938,Nov 10,Wondering where you can grab the ROG 7? We've got you covered,https://t.co/47RWJTxFUA,7,,,5.4K
https://twitter.com/AndroidPolice,@AndroidPolice,https://twitter.com/AndroidPolice/status/1722772848308080761,Nov 10,Signal confirms it’s working on introducing usernames to increase privacy,https://t.co/juAw0x96Iu,3,37,,6.7K
https://twitter.com/AndroidPolice,@AndroidPolice,https://twitter.com/AndroidPolice/status/1722754648790999134,Nov 10,Google Wallet now lets you digitize your employee ID,https://t.co/Q5C2U2V9dv,3,20,107,13K
https://twitter.com/AndroidPolice,@AndroidPolice,https://twitter.com/AndroidPolice/status/1722721519745356044,Nov 10,The Galaxy Tab S9 FE is out. How does the Fan Edition compare to the original Galaxy Tab S9?,https://t.co/A3tdwOcZBd,9,,,5.1K
https://twitter.com/AndroidPolice,@AndroidPolice,https://twitter.com/AndroidPolice/status/1722699585187889263,Nov 10,The Play Store now shows what apps look like on different form factors,https://t.co/K95pVKSaqe,1,53,,6.7K
https://twitter.com/AndroidPolice,@AndroidPolice,https://twitter.com/AndroidPolice/status/1722691426402611660,Nov 10,Google Pixel Watch 2 vs. Apple Watch 9: Do you prefer Android or iOS?,https://t.co/NfoWD0z9YH,1,16,,5.9K
https://twitter.com/AndroidPolice,@AndroidPolice,https://twitter.com/AndroidPolice/status/1722686492634452441,Nov 10,Android 15 isn't all that far out anymore — here's everything we'd like to see in it,https://t.co/bx0nN7oSpW,33,,,5.7K
https://twitter.com/AndroidPolice,@AndroidPolice,https://twitter.com/AndroidPolice/status/1722677805878497771,Nov 9,"Google is ending Fitbit sales in over a dozen countries across Europe, Asia, and Africa",https://t.co/7t68i22RvN,13,,,4.7K
https://twitter.com/AndroidPolice,@AndroidPolice,https://twitter.com/AndroidPolice/status/1722669307652452666,Nov 9,"Oppo and Hasselblad join forces creating slick new camera tricks debuting on the OnePlus 12, Find X7, and Reno 11",https://t.co/KEnhUM9rOS,20,,,5.3K
https://twitter.com/AndroidPolice,@AndroidPolice,https://twitter.com/AndroidPolice/status/1722662681910407399,Nov 9,Don't know how to activate Chrome flags or what they even are? We've got you covered.,https://t.co/E0o43ecTWh,1,15,,4.8K
https://twitter.com/AndroidPolice,@AndroidPolice,https://twitter.com/AndroidPolice/status/1722632797511434463,Nov 9,Can you expand the Pixel 8's storage using a microSD card?,https://t.co/XDIypImhOG,17,1,45,13K
https://twitter.com/AndroidPolice,@AndroidPolice,https://twitter.com/AndroidPolice/status/1722626760595104049,Nov 9,Google Drive and Dropbox may be your best bet when your Pixel 8 Pro starts running out of bytes,https://t.co/HGpuQG5JjY,1,19,,5.3K
https://twitter.com/AndroidPolice,@AndroidPolice,https://twitter.com/AndroidPolice/status/1722616282942701892,Nov 9,Try setting a timer for 12 minutes on your Nest speaker and tell us what the result is,https://t.co/QJfzN8CGWS,1,1,9,7.1K
https://twitter.com/AndroidPolice,@AndroidPolice,https://twitter.com/AndroidPolice/status/1722598216888136113,Nov 9,"I've used Samsung phones exclusively for five years now, but the Pixel 8 Pro has me considering a switch to Team Pixel",https://t.co/3NhZKU75qh,6,3,71,11K
https://twitter.com/AndroidPolice,@AndroidPolice,https://twitter.com/AndroidPolice/status/1722590852583727129,Nov 9,Xiaomi is getting a lot more restrictive about unlocking the bootloader of its HyperOS phones,https://t.co/AwJOjQLXHq,2,24,,6.4K
https://twitter.com/AndroidPolice,@AndroidPolice,https://twitter.com/AndroidPolice/status/1722582790632301049,Nov 9,Google is announcing SGE's expansion into 120 countries while also adding a couple of nifty features to the AI-based search tool,https://t.co/aTIYrxSehQ,1,2,22,7K
https://twitter.com/AndroidPolice,@AndroidPolice,https://twitter.com/AndroidPolice/status/1722569514993213805,Nov 9,Chrome might prompt you to restore your web apps on your new Android phone,https://t.co/2tYyaT12tQ,1,28,,5.6K
https://twitter.com/AndroidPolice,@AndroidPolice,https://twitter.com/AndroidPolice/status/1722549614589477108,Nov 9,You can now access the home panel's Spaces and Favorites right from your Android lock screen,https://t.co/OaQykigpcZ,2,16,,6K
https://twitter.com/AndroidPolice,@AndroidPolice,https://twitter.com/AndroidPolice/status/1722542164184281459,Nov 9,Samsung is teasing one of many AI-powered features coming with the Galaxy S24 next year,https://t.co/EiCeFzpcVQ,1,19,,5.6K
https://twitter.com/AndroidPolice,@AndroidPolice,https://twitter.com/AndroidPolice/status/1722411460955976169,Nov 9,Don't miss this massive discount on one of our favorite smartwatches for sports and outdoors,https://t.co/tKB2CqTDyQ,11,,,5.6K
https://twitter.com/AndroidPolice,@AndroidPolice,https://twitter.com/AndroidPolice/status/1722402236918042895,Nov 9,Google appears to be adding a basic Pixel Watch feature that should've been there all along,https://t.co/B9zuz0eJcI,2,7,58,7.7K
https://twitter.com/AndroidPolice,@AndroidPolice,https://twitter.com/AndroidPolice/status/1722394749586346318,Nov 9,OnePlus has a special limited-time code that takes up to $200 off their best devices,https://t.co/gEhNqMkvs9,9,,,5.5K
https://twitter.com/AndroidPolice,@AndroidPolice,https://twitter.com/AndroidPolice/status/1722383237706551566,Nov 9,Android 14's dual display mode could spur creative third-party development for foldables,https://t.co/TIPs4xCKRf,3,27,,6.4K
https://twitter.com/AndroidPolice,@AndroidPolice,https://twitter.com/AndroidPolice/status/1722359124820652095,Nov 9,Ensure your Samsung Galaxy Z Fold 5 or Z Flip 5 is protected with Caseborne's range of phone cases.,https://t.co/Uz0nJyzglj,9,,,5.3K
https://twitter.com/AndroidPolice,@AndroidPolice,https://twitter.com/AndroidPolice/status/1722351213415440490,Nov 9,Gmail is testing a new message composition box for its Android app,https://t.co/VGFkYfLjPQ,36,,,5.7K
https://twitter.com/AndroidPolice,@AndroidPolice,https://twitter.com/AndroidPolice/status/1722331880589025363,Nov 9,WhatsApp is considering launching ads within the app with one exception,https://t.co/jgLorXmDOV,11,,,5.1K
https://twitter.com/AndroidPolice,@AndroidPolice,https://twitter.com/AndroidPolice/status/1722328813193839097,Nov 9,"Which of Google's premium Pixel phones should you buy, the 8 Pro or the Fold?",https://t.co/njFWtzKfba,2,1,21,5.4K
https://twitter.com/AndroidPolice,@AndroidPolice,https://twitter.com/AndroidPolice/status/1722323084366012501,Nov 9,"With Google unable to persuade Apple to bring RCS support to iMessage, it's doing the next best thing: turning to EU regulators",https://t.co/ukV0K3084I,16,41,250,28K
https://twitter.com/AndroidPolice,@AndroidPolice,https://twitter.com/AndroidPolice/status/1722315244544901499,Nov 8,Gift the ultimate style and comfort of AndaSeat Gaming chairs during the holidays.,https://t.co/8oiCrmfx4K,5,,,3K
https://twitter.com/AndroidPolice,@AndroidPolice,https://twitter.com/AndroidPolice/status/1722292359092711496,Nov 8,What's better than free things you never knew you needed?,https://t.co/Jt00HxDvTF,15,,,5.2K
https://twitter.com/AndroidPolice,@AndroidPolice,https://twitter.com/AndroidPolice/status/1722283811424317477,Nov 8,Looking for earbuds that *don't* block external noise? Check these out.,https://t.co/QwJGT3sB5d,1,10,,4.9K
https://twitter.com/AndroidPolice,@AndroidPolice,https://twitter.com/AndroidPolice/status/1722269314836054025,Nov 8,Google Photos won't play along with your fake ID dreams using Magic Editor,https://t.co/LNnhgQceU1,2,42,,6.2K
https://twitter.com/AndroidPolice,@AndroidPolice,https://twitter.com/AndroidPolice/status/1722260331966390359,Nov 8,An F2FS file system bug was the root cause behind some Pixel users being locked out of their phone’s internal storage,https://t.co/tuD2PgxEVM,3,44,,6.3K
https://twitter.com/AndroidPolice,@AndroidPolice,https://twitter.com/AndroidPolice/status/1722255528238444970,Nov 8,"Google Drive's under-development redesign for Android doesn't look great, but it has a couple of other handy additions",https://t.co/onojD7rTuA,1,4,50,7.9K
https://twitter.com/AndroidPolice,@AndroidPolice,https://twitter.com/AndroidPolice/status/1722241755574325424,Nov 8,"The OnePlus Open is an impressive piece of foldable hardware. In 2024, here's what Samsung and Google need to learn to compete",https://t.co/V52ceqGTs6,2,21,,6.4K
https://twitter.com/AndroidPolice,@AndroidPolice,https://twitter.com/AndroidPolice/status/1722222963771191475,Nov 8,Chrome will soon look just a little more up-to-date thanks to MD3 toggles,https://t.co/SdaQPcqP4T,1,47,,8.1K
https://twitter.com/AndroidPolice,@AndroidPolice,https://twitter.com/AndroidPolice/status/1722211308572119546,Nov 8,"After Epic's latest round of layoffs, you have to wonder if Bandcamp would be better off in any other company's hands",https://t.co/vIB2xdv2P6,2,16,,6.1K
https://twitter.com/AndroidPolice,@AndroidPolice,https://twitter.com/AndroidPolice/status/1722196766467006877,Nov 8,Google's latest gimmick is a one-stop shop for product discounts from across the web,https://t.co/g6max4zsKT,11,,,5.8K
https://twitter.com/AndroidPolice,@AndroidPolice,https://twitter.com/AndroidPolice/status/1722107345201672578,Nov 8,The Samsung Galaxy Tab S9 FE+ borrows a lot from the regular Tab S9 — including a crucial accessory,https://t.co/fbqoiyxA6a,1,1,19,7.1K
https://twitter.com/AndroidPolice,@AndroidPolice,https://twitter.com/AndroidPolice/status/1722079980031516807,Nov 8,Crash history alerts from Waze might get you to rethink your route,https://t.co/9R5YPSK31b,1,2,16,6.3K
https://twitter.com/AndroidPolice,@AndroidPolice,https://twitter.com/AndroidPolice/status/1722055105581645886,Nov 8,The Google Play Store could soon allow you to uninstall apps from connected devices remotely,https://t.co/07MN2QTEIZ,2,9,68,8.8K
https://twitter.com/AndroidPolice,@AndroidPolice,https://twitter.com/AndroidPolice/status/1722046689408692301,Nov 8,Anker’s fantastic 100W GaN charger is down to just $43 for Amazon Prime members,https://t.co/3EZbbwzpgs,1,11,,6.1K
https://twitter.com/AndroidPolice,@AndroidPolice,https://twitter.com/AndroidPolice/status/1722035043038613809,Nov 8,"Anker's new 20,000mAh power bank is $10 off in its first-ever deal",https://t.co/3aZDi4ppZm,1,1,30,7.1K
https://twitter.com/AndroidPolice,@AndroidPolice,https://twitter.com/AndroidPolice/status/1722028557772202004,Nov 8,Your one-stop shop for Black Friday discounts on Google Gear,https://t.co/R058SMWQKt,23,,,5.6K
https://twitter.com/AndroidPolice,@AndroidPolice,https://twitter.com/AndroidPolice/status/1722018875535978998,Nov 8,"Google Home can help you write smart home automation scripts now, but the experience has rough edges",https://t.co/X0kIgczqsO,1,2,21,5.9K
https://twitter.com/AndroidPolice,@AndroidPolice,https://twitter.com/AndroidPolice/status/1722009668992586200,Nov 8,Alexa just turned 9 years old and Amazon is celebrating with awesome discounts,https://t.co/YWaFsm4Nox,1,8,,5.3K
https://twitter.com/AndroidPolice,@AndroidPolice,https://twitter.com/AndroidPolice/status/1721990953534124528,Nov 8,The Google Pixel Watch 2 comes with a 6-month trial of Fitbit Premium — but do you have to subscribe once it's over?,https://t.co/RTGdpcLZD0,6,2,33,9.4K
https://twitter.com/AndroidPolice,@AndroidPolice,https://twitter.com/AndroidPolice/status/1721966408064471316,Nov 8,"The new Fitbit Charge 6 is here, but is it enough of an upgrade from the classic Charge 4?",https://t.co/4E8I3sTxta,1,2,20,6.6K
https://twitter.com/AndroidPolice,@AndroidPolice,https://twitter.com/AndroidPolice/status/1721949819093074348,Nov 7,Google Home’s script editor on the web is gaining AI integration,https://t.co/rc4ZgSCXc8,20,,,5.8K
https://twitter.com/AndroidPolice,@AndroidPolice,https://twitter.com/AndroidPolice/status/1721941152222351499,Nov 7,A beta of WhatsApp Web has revealed the inclusion of a calendar icon for more specific searches within chats,https://t.co/xrNRJLcqKS,2,20,,5.7K
https://twitter.com/AndroidPolice,@AndroidPolice,https://twitter.com/AndroidPolice/status/1721929131338633492,Nov 7,YouTube starts experimenting with a Bard-like chatbot and AI summarization for comments,https://t.co/v5Gyfkg6t0,2,33,,6.3K
https://twitter.com/AndroidPolice,@AndroidPolice,https://twitter.com/AndroidPolice/status/1721915158530806206,Nov 7,Why wait years to upgrade your phone when you can do it any time you want with T-Mobile JUMP!,https://t.co/yInltlWq23,2,14,,6K
https://twitter.com/AndroidPolice,@AndroidPolice,https://twitter.com/AndroidPolice/status/1721901637843984729,Nov 7,ExpressVPN elevates its app game by integrating a password manager tool,https://t.co/VBKjZFjjo0,10,,,5.2K
https://twitter.com/AndroidPolice,@AndroidPolice,https://twitter.com/AndroidPolice/status/1721892971619209437,Nov 7,"Google's new Magic Editor is novel, but is it dangerous? Probably not",https://t.co/8OGuhA2Vbp,1,8,,5.1K
https://twitter.com/AndroidPolice,@AndroidPolice,https://twitter.com/AndroidPolice/status/1721885391110955411,Nov 7,"After a heart attack and other major health events, here's why I'm sticking with the Apple Watch instead of switching to Google",https://t.co/eG1BxGJYPl,1,12,,6.2K
https://twitter.com/AndroidPolice,@AndroidPolice,https://twitter.com/AndroidPolice/status/1721877917976727739,Nov 7,Bluepoch should go back in time to fix Reverse: 1999,https://t.co/4v97Krd4eg,5,,,4.9K
https://twitter.com/AndroidPolice,@AndroidPolice,https://twitter.com/AndroidPolice/status/1721858650464031034,Nov 7,"In a world of foldables and phablets, is there any space left for 8-inch Android tablets?",https://t.co/UJkgiu8r5t,4,3,22,8.4K
https://twitter.com/AndroidPolice,@AndroidPolice,https://twitter.com/AndroidPolice/status/1721848797096013834,Nov 7,Worried about dropping or losing your new phone? Verizon Mobile Protect could be the solution if the price is right and you meet these requirements,https://t.co/QcaxqpZ8Ds,2,6,,5.5K
https://twitter.com/AndroidPolice,@AndroidPolice,https://twitter.com/AndroidPolice/status/1721835871563846078,Nov 7,Google Photos might soon get a neat update to Marie Kondo your messy library,https://t.co/9Ha8Lc1KQV,2,32,,6.3K
https://twitter.com/AndroidPolice,@AndroidPolice,https://twitter.com/AndroidPolice/status/1721815000379978207,Nov 7,Latest Google Slides update finally adds a built-in tool to search for GIFs and stickers,https://t.co/ChS1MI9d8s,3,18,,5.7K
https://twitter.com/AndroidPolice,@AndroidPolice,https://twitter.com/AndroidPolice/status/1721808028855382404,Nov 7,The Xperia 1 V gets some features from the Xperia 5 V as a part of its Android 14 update,https://t.co/bh5aFJm7oK,1,4,29,7.4K
https://twitter.com/AndroidPolice,@AndroidPolice,https://twitter.com/AndroidPolice/status/1721738383813218714,Nov 7,Firefox 120 will launch with 200 new Android extensions this December,https://t.co/KYXHjNmqcw,10,85,,9.5K
https://twitter.com/AndroidPolice,@AndroidPolice,https://twitter.com/AndroidPolice/status/1721706738317971492,Nov 7,Google Maps for Android Auto will soon receive a few visual updates,https://t.co/tmbcQcUXTS,1,43,,7.9K
https://twitter.com/AndroidPolice,@AndroidPolice,https://twitter.com/AndroidPolice/status/1721674587786674562,Nov 7,Simply irWRISTsistable: get the Galaxy Watch 5 Pro at its all-time low price,https://t.co/08nXKgrMr3,7,,,5.7K
https://twitter.com/AndroidPolice,@AndroidPolice,https://twitter.com/AndroidPolice/status/1721640866823950549,Nov 7,The Motorola Razr (2023) gets even cheaper in this amazing deal,https://t.co/q3kXyozTOl,16,,,5.7K
https://twitter.com/AndroidPolice,@AndroidPolice,https://twitter.com/AndroidPolice/status/1721607777989140937,Nov 7,November's security patches have started rolling out to Google's Pixel phones,https://t.co/SbVT3BpESX,1,6,109,10K
https://twitter.com/AndroidPolice,@AndroidPolice,https://twitter.com/AndroidPolice/status/1721589411576418573,Nov 6,A couple of WhatsApp beta updates over the weekend detail the addition of Channel polls and the reappearance of Muted updates,https://t.co/jl7JyMa0ft,6,19,,5.8K
https://twitter.com/AndroidPolice,@AndroidPolice,https://twitter.com/AndroidPolice/status/1721571655456014710,Nov 6,We go hands-on with Magic Editor on the Pixel 8 to see how good it is,https://t.co/E6gMF3FOTI,3,38,,6.8K
https://twitter.com/AndroidPolice,@AndroidPolice,https://twitter.com/AndroidPolice/status/1721561675076075835,Nov 6,There's no point spending more just to run Plex: the TerraMaster F2-212 NAS checks all the necessary boxes,https://t.co/UJzHl70FsV,3,2,4,6.6K
https://twitter.com/AndroidPolice,@AndroidPolice,https://twitter.com/AndroidPolice/status/1721555003515535546,Nov 6,"Samsung Galaxy Buds FE offer a mid-level price, but are you sacrificing convenient features like wireless charging for a lower cost?",https://t.co/tQdOmmYhuX,10,,,5.5K
https://twitter.com/AndroidPolice,@AndroidPolice,https://twitter.com/AndroidPolice/status/1721544457202381293,Nov 6,Google and OnePlus flagships go head-to-head,https://t.co/bm36uds5Kb,2,17,,6.7K
https://twitter.com/AndroidPolice,@AndroidPolice,https://twitter.com/AndroidPolice/status/1721533893596020896,Nov 6,Can the Google Pixel 8 manage precision location finding over UWB? We find out.,https://t.co/xUYsARhOqu,2,29,,6.9K
https://twitter.com/AndroidPolice,@AndroidPolice,https://twitter.com/AndroidPolice/status/1721526170322096550,Nov 6,Not sure where your downloads folder is located on your Pixel Tablet?,https://t.co/3Wv0sViasw,1,8,,5.4K
https://twitter.com/AndroidPolice,@AndroidPolice,https://twitter.com/AndroidPolice/status/1721504288013177045,Nov 6,"Google Calendar was one of the first apps to use predictive back gestures on Android 14, and now they work without developer options",https://t.co/xirjQye7AZ,2,9,84,12K
https://twitter.com/AndroidPolice,@AndroidPolice,https://twitter.com/AndroidPolice/status/1721494225848594834,Nov 6,Samsung could integrate ChatGPT or Google Bard on its 2024 flagship,https://t.co/cIomObaJMw,5,7,58,10K
https://twitter.com/AndroidPolice,@AndroidPolice,https://twitter.com/AndroidPolice/status/1721331876785164649,Nov 6,"The Galaxy S23 FE, OnePlus Open, Snapdragon X Elite, Pixel 8, and Pixel Watch 2 make for a long laundry list. The AP podcast is here to tackle it",https://t.co/NjiaBy62y1,9,34,,11K
https://twitter.com/AndroidPolice,@AndroidPolice,https://twitter.com/AndroidPolice/status/1721205652301738351,Nov 5,"YouTube appears to be experimenting with a mystery button on its Android app, providing quick access to suggested videos",https://t.co/BHq3FTVFuZ,2,10,68,14K
https://twitter.com/AndroidPolice,@AndroidPolice,https://twitter.com/AndroidPolice/status/1721197564014231935,Nov 5,"If full-price console games were more prevalent on Android, would you be willing to shell out for them?",https://t.co/hPuNVpKL12,7,4,25,11K
https://twitter.com/AndroidPolice,@AndroidPolice,https://twitter.com/AndroidPolice/status/1721156086898508170,Nov 5,"Now that Techtober has given way to the chaos of November's Black Friday blitz, it's time to look back on our favorite device reviews of the month",https://t.co/q4uEYlABKf,1,5,36,10K
https://twitter.com/AndroidPolice,@AndroidPolice,https://twitter.com/AndroidPolice/status/1721134574338453860,Nov 5,Everything you need to know about storage on the OnePlus Open,https://t.co/jVMc6vK9r2,3,35,,9.4K
https://twitter.com/AndroidPolice,@AndroidPolice,https://twitter.com/AndroidPolice/status/1720851413570367770,Nov 4,Google should totally copy the Apple Watch's double tap feature,https://t.co/7CoSeueBBW,2,4,47,10K
https://twitter.com/AndroidPolice,@AndroidPolice,https://twitter.com/AndroidPolice/status/1720819312989020572,Nov 4,"Microsoft take note, this is how you make a controller",https://t.co/KGEaczoG7d,1,27,,8.9K
https://twitter.com/AndroidPolice,@AndroidPolice,https://twitter.com/AndroidPolice/status/1720796634643108271,Nov 4,Google Password Manager on Android is preparing for a redesign with a new bottom navigation bar and other minor design tweaks,https://t.co/xrLD73cYsj,2,6,83,12K
