UserId_Url,UserId,Tweet_Url,,Tweets,,Comments,Retweets,Likes,Impressions,,,
https://twitter.com/androidcentral,@androidcentral,https://twitter.com/androidcentral/status/1711732504481140855,Oct 10,"Prime Big Deal Days is officially here, and we're sharing all of the best phone deals over the next few days as Amazon posts them. Check this page for live updates!",https://t.co/2SEkQtpLOO,6,4,45,12K,,,
https://twitter.com/androidcentral,@androidcentral,https://twitter.com/androidcentral/status/1723580530170445998,5h,"The unified Disney Plus and Hulu app will kick off in beta next month, with a full rollout planned for early 2024",https://t.co/Wd0nouR0hy,1,1,15,6.2K,,,
https://twitter.com/androidcentral,@androidcentral,https://twitter.com/androidcentral/status/1723458399889666469,13h,This is the biggest problem facing Chinese phone brands,https://t.co/u5525qKQVY,5,1,31,12K,,,
https://twitter.com/androidcentral,@androidcentral,https://twitter.com/androidcentral/status/1723447369830736215,14h,"You probably haven't heard of GPS handhelds before, but this expensive model could save your life",https://t.co/bo8XE8pcWT,1,20,,7.5K,,,
https://twitter.com/androidcentral,@androidcentral,https://twitter.com/androidcentral/status/1723441832724435229,14h,5 things to do first when you get new headphones or earbuds,https://t.co/mV9QHB6X7w,1,38,,8.2K,,,
,,,,,,,,,,,,
https://twitter.com/Google,Follow,https://twitter.com/search?q=%23HeyGoogle&src=hashtag_click,#HeyGoogle,,,,,,,,,
https://twitter.com/AndroidPolice,Follow,,,"We cover Android news, apps and games, phones and tablets. Sometimes we rant. Got a hot tip? tips@androidpolice.com.",,,,,,,,
https://twitter.com/Windows,Follow,,,Makes the everyday easier.,,,,,,,,
,,,,,,,,,,,,
https://twitter.com/androidcentral,@androidcentral,https://twitter.com/androidcentral/status/1723425326036832561,16h,We wanted to see if the Pixel 8 Pro temperature sensor was actually worth including,https://t.co/E3NEpOA8OO,2,4,50,9.9K,,,
https://twitter.com/androidcentral,@androidcentral,https://twitter.com/androidcentral/status/1723399459214590386,17h,Galaxy S23 gets One UI 6 (Android 14) update in the US,https://t.co/YINXuCYvy1,1,1,64,9.1K,,,
https://twitter.com/androidcentral,@androidcentral,https://twitter.com/androidcentral/status/1723391559746335189,18h,"From Zuckerberg's China gambit with the Quest 3 Lite to an insanely packed schedule of games like Assassin's Creed Nexus, these are all the VR news highlights you need to know",https://t.co/OkpJMiZfWS,10,,,7K,,,
https://twitter.com/androidcentral,@androidcentral,https://twitter.com/androidcentral/status/1723371282379464958,19h,"We didn't really want satellite phones after all, did we?",https://t.co/XV1qwJtX71,2,37,,8.1K,,,
https://twitter.com/androidcentral,@androidcentral,https://twitter.com/androidcentral/status/1723330241576263754,22h,"Mixed reality is great for entertainment while doing monotonous chores, but did you know there were even more reasons to not take the headset off?",https://t.co/UyFW4gUJUx,1,22,,8.3K,,,
https://twitter.com/androidcentral,@androidcentral,https://twitter.com/androidcentral/status/1723196386617811099,Nov 11,"Pico currently rules the roost in China's VR market, but a Meta Quest 3 Lite could put that crown in jeopardy for ByteDance",https://t.co/LI3jvm0Fc0,3,29,,8.6K,,,
https://twitter.com/androidcentral,@androidcentral,https://twitter.com/androidcentral/status/1723103266655875103,Nov 11,Google offered Netflix a unique deal to stick with Play Store billing,https://t.co/m0YuCP1p6J,2,31,,8.1K,,,
https://twitter.com/androidcentral,@androidcentral,https://twitter.com/androidcentral/status/1723096228706005032,Nov 11,Gmail tests redesign on Android with a chat-style UI for replying to emails,https://t.co/KZyy0tCT25,2,9,64,11K,,,
https://twitter.com/androidcentral,@androidcentral,https://twitter.com/androidcentral/status/1723091929586356474,Nov 11,Google TV redesign will say goodbye to boxy app icons,https://t.co/HHzC1NaUOp,4,48,,8.7K,,,
https://twitter.com/androidcentral,@androidcentral,https://twitter.com/androidcentral/status/1723074005307933151,Nov 11,"Facebook has been banned in China for 14 years, but a new deal could bring an important Meta product to the country for the first time",https://t.co/0dpLk4hYaU,2,16,,6.3K,,,
https://twitter.com/androidcentral,@androidcentral,https://twitter.com/androidcentral/status/1723054177335533705,Nov 11,The OnePlus 12 camera should be just as good as the OnePlus Open,https://t.co/QgvPpcP8W2,23,,,7.3K,,,
https://twitter.com/androidcentral,@androidcentral,https://twitter.com/androidcentral/status/1723042861627621621,Nov 10,"OnePlus Watch 2 leak reveals sleek new design, could launch with Wear OS 4",https://t.co/FAYzTgjAPV,5,45,,8K,,,
https://twitter.com/androidcentral,@androidcentral,https://twitter.com/androidcentral/status/1723031531575214288,Nov 10,This Android-powered retro handheld gives us major Sega Genesis vibes,https://t.co/lG0pYTIPR5,30,,,6.4K,,,
https://twitter.com/androidcentral,@androidcentral,https://twitter.com/androidcentral/status/1722992782904561887,Nov 10,"Amazon is reportedly planning to ditch Android for its own Fire OS replacement, finally breaking free from Google's shackles",https://t.co/tJcs5rR5dL,1,4,40,9.7K,,,
https://twitter.com/androidcentral,@androidcentral,https://twitter.com/androidcentral/status/1722948497056452854,Nov 10,The OnePlus Open and OPPO Pen put the Galaxy Z Fold 5 to shame,https://t.co/ZdPPrbpNbH,2,4,24,8.4K,,,
https://twitter.com/androidcentral,@androidcentral,https://twitter.com/androidcentral/status/1722924586243604556,Nov 10,"Google's rolling out its fancy AI search to over 120 countries and territories, and it's got your back with even more languages",https://t.co/GH8ZCTqzFt,1,23,,7K,,,
https://twitter.com/androidcentral,@androidcentral,https://twitter.com/androidcentral/status/1722771082531291259,Nov 10,"Google Messages may finally get a long-awaited ""Profiles"" feature",https://t.co/t1JFaPXYdS,2,6,63,8.9K,,,
https://twitter.com/androidcentral,@androidcentral,https://twitter.com/androidcentral/status/1722742879380975657,Nov 10,We almost got the Google Play Store on Meta Quest headsets,https://t.co/vOOxIuA3yA,15,,,6.3K,,,
https://twitter.com/androidcentral,@androidcentral,https://twitter.com/androidcentral/status/1722734834311729522,Nov 10,Spotify gets a breath of fresh air on smart TVs as its redesign rolls out,https://t.co/1AFe1bz2Nu,23,,,6.6K,,,
https://twitter.com/androidcentral,@androidcentral,https://twitter.com/androidcentral/status/1722725520717029745,Nov 10,Epic turned down an epic offer from Google to get Fortnite on the Play Store,https://t.co/vMAIAiVFk2,1,1,25,8.1K,,,
https://twitter.com/androidcentral,@androidcentral,https://twitter.com/androidcentral/status/1722722260350279714,Nov 10,Samsung reportedly wants to produce affordable folding phones,https://t.co/XlvbQ4Aooa,2,27,,6.4K,,,
https://twitter.com/androidcentral,@androidcentral,https://twitter.com/androidcentral/status/1722689789525110884,Nov 10,"Nothing OS 2.5 Open Beta 2 improves Glyph Interface, previews new widgets",https://t.co/RJx7l33OvH,6,28,,7K,,,
https://twitter.com/androidcentral,@androidcentral,https://twitter.com/androidcentral/status/1722687526257701073,Nov 10,Leaked Galaxy Fit 3 renders show a larger display to challenge the Fitbit Charge 6,https://t.co/v1iRC9sNxY,1,3,24,6.6K,,,
https://twitter.com/androidcentral,@androidcentral,https://twitter.com/androidcentral/status/1722651459739697598,Nov 9,Have you ever washed the dishes or cooked while wearing a VR headset? You might be surprised at its usefulness!,https://t.co/EGcGl2UDRT,2,32,,7.3K,,,
https://twitter.com/androidcentral,@androidcentral,https://twitter.com/androidcentral/status/1722619171975160103,Nov 9,"Most people use GPS watches to track their hikes, but you can make a case for this Garmin GPS+Satellite handheld instead",https://t.co/p7FQ0SxYCG,1,2,26,7K,,,
https://twitter.com/androidcentral,@androidcentral,https://twitter.com/androidcentral/status/1722606953137111513,Nov 9,"You can buy earbuds that act as a heart rate tracker, but Google is trying to use the ones you already have",https://t.co/SUOF7yMFBP,2,32,,7.2K,,,
https://twitter.com/androidcentral,@androidcentral,https://twitter.com/androidcentral/status/1722494602559590432,Nov 9,"Samsung flaunts its new mobile AI experience known as Galaxy AI, set to grace the Galaxy S24 series next year",https://t.co/NuUZxKHNXB,4,49,,9.1K,,,
https://twitter.com/androidcentral,@androidcentral,https://twitter.com/androidcentral/status/1722390301313061350,Nov 9,There are things that Google's Magic Editor won't 'fix',https://t.co/QMCT3wl3bS,4,24,,7.1K,,,
https://twitter.com/androidcentral,@androidcentral,https://twitter.com/androidcentral/status/1722375716279328804,Nov 9,"Spotify takes the fight to Audible with 200,000 'free' audiobooks, but there's a catch",https://t.co/71rBoYQfdp,14,,,6.5K,,,
https://twitter.com/androidcentral,@androidcentral,https://twitter.com/androidcentral/status/1722371435941732864,Nov 9,Google opts for a different approach to get iMessage to support RCS: going straight to the regulators,https://t.co/pS4ijySoip,10,62,,9.5K,,,
https://twitter.com/androidcentral,@androidcentral,https://twitter.com/androidcentral/status/1722357093301100888,Nov 9,The Galaxy Z Fold 5 and Z Flip 5 are one step closer to Android 14,https://t.co/cfSycctgST,22,,,5.9K,,,
https://twitter.com/androidcentral,@androidcentral,https://twitter.com/androidcentral/status/1722355210511626698,Nov 9,"TicWatch Pro 5 update brings new features, but still no Google Assistant",https://t.co/EPQzD72Smb,2,23,,6.5K,,,
https://twitter.com/androidcentral,@androidcentral,https://twitter.com/androidcentral/status/1722332654253560095,Nov 9,Chrome's new tab memory snitch lets you identify the memory hogs slowing you down when you hover over a tab,https://t.co/po0sS7qGHy,3,24,,6.8K,,,
https://twitter.com/androidcentral,@androidcentral,https://twitter.com/androidcentral/status/1722314939669365120,Nov 8,The Pixel 8 Pro temperature sensor is only good for one thing (and hardly even that),https://t.co/5YEdpY0tho,2,1,44,9.8K,,,
https://twitter.com/androidcentral,@androidcentral,https://twitter.com/androidcentral/status/1722284247581413479,Nov 8,"Most people haven't used (or heard of) GPS handhelds, but this expensive satellite model could save your life in the wilderness",https://t.co/OoyBmI6ZOi,4,23,,7.3K,,,
https://twitter.com/androidcentral,@androidcentral,https://twitter.com/androidcentral/status/1722129847122583917,Nov 8,The Google Pixel 4a just scored an unexpected update,https://t.co/BjhlAreHP6,1,23,,8.7K,,,
https://twitter.com/androidcentral,@androidcentral,https://twitter.com/androidcentral/status/1722072970858750326,Nov 8,"You can now use AI to create your own Popsockets case, grip, or wallet",https://t.co/TONi8E3Fb3,3,7,27,8.2K,,,
https://twitter.com/androidcentral,@androidcentral,https://twitter.com/androidcentral/status/1722052304826720714,Nov 8,Google launches a new tool to track shopping deals ahead of the holidays,https://t.co/CfoPppEnoa,2,9,62,10K,,,
https://twitter.com/androidcentral,@androidcentral,https://twitter.com/androidcentral/status/1722045150703096119,Nov 8,The first Pixel Watch 2 update is a small one,https://t.co/bsntvFHIqL,2,4,45,8.4K,,,
https://twitter.com/androidcentral,@androidcentral,https://twitter.com/androidcentral/status/1722034189095022849,Nov 8,Celebrate Amazon Alexa's birthday with these crazy Black Friday deals,https://t.co/JAuN3eX3qP,2,15,,7K,,,
https://twitter.com/androidcentral,@androidcentral,https://twitter.com/androidcentral/status/1722017373341819046,Nov 8,"The Samsung Galaxy S Pen 'Creator Edition' finally arrives, with a few caveats",https://t.co/YzAmLYvrdT,1,3,31,7.9K,,,
https://twitter.com/androidcentral,@androidcentral,https://twitter.com/androidcentral/status/1722013455429800268,Nov 8,New Waze feature aims to keep you safe on accident-prone roads,https://t.co/uisiS26pYO,2,23,,7.3K,,,
https://twitter.com/androidcentral,@androidcentral,https://twitter.com/androidcentral/status/1722002267136557373,Nov 8,Uninstalling Android apps on other devices is about to become a lot easier,https://t.co/6j6MUXAEn6,1,29,,6.6K,,,
https://twitter.com/androidcentral,@androidcentral,https://twitter.com/androidcentral/status/1721999747731382680,Nov 8,Galaxy S24 Ultra shows up on Geekbench for a performance check-in,https://t.co/iwuUkdbaTN,2,46,,8.2K,,,
https://twitter.com/androidcentral,@androidcentral,https://twitter.com/androidcentral/status/1721585512715059451,Nov 6,Google Chat's new logo puts it in the same class as its productivity peers,https://t.co/Lzbjhji4fI,3,31,,7K,,,
https://twitter.com/androidcentral,@androidcentral,https://twitter.com/androidcentral/status/1721574926136533373,Nov 6,"After the iPhone 15 Pro, Samsung may push for a titanium Galaxy S24 Ultra",https://t.co/7dEPVR9Jt9,17,,,6.3K,,,
https://twitter.com/androidcentral,@androidcentral,https://twitter.com/androidcentral/status/1721566892421243179,Nov 6,"Max downgrades ad-free plan to Full HD, adds a more expensive tier with 4K",https://t.co/vZgMaP19Uw,2,25,,6.9K,,,
https://twitter.com/androidcentral,@androidcentral,https://twitter.com/androidcentral/status/1721526054668337476,Nov 6,"Fitbit's Daily Readiness score is very useful, but there's one obvious area where it could improve",https://t.co/JK7tigqnF5,2,23,,6.5K,,,
https://twitter.com/androidcentral,@androidcentral,https://twitter.com/androidcentral/status/1721499856802394144,Nov 6,Google has removed the option to get COVID-19 exposure notifications in Android's settings,https://t.co/JkuaqnxgYW,1,6,45,10K,,,
https://twitter.com/androidcentral,@androidcentral,https://twitter.com/androidcentral/status/1721426613823320552,Nov 6,"It seems like Qualcomm's Snapdragon 8 Gen 3 for Galaxy chip might be getting a speed boost for its main core and GPU, but the other cores might be underclocked",https://t.co/0OoSfMYc1r,1,6,32,9.6K,,,
https://twitter.com/androidcentral,@androidcentral,https://twitter.com/androidcentral/status/1721259594322747400,Nov 6,"Our full review of the Pixel Watch 2 is up, and there's a lot to like about this second-generation smartwatch",https://t.co/5VsNm2lnNR,1,3,49,11K,,,
https://twitter.com/androidcentral,@androidcentral,https://twitter.com/androidcentral/status/1721254423333048559,Nov 6,Garmin's best running watches are getting smarter with new sleep tricks and Body Battery insights plucked from the Venu 3,https://t.co/krMsu3tetx,19,,,9.2K,,,
https://twitter.com/androidcentral,@androidcentral,https://twitter.com/androidcentral/status/1721248517165814201,Nov 6,The latest update for the Razr Plus brings more than just a few bug fixes,https://t.co/g2lU311VFS,3,32,,9.4K,,,
https://twitter.com/androidcentral,@androidcentral,https://twitter.com/androidcentral/status/1721242243338477589,Nov 6,"Foldable phones are great, but the software holds them back from achieving their full potential. Here are some software issues",https://t.co/Y4pKWH61uY,1,3,32,10K,,,
https://twitter.com/androidcentral,@androidcentral,https://twitter.com/androidcentral/status/1721236213636399608,Nov 6,"The chip powering the Galaxy S25 may bring ""astonishing levels of performance,"" but that could come at a hefty price",https://t.co/1PAYF3oExW,6,43,,10K,,,
https://twitter.com/androidcentral,@androidcentral,https://twitter.com/androidcentral/status/1721230871670165965,Nov 5,Google wants to upgrade your earbuds with health-tracking features,https://t.co/joJOFA4qBu,3,9,52,12K,,,
https://twitter.com/androidcentral,@androidcentral,https://twitter.com/androidcentral/status/1721198727182848421,Nov 5,"The Charge 6 is a solid fitness tracker, but it has its flaws. Here's how Fitbit should improve the next generation, both for hardware and software",https://t.co/3LCnuFFmUD,2,5,28,9.8K,,,
https://twitter.com/androidcentral,@androidcentral,https://twitter.com/androidcentral/status/1720865272028909654,Nov 4,"VR news of the week: TikTok in VR, controller issues, and new smart glasses",https://t.co/8zdIriqxDj,1,3,35,12K,,,
https://twitter.com/androidcentral,@androidcentral,https://twitter.com/androidcentral/status/1720819700748157429,Nov 4,"Google's Pixel camera AI isn't ""destroying humanity"" or creating any sort of apocalypse",https://t.co/DPxRil8Uq2,4,8,92,13K,https://t.co/DPxRil8Uq2,Google's Pixel camera AI isn't 'destroying humanity' or creating any sort of apocalypse,"Saying it is a good way to get you to click, though."
https://twitter.com/androidcentral,@androidcentral,https://twitter.com/androidcentral/status/1720774147322597814,Nov 4,I tested the Pixel Watch 2 and Fitbit Charge 6 at Disneyland — the results were surprising,https://t.co/9zV24im4Jh,3,51,,11K,,,
https://twitter.com/androidcentral,@androidcentral,https://twitter.com/androidcentral/status/1720567810969960691,Nov 4,The Moto G Power 5G (2024) looks fresh in these leaked renders,https://t.co/HBZq4d4mEC,3,32,,9.7K,,,
https://twitter.com/androidcentral,@androidcentral,https://twitter.com/androidcentral/status/1720556982107594971,Nov 4,A Google Password Manager redesign is on the way with a navigational bar,https://t.co/Ur6rI8BxZg,1,8,85,12K,,,
https://twitter.com/androidcentral,@androidcentral,https://twitter.com/androidcentral/status/1720519467149488366,Nov 4,The Galaxy Z Fold 6 could make S Pen cases a thing of the past,https://t.co/2yBpHbw8Yb,2,1,44,9.6K,,,
https://twitter.com/androidcentral,@androidcentral,https://twitter.com/androidcentral/status/1720509927586660652,Nov 4,The Galaxy S24 is rumored to be a New Year's present with a January launch,https://t.co/E8K6bqvaj0,1,4,41,9.2K,,,
https://twitter.com/androidcentral,@androidcentral,https://twitter.com/androidcentral/status/1720457032526913827,Nov 3,"The Pixel 8 phones are apparently having trouble connecting to the internet, and their batteries drain quickly when using mobile data instead of Wi-Fi",https://t.co/d6wMudORrI,16,3,49,19K,,,
https://twitter.com/androidcentral,@androidcentral,https://twitter.com/androidcentral/status/1720358907611075021,Nov 3,Apple made the wrong decision with not bringing the Apple Watch to Android,https://t.co/R9QPAaOm8k,11,3,53,15K,,,
https://twitter.com/androidcentral,@androidcentral,https://twitter.com/androidcentral/status/1720232334908104956,Nov 3,A new Chromebook tablet could finally be around the corner,https://t.co/wbwzEdezob,3,5,46,10K,,,
https://twitter.com/androidcentral,@androidcentral,https://twitter.com/androidcentral/status/1720193072149983437,Nov 3,"Motorola Razr Plus update brings welcome UI tweaks, Moto Unplugged app",https://t.co/B4t6vucFFP,2,25,,8K,,,
https://twitter.com/androidcentral,@androidcentral,https://twitter.com/androidcentral/status/1720158103147061574,Nov 3,"Apple almost made an Android-compatible Apple Watch, says report",https://t.co/FDZzEVqJuT,2,27,,8.8K,,,
https://twitter.com/androidcentral,@androidcentral,https://twitter.com/androidcentral/status/1720151808507572682,Nov 3,Gboard may soon gain a little Google Lens magic to grab text from images,https://t.co/smS16smn3v,4,4,74,10K,,,
https://twitter.com/androidcentral,@androidcentral,https://twitter.com/androidcentral/status/1720145052171743424,Nov 2,Why are chores more fun in VR?,https://t.co/lpZJqzAdRg,2,22,,7.4K,,,
https://twitter.com/androidcentral,@androidcentral,https://twitter.com/androidcentral/status/1720006529519059400,Nov 2,"The Samsung Galaxy S24 is coming early next year, and we have a good idea of what the Ultra model will look like thanks to these concept images",https://t.co/VGRiAxPtF3,4,6,51,12K,,,
https://twitter.com/androidcentral,@androidcentral,https://twitter.com/androidcentral/status/1719975153021440042,Nov 2,Ghostbusters: Rise of the Ghost Lord is light on lore but stuffed with fun,https://t.co/app5AKBUXB,1,3,16,8.2K,,,
https://twitter.com/androidcentral,@androidcentral,https://twitter.com/androidcentral/status/1719900897768071436,Nov 2,The Garmin Venu 3's best insights are making their way to your favorite Forerunners,https://t.co/R8SsP7tCUv,1,20,,8K,,,
https://twitter.com/androidcentral,@androidcentral,https://twitter.com/androidcentral/status/1719893859663052811,Nov 2,"Google settles with Match Group, but Epic still intends to go to trial",https://t.co/7NMtsN9a8f,2,19,,8K,,,
https://twitter.com/androidcentral,@androidcentral,https://twitter.com/androidcentral/status/1719839246284952045,Nov 2,A new supercharged Qualcomm chipset could help Samsung beat Apple Vision Pro,https://t.co/9OEiYckLsU,2,30,,8K,https://t.co/9OEiYckLsU,A new supercharged Qualcomm chipset could help Samsung beat Apple Vision Pro,"The XR wars are heating up. Hopefully, not literally."
https://twitter.com/androidcentral,@androidcentral,https://twitter.com/androidcentral/status/1719834716847706264,Nov 2,Qualcomm says Snapdragon 8 Gen 3 may have the 'majority share' with the Galaxy S24,https://t.co/89EqvXxK1S,4,36,,8.2K,,,
https://twitter.com/androidcentral,@androidcentral,https://twitter.com/androidcentral/status/1719807780347916330,Nov 2,The OnePlus 12 taps Sony for its new camera sensor,https://t.co/dPWvtRbIuQ,2,33,,9.1K,,,
https://twitter.com/androidcentral,@androidcentral,https://twitter.com/androidcentral/status/1719799738868875673,Nov 2,The Pixel Watch 2 is having charging problems for some owners,https://t.co/i0wV5cjYK9,1,16,,7.3K,,,
https://twitter.com/androidcentral,@androidcentral,https://twitter.com/androidcentral/status/1719796978211570167,Nov 2,Google Search gets advanced features to help you solve math and science problems,https://t.co/ws3GJ0wboT,4,28,,7.3K,,,
https://twitter.com/androidcentral,@androidcentral,https://twitter.com/androidcentral/status/1719785137141899311,Nov 2,Visible brings eSIM free trial to Android devices,https://t.co/7cA2CXuJhM,1,15,,6.9K,,,
https://twitter.com/androidcentral,@androidcentral,https://twitter.com/androidcentral/status/1719772569740390510,Nov 1,Google Pixel 8 Pro review: King of the Androids,https://t.co/suINKd4T1l,5,8,75,11K,,,
https://twitter.com/androidcentral,@androidcentral,https://twitter.com/androidcentral/status/1719763998055243784,Nov 1,Google Pixel Watch 2 review: The Apple Watch for Android,https://t.co/uwmZg5Qxir,5,40,,7.4K,,,
https://twitter.com/androidcentral,@androidcentral,https://twitter.com/androidcentral/status/1719748904026091979,Nov 1,ASUS ROG Phone 8 promo teases Snapdragon 8 Gen 3 in early leak,https://t.co/Lgr47CPKz7,2,32,,7K,,,
https://twitter.com/androidcentral,@androidcentral,https://twitter.com/androidcentral/status/1719733822260916447,Nov 1,Qualcomm's XPAN tech is the best new audio feature you'll probably never get to use,https://t.co/ZT3AH45qV1,1,2,27,7.9K,,,
https://twitter.com/androidcentral,@androidcentral,https://twitter.com/androidcentral/status/1719702252904931425,Nov 1,"Google will soon start testing its Duet AI side panel, and it's updating its privacy policy to make sure your data is safe",https://t.co/YUUP9IwgEU,3,22,,6.3K,,,
https://twitter.com/androidcentral,@androidcentral,https://twitter.com/androidcentral/status/1719666057407864962,Nov 1,Pixel's Car crash detection is now available in these five additional territories,https://t.co/ZKr7hU9a5U,3,40,,7.9K,,,
https://twitter.com/androidcentral,@androidcentral,https://twitter.com/androidcentral/status/1719521647978274949,Nov 1,Apple and Samsung lost market share to a phone brand you've never heard of,https://t.co/e2JHYCNsFG,3,9,57,15K,,,
https://twitter.com/androidcentral,@androidcentral,https://twitter.com/androidcentral/status/1719471076399300973,Nov 1,YouTube ramps up efforts to block you from blocking ads,https://t.co/zN2pV3U9Dh,11,11,55,15K,,,
https://twitter.com/androidcentral,@androidcentral,https://twitter.com/androidcentral/status/1719449192253256055,Nov 1,"Chrome finally lets you move the address bar to the bottom, but not on Android",https://t.co/7yfWEJt4RE,6,8,78,11K,,,
https://twitter.com/androidcentral,@androidcentral,https://twitter.com/androidcentral/status/1719441120214565047,Nov 1,Snapdragon 8 Gen 3's benchmark results show its dominance over Apple's A17 Pro,https://t.co/sJtcJEXK51,1,5,57,10K,,,
https://twitter.com/androidcentral,@androidcentral,https://twitter.com/androidcentral/status/1719435340467798470,Nov 1,Samsung details new Auto Blocker security on One UI 6,https://t.co/mu42aCZmo8,5,34,,7.6K,,,
https://twitter.com/androidcentral,@androidcentral,https://twitter.com/androidcentral/status/1719430311929405508,Nov 1,"Fitbit Charge 6 review: Familiar hardware, Googleified",https://t.co/h2WAIDeDD2,1,2,26,7.2K,,,
https://twitter.com/androidcentral,@androidcentral,https://twitter.com/androidcentral/status/1719422005907214462,Nov 1,Google is working on a fix for the Pixel 8 Pro's weird Always On Display tint,https://t.co/PBCyeOvogj,3,44,,7.9K,,,
https://twitter.com/androidcentral,@androidcentral,https://twitter.com/androidcentral/status/1719400110264582655,Oct 31,Halloween is the perfect time to play these spooky Meta Quest games,https://t.co/NtgDv5YDVX,13,,,6.2K,,,
https://twitter.com/shruti_shekar,@shruti_shekar,https://twitter.com/shruti_shekar/status/1719319297044959244,Oct 31,"Morning yall,",https://twitter.com/shruti_shekar,3,10,reposted,7.6K,https://t.co/ECLHzIYRRQ,"News Editor, Android Central - Future Publishing","Led by a passionate team and backed by technology enthusiasts and tastemakers, Android Central provides honest opinions, trustworthy advice and recommendations consumers can count on.This is an..."
https://twitter.com/androidcentral,@androidcentral,https://twitter.com/androidcentral/status/1719164048640516355,Oct 31,Google has turned off-the-shelf ANC earbuds into heart rate monitors,https://t.co/SqblnLHLhW,3,27,,9.1K,,,
https://twitter.com/androidcentral,@androidcentral,https://twitter.com/androidcentral/status/1719151458484883476,Oct 31,Meta introduces ad-free plans for Facebook and Instagram users in Europe,https://t.co/xwme3QMrT7,1,2,24,7.9K,,,
