UserId_Url,UserId,Tweet_Url,,Tweets,,Comments,Retweets,Likes,Impressions,,,
https://twitter.com/androidcentral,@androidcentral,https://twitter.com/androidcentral/status/1699167674356449289,Sep 6,Google could learn a thing or two from Samsung when it comes to foldable software,https://t.co/0uGJXcf2zF,1,21,,6.3K,,,
https://twitter.com/androidcentral,@androidcentral,https://twitter.com/androidcentral/status/1699162340317405619,Sep 6,"Walking 5 miles a day for 31 days had an immediate, positive impact on our writer's health",https://t.co/Q7bCHzXFgI,1,4,35,8.6K,,,
https://twitter.com/androidcentral,@androidcentral,https://twitter.com/androidcentral/status/1699156209218072687,Sep 6,"A report claims Apple is looking to take on Chromebooks with a cheap MacBook, but Google probably doesn't have anything to worry about",https://t.co/sUWlOAup79,3,2,16,6.7K,https://t.co/sUWlOAup79,Don't count on Apple releasing a cheap MacBook to really challenge Chromebooks,Crazier things have happened.
https://twitter.com/androidcentral,@androidcentral,https://twitter.com/androidcentral/status/1699149667030761566,Sep 6,Waze launches its new Alien driving experience to help lead you back home,https://t.co/iYwqhWswob,2,2,11,5.9K,https://t.co/iYwqhWswob,"Aliens might be here, and a new Waze update puts them in your car",They come in peace.
https://twitter.com/androidcentral,@androidcentral,https://twitter.com/androidcentral/status/1699144132147454146,Sep 6,Individual Workspace subscribers utilizing Google Meet will receive additional features and updates this week,https://t.co/wb18p1ep2M,2,2,16,7K,https://t.co/wb18p1ep2M,Google Meet adds new features for individual Workspace users,"Larger meetings, records, and more."
https://twitter.com/androidcentral,@androidcentral,https://twitter.com/androidcentral/status/1699138591908077820,Sep 6,Dozens of Garmin watches just got smarter and more judgy thanks to a massive update,https://t.co/iIqyc7TsKy,1,16,,6.1K,,,
https://twitter.com/androidcentral,@androidcentral,https://twitter.com/androidcentral/status/1699122743147417994,Sep 5,"A new leak shows off what could be the next ""affordable"" flip-style foldable",https://t.co/IYRWVJEHFJ,1,2,15,6K,https://t.co/IYRWVJEHFJ,Tecno Phantom V Flip gets leaked again thanks to early case listing,Previous renders have shown the same rear design.
https://twitter.com/androidcentral,@androidcentral,https://twitter.com/androidcentral/status/1699122743126409464,Sep 5,Your favorite bugdroid has a new 3D look as Google updates the Android logo,https://t.co/O7SyCBPPDR,1,1,38,7.1K,https://t.co/O7SyCBPPDR,Google gives the Android brand some TLC with a visual makeover and updated logo,Say hello to the familiar bugdroid in 3D.
https://twitter.com/androidcentral,@androidcentral,https://twitter.com/androidcentral/status/1699118216834904568,Sep 5,More flagship-level smartphones from Xiaomi may arrive soon,https://t.co/CBGoHxdKHC,1,2,19,5.7K,https://t.co/CBGoHxdKHC,Xiaomi 13T and 13T Pro tipped to launch at the end of September,The launch event is likely to be held in Berlin.
https://twitter.com/androidcentral,@androidcentral,https://twitter.com/androidcentral/status/1699108407872029110,Sep 5,Your favorite bugdroid has a new 3D look as Google updates the Android logo,https://t.co/ASxZFj2anH,3,7,64,9.9K,https://t.co/ASxZFj2anH,Google gives the Android brand some TLC with a visual makeover and updated logo,Say hello to the familiar bugdroid in 3D.
https://twitter.com/androidcentral,@androidcentral,https://twitter.com/androidcentral/status/1699106899944222860,Sep 5,"The Assistant At a Glance widget is getting a Material You makeover, and it's rolling out to all Android phones as part of the latest feature drop",https://t.co/QLiySiZkgv,1,3,27,6.8K,,,
https://twitter.com/androidcentral,@androidcentral,https://twitter.com/androidcentral/status/1699096818439663787,Sep 5,"They said it was canceled, but the latest rumors suggest Meta is ready to take on Apple's Vision Pro with a new ultra-premium headset",https://t.co/n1O2mxUQCQ,1,15,,5.5K,https://t.co/n1O2mxUQCQ,Meta’s next Apple Vision Pro rival is reportedly in the works,"Some thought it to be canceled, but rumors say otherwise."
https://twitter.com/androidcentral,@androidcentral,https://twitter.com/androidcentral/status/1699086687261819303,Sep 5,Can you Netflix and chill with the Boox Tab Ultra? Probably not. But here's why you might not even miss it.,https://t.co/shifvZEulM,1,1,13,5.6K,https://t.co/shifvZEulM,"Onyx Boox Tab Ultra review: Replacing my physical notebooks, one day at a time",This tablet is so much better than I ever expected.
https://twitter.com/androidcentral,@androidcentral,https://twitter.com/androidcentral/status/1699081648334159876,Sep 5,"The Galaxy Watch 4 series is finally getting a One UI 5 Watch glow-up, at least in the US",https://t.co/lPpXpoETva,1,3,32,8.4K,,,
https://twitter.com/androidcentral,@androidcentral,https://twitter.com/androidcentral/status/1698984395128856764,Sep 5,"WhatsApp could be getting a fresh new look, with a white top bar and green accents",https://t.co/gvghBqx832,2,4,57,12K,https://t.co/gvghBqx832,WhatsApp may soon give its interface a fresh coat of paint,"Apparently, you'll also be able to filter your chats by unread, personal, or business."
https://twitter.com/androidcentral,@androidcentral,https://twitter.com/androidcentral/status/1698972165616595436,Sep 5,"UGREEN's latest charging station goes up to an insane 300W, and is now available globally. Here's everything you need to know about it:",https://t.co/BN6AKdwPOE,1,1,20,7.3K,https://t.co/BN6AKdwPOE,UGREEN Nexode 300W review: The only desktop charging station you'll ever need,The Nexode 300W works over the latest USB PD 3.1 protocol and hits 140W on a single USB-C port.
https://twitter.com/androidcentral,@androidcentral,https://twitter.com/androidcentral/status/1698840551347425661,Sep 5,Here are some helpful back-to-school tips on protecting your privacy,https://t.co/hpghVrqJGa,2,2,21,8.5K,https://t.co/hpghVrqJGa,Protect your privacy as you head back to school,You're in charge and the world can be ugly.
https://twitter.com/androidcentral,@androidcentral,https://twitter.com/androidcentral/status/1698834334235373569,Sep 5,The latest leak may give us a good idea of the expected pricing for Samsung's upcoming Fan Edition devices,https://t.co/sozS8wv9Nl,1,23,,8.4K,https://t.co/sozS8wv9Nl,Galaxy Tab S9 Fan Edition pricing tipped ahead of the release,The prices of the devices were allegedly obtained from a European retailer database.
https://twitter.com/androidcentral,@androidcentral,https://twitter.com/androidcentral/status/1698828544317575397,Sep 5,The OnePlus Open may be built to last for years to come,https://t.co/HRvxtAieT0,1,3,32,10K,,,
https://twitter.com/androidcentral,@androidcentral,https://twitter.com/androidcentral/status/1698820251239018569,Sep 5,Google could launch new Buds Pro colors to match the Pixel 8,https://t.co/2wWGOQRgFI,1,37,,9.1K,https://t.co/2wWGOQRgFI,New Pixel Buds Pro colors could arrive with the Pixel 8 series,"If true, they would complement the Pixel 8 Pro's rumored options."
https://twitter.com/androidcentral,@androidcentral,https://twitter.com/androidcentral/status/1698764122760835389,Sep 4,Galaxy Z Flip 5 teardown video shows off the new hinge and more,https://t.co/HmN4ddl0ja,1,31,,8.7K,https://t.co/HmN4ddl0ja,Check out this Galaxy Z Flip 5 teardown to see what makes the foldable tick,Pull tabs bring about an easier recycling process.
https://twitter.com/androidcentral,@androidcentral,https://twitter.com/androidcentral/status/1698762185936109844,Sep 4,"Get ready to shell out a little more than you might have thought for the Pixel 8, if this rumor doesn't lie",https://t.co/dXLOyrktRV,2,3,47,11K,,,
https://twitter.com/androidcentral,@androidcentral,https://twitter.com/androidcentral/status/1698579922220888248,Sep 4,"The Pixel Fold is a great piece of hardware, but",https://t.co/ag4zrCY4MJ,1,4,30,9.8K,,,
https://twitter.com/androidcentral,@androidcentral,https://twitter.com/androidcentral/status/1698351649817825517,Sep 3,"Do you actually need to walk 10,000 steps a day? Our Fitness Editor hit that goal every day in August to see if it's worth the fuss",https://t.co/ZFtLSiRe1C,4,7,38,13K,,,
https://twitter.com/androidcentral,@androidcentral,https://twitter.com/androidcentral/status/1698306600534950221,Sep 3,"Sony just dropped a new compact phone, the Xperia 5 V, and it's got some surprisingly powerful specs and features for its size",https://t.co/f8myU0wdKF,1,7,58,13K,https://t.co/f8myU0wdKF,The Sony Xperia 5 V packs the same flagship sensor as the Xperia 1 V,Sony's latest Xperia 5 model doubles down on content creation despite having one fewer lens than its predecessor.
https://twitter.com/androidcentral,@androidcentral,https://twitter.com/androidcentral/status/1697989014853189921,Sep 2,"A new school year is upon us, so here are some tips on how you can protect your personal information",https://t.co/thojvjgIEh,1,17,,9.7K,https://t.co/thojvjgIEh,Protect your privacy as you head back to school,You're in charge and the world can be ugly.
https://twitter.com/androidcentral,@androidcentral,https://twitter.com/androidcentral/status/1697698357567725891,Sep 2,Samsung may outfit the S24 Ultra with an optimized version of its 200MP camera found in the Galaxy S23 Ultra,https://t.co/1fgkVnniNk,3,3,33,12K,https://t.co/1fgkVnniNk,Galaxy S24 Ultra tipped to feature an even better 200MP camera,Additional optimizations to the sensor could bring better photos.
https://twitter.com/androidcentral,@androidcentral,https://twitter.com/androidcentral/status/1697692836597039207,Sep 2,Huawei may have gotten back into the 5G game with the Mate 60 and Mate 60 Pro,https://t.co/DT1UsURS1o,1,5,29,11K,,,
https://twitter.com/androidcentral,@androidcentral,https://twitter.com/androidcentral/status/1697687536745738422,Sep 2,This week was light on Quest 3 leaks but heavy on promises delivered by Meta. Check out the new features coming to your Quest headset soon,https://t.co/XzktM6wVFK,1,2,17,11K,https://t.co/XzktM6wVFK,"VR news of the week: Vampires, mice with swords, and virtual keyboards","VR weekly news recap September 1, 2023: New games and Meta finally delivering on its promises."
https://twitter.com/androidcentral,@androidcentral,https://twitter.com/androidcentral/status/1697671681018315249,Sep 1,Google may have even more camera tricks up its sleeve for the Pixel 8 Pro,https://t.co/ZrHGwnz0Dd,1,5,53,10K,https://t.co/ZrHGwnz0Dd,The Pixel 8 Pro may extend Night Sight to video recording,"In addition, despite what reports claimed, the physical SIM will probably remain."
https://twitter.com/androidcentral,@androidcentral,https://twitter.com/androidcentral/status/1697581951505314105,Sep 1,Samsung's software expertise on foldable phones really gives it a leg up on the rest of the competition.,https://t.co/unfS2E9Bjo,1,3,25,9.5K,,,
https://twitter.com/androidcentral,@androidcentral,https://twitter.com/androidcentral/status/1697546754672218458,Sep 1,Honor just showed off a foldable that's designed to be carried as a purse,https://t.co/LsryUnNOrn,3,3,26,10K,https://t.co/LsryUnNOrn,Honor just showed off a foldable that you carry as a purse,"Meet the Honor V Purse, a foldable that's more a fashion statement than a tech product."
https://twitter.com/androidcentral,@androidcentral,https://twitter.com/androidcentral/status/1697544562649215343,Sep 1,Honor's Magic V2 goes global to take on the Galaxy Z Fold 5,https://t.co/OeCQkgsKxu,3,19,,9.8K,https://t.co/OeCQkgsKxu,"Honor's Magic V2 is the thinnest foldable yet, and it's now available globally","Honor's latest foldable is thinner, lighter, and has a larger battery than the Galaxy Z Fold 5."
https://twitter.com/androidcentral,@androidcentral,https://twitter.com/androidcentral/status/1697398630590628016,Sep 1,Chrome users are complaining after the latest update got rid of a feature,https://t.co/KNN7oclY1B,1,2,19,8.9K,,,
https://twitter.com/androidcentral,@androidcentral,https://twitter.com/androidcentral/status/1697393349928374316,Sep 1,You can now comment on your favorite songs with YouTube Music's updated Now Playing UI,https://t.co/u7umGlYNRl,2,3,20,9.8K,https://t.co/u7umGlYNRl,YouTube Music update adds a comment section to the Now Playing screen,Drop a comment on your favorite song.
https://twitter.com/androidcentral,@androidcentral,https://twitter.com/androidcentral/status/1697366658124300330,Sep 1,The Chrome Web Store shows off a new look,https://t.co/yUi8Iy3oO9,1,25,,8.3K,https://t.co/yUi8Iy3oO9,An early Google Chrome Web Store preview shows a 'modern' redesign,"A cleaner design, bringing it closer to others in Google's ecosystem."
https://twitter.com/androidcentral,@androidcentral,https://twitter.com/androidcentral/status/1697355349404115202,Sep 1,A new One UI 6 beta brings additional features,https://t.co/f3hSAXHGTU,1,4,40,11K,,,
https://twitter.com/androidcentral,@androidcentral,https://twitter.com/androidcentral/status/1697321666592870668,Sep 1,"We can argue about light mode vs dark mode all day, but one is the clear loser on most modern smartphones for a surprising reason",https://t.co/qRG3y1g4IK,1,4,16,9.5K,https://t.co/qRG3y1g4IK,Dark mode is a lie,"It's supposedly better for your eyes, but that's not always true."
https://twitter.com/androidcentral,@androidcentral,https://twitter.com/androidcentral/status/1697314578277827004,Aug 31,Sit back and enjoy many of your favorite Steam games on your Chromebook with three months of GeForce Now for free,https://t.co/oqNTMFhdPh,1,8,,7.6K,https://t.co/oqNTMFhdPh,Play Baldur's Gate 3 for free on your Chromebook thanks to Google and NVIDIA,Enjoy all of your favorite PC games for free with this latest promotion.
https://twitter.com/androidcentral,@androidcentral,https://twitter.com/androidcentral/status/1697309306268356822,Aug 31,"Google Play is gifting users with a seven-day points for 8x more points and the opportunity to use points on Walmart Plus, Instacart, and Discord offers",https://t.co/wwEoEMF8HR,2,3,18,8.2K,https://t.co/wwEoEMF8HR,Google Play Live brings a wealth of in-game items and rewards with Play Points,Platinum point members will gain some new goodies soon.
https://twitter.com/androidcentral,@androidcentral,https://twitter.com/androidcentral/status/1697301247601016837,Aug 31,Samsung is finally bringing Wear OS 4 to its older smartwatches,https://t.co/jsbffWrZ0k,1,5,33,10K,,,
https://twitter.com/androidcentral,@androidcentral,https://twitter.com/androidcentral/status/1697297711702180108,Aug 31,OxygenOS 14 will soon be upon us,https://t.co/1sPLMSoR6P,2,3,28,11K,,,
https://twitter.com/androidcentral,@androidcentral,https://twitter.com/androidcentral/status/1697294456381145428,Aug 31,"As we approach Halloween, all manner of scary creatures are on everyone's minds.",https://t.co/928an5MFDU,1,1,11,6K,https://t.co/928an5MFDU,I sunk my teeth into the new Vampire: The Masquerade VR game,Solid Snake has nothing on this vampire stealth action game for Oculus Quest.
https://twitter.com/androidcentral,@androidcentral,https://twitter.com/androidcentral/status/1697289055103496680,Aug 31,"XGIMI has a new 4K laser projector in the Horizon Ultra, and it is fabulous",https://t.co/eEiYYcn8LV,1,1,18,7.2K,,,
https://twitter.com/androidcentral,@androidcentral,https://twitter.com/androidcentral/status/1697286895569445263,Aug 31,The latest Withings hybrid smartwatch gives the Fitbit Sense 2 a run for its money with not one but two skin temperature sensors,https://t.co/f1lr0X1Ntf,1,1,14,7.6K,https://t.co/f1lr0X1Ntf,The Withings ScanWatch 2 may be the most advanced health-tracking watch we've seen,"The new ScanWatch 2 has dual temperature sensors, FDA-approved SpO2 and AFib detection, and a 30-day battery life."
https://twitter.com/androidcentral,@androidcentral,https://twitter.com/androidcentral/status/1697245371360280849,Aug 31,"Jabra's Elite earbuds are getting a refresh, with new models to fit everyone's needs",https://t.co/1OM8GxiSI0,1,16,,8.7K,,,
https://twitter.com/androidcentral,@androidcentral,https://twitter.com/androidcentral/status/1697239073822331097,Aug 31,"Jabra takes it up a notch with the new Elite 10 wireless earbuds, which sound as good as they look",https://t.co/iotwJfr8bt,1,2,31,10K,,,
https://twitter.com/androidcentral,@androidcentral,https://twitter.com/androidcentral/status/1697236573366935604,Aug 31,The Jabra Elite 8 Active are a worthy follow-up to the company's best workout earbuds,https://t.co/N6OgTS7XSU,16,,,7.9K,,,
https://twitter.com/androidcentral,@androidcentral,https://twitter.com/androidcentral/status/1697166101069680907,Aug 31,"Even though it was a boring hardware update, you'll feel right at home if you've used a Galaxy Z Fold in the past.",https://t.co/IdkMnn1FyN,17,,,7.8K,,,
https://twitter.com/androidcentral,@androidcentral,https://twitter.com/androidcentral/status/1697135870346661990,Aug 31,"European fans of Samsung's Galaxy S series may be in for a bit of a letdown, as the upcoming S24 could be powered by an Exynos processor",https://t.co/OlnxSOsKvQ,3,32,,12K,,,
https://twitter.com/androidcentral,@androidcentral,https://twitter.com/androidcentral/status/1697130365540807102,Aug 31,The Pixel 8 series stops by the FCC with just over a month to go before the launch,https://t.co/dKw6Yv5tJC,3,35,,9.8K,https://t.co/dKw6Yv5tJC,Pixel 8 models arrive at FCC as Google sets a date for the launch event,"The Pixel 8 Pro supports UWB connectivity, whereas the Pixel 8 will likely omit it."
https://twitter.com/androidcentral,@androidcentral,https://twitter.com/androidcentral/status/1697114008027865574,Aug 31,"The new Fairphone 5 is much more modern, modular, and will last for a long time",https://t.co/VvzEqsfxXE,1,2,49,13K,https://t.co/VvzEqsfxXE,The Fairphone 5 goes official with a promise of software updates to 2031,The modern-looking Fairphone 5 is also backed by a five-year warranty.
https://twitter.com/androidcentral,@androidcentral,https://twitter.com/androidcentral/status/1697045292326199307,Aug 31,The doors are opening on Google's generative AI Search experiment for users in Japan and India,https://t.co/oIMUlseltZ,17,,,9.8K,https://t.co/oIMUlseltZ,Google brings Search Labs to Japan and India with multilingual support,Its AI overview will look to become a little more trustworthy starting today.
https://twitter.com/androidcentral,@androidcentral,https://twitter.com/androidcentral/status/1697005545230598422,Aug 31,It might not be long before Google's rumored Chromebook Plus branding makes its way to the first devices,https://t.co/2m2U1H817o,1,2,28,11K,,,
https://twitter.com/androidcentral,@androidcentral,https://twitter.com/androidcentral/status/1696978865107689942,Aug 31,"Garmin just launched the Venu 3, a lifestyle watch with 14-day battery life, a 1.4-inch AMOLED display, mic & speaker, and some dormant health sensors",https://t.co/53JpyOObnT,1,24,,8.6K,https://t.co/53JpyOObnT,"The Garmin Venu 3 adds Sleep Coaching, but some features are still hibernating","The new Elevate v5 sensor is allegedly capable of ECG and skin temperature readings, but you can't use them yet."
https://twitter.com/androidcentral,@androidcentral,https://twitter.com/androidcentral/status/1696959733427519881,Aug 31,Samsung Food uses AI to help you take control of your diet,https://t.co/rrz0OslAGX,16,,,8.9K,,,
https://twitter.com/androidcentral,@androidcentral,https://twitter.com/androidcentral/status/1696954717522334008,Aug 31,"As long as you have the budget, this USB-C hub from Dockcase is much more than a way to connect everything to your computer",https://t.co/65ezlZAxdq,1,1,26,9.6K,,,
https://twitter.com/androidcentral,@androidcentral,https://twitter.com/androidcentral/status/1696943878828409027,Aug 30,"Google sets a date for the Pixel 8 launch event, which will take place in early October",https://t.co/z9oxcEtIaa,1,8,58,11K,https://t.co/z9oxcEtIaa,Google announces Pixel 8 launch event set for October,We may also get the Pixel Watch 2.
https://twitter.com/androidcentral,@androidcentral,https://twitter.com/androidcentral/status/1696927036307128754,Aug 30,Google accidentally leaked its upcoming Pixel 8 Pro,https://t.co/p6vSzApQKF,8,6,63,13K,https://t.co/p6vSzApQKF,The Pixel 8 Pro was already spotted on the Google Store,"Until now, the colorways were only spotted in leaks and renders."
https://twitter.com/androidcentral,@androidcentral,https://twitter.com/androidcentral/status/1696895593753334217,Aug 30,"If you're looking to run your way into shape, the COROS PACE 3 is a great starting point that won't break the bank",https://t.co/08eNDK2rPY,1,1,12,8.9K,https://t.co/08eNDK2rPY,"COROS PACE 3 review: The best affordable running watch of the year, bar none","You don't need to overspend to get a fantastic, lightweight running watch. Only a frustrating watch band situation keeps this from a perfect score."
https://twitter.com/androidcentral,@androidcentral,https://twitter.com/androidcentral/status/1696857059046662406,Aug 30,"It's been said that dark mode on phones makes for a more comfortable viewing experience, but is it actually better for your eyes? Not necessarily says",https://t.co/oCCkQC4tcz,3,2,24,11K,,,
https://twitter.com/androidcentral,@androidcentral,https://twitter.com/androidcentral/status/1696795951569183020,Aug 30,"With the Keyboard 81 Pro, OnePlus took one of the best custom mechanical keyboards and elevated the design. The result? Perfection.",https://t.co/s4Jpt7Ke7E,20,,,7.9K,,,
https://twitter.com/androidcentral,@androidcentral,https://twitter.com/androidcentral/status/1696760171974770846,Aug 30,Google Chat gets a revamp and borrows some features from Slack and other enterprise apps,https://t.co/i6FeMQaCsk,13,,,9K,,,
https://twitter.com/androidcentral,@androidcentral,https://twitter.com/androidcentral/status/1696755897236652424,Aug 30,The first half of 2023 was dominated by Samsung and Apple,https://t.co/caAOA8sEbL,1,4,41,12K,,,
https://twitter.com/androidcentral,@androidcentral,https://twitter.com/androidcentral/status/1696667318921896228,Aug 30,"Google Meet’s Duet AI is the meeting assistant that’s always got your back, even when you’re not there",https://t.co/fVp0deiK0Z,1,2,23,13K,,,
https://twitter.com/androidcentral,@androidcentral,https://twitter.com/androidcentral/status/1696646168241967367,Aug 30,Samsung may launch its next wave of Fan Edition devices before the end of the year,https://t.co/2AWv6wUL4L,3,36,,10K,,,
https://twitter.com/androidcentral,@androidcentral,https://twitter.com/androidcentral/status/1696639382768300269,Aug 30,"Google could start offering longer update support for its phones, starting with the Pixel 8",https://t.co/WXaL7RG8ox,4,12,68,20K,,,
https://twitter.com/androidcentral,@androidcentral,https://twitter.com/androidcentral/status/1696623015503560963,Aug 30,The Galaxy Z Flip 5 is one tough phone,https://t.co/dIQzBDJRNm,1,15,,8.4K,https://t.co/dIQzBDJRNm,The Galaxy Z Flip 5 powers through a tough durability test,The latest foldables from Samsung proved to be sturdy with the recent new durability tests from Zack Nelson.
https://twitter.com/androidcentral,@androidcentral,https://twitter.com/androidcentral/status/1696619254332715190,Aug 30,The Google Graveyard just claimed another soul as Pixel Pass is being discontinued,https://t.co/4qBOj2xljb,3,36,,11K,https://t.co/4qBOj2xljb,Google just killed Pixel Pass and I'm really not surprised,Another one bites the dust.
https://twitter.com/androidcentral,@androidcentral,https://twitter.com/androidcentral/status/1696610440644608393,Aug 30,Duet AI for Workspace can summarize lengthy documents and even create a presentation for you,https://t.co/WdjvB2Ujl1,1,3,28,10K,https://t.co/WdjvB2Ujl1,"Google's Duet AI does it all in Docs, Slides, and more for Workspace users",Summarize and create with a command.
https://twitter.com/androidcentral,@androidcentral,https://twitter.com/androidcentral/status/1696591569460072810,Aug 30,Samsung updates the Galaxy Buds 2 Pro with enhanced Auracast capabilities,https://t.co/WXlgpUyD5f,1,1,27,8.2K,https://t.co/WXlgpUyD5f,Galaxy Buds 2 Pro update lets you connect multiple earbuds to a Samsung TV,"With LE audio as its core, Auracast could help users hear better."
https://twitter.com/androidcentral,@androidcentral,https://twitter.com/androidcentral/status/1696575965525110787,Aug 29,Your Locked Folder can now be backed up and synced across devices,https://t.co/lPkVYbQs1d,5,32,,8.4K,,,
https://twitter.com/androidcentral,@androidcentral,https://twitter.com/androidcentral/status/1696556587563794566,Aug 29,"It's been 84 years, but Quest avatars no longer float. They walk.",https://t.co/qjnMas1ENz,1,17,,7.2K,https://t.co/qjnMas1ENz,Oculus Quest avatars actually have legs now,Just in time for Connect 2023 and the Quest 3.
https://twitter.com/androidcentral,@androidcentral,https://twitter.com/androidcentral/status/1696552550860742854,Aug 29,"It's been over two years since TCL first debuted its NXTPAPER technology, and now the company has unveiled its first smartphones using this unique type of display",https://t.co/iMuBDxvln1,1,15,,5.8K,https://t.co/iMuBDxvln1,TCL's first NXTPAPER phones to help reduce eye strain with paper-like displays,NXTPAPER displays are coming to smartphones.
https://twitter.com/androidcentral,@androidcentral,https://twitter.com/androidcentral/status/1696510538862190885,Aug 29,"The COROS PACE 3 is one of the best running watches we've ever tested, and it costs half as much as our favorite, the Garmin Forerunner 265",https://t.co/HGuEAYwjKi,2,2,20,12K,https://t.co/HGuEAYwjKi,"COROS PACE 3 review: The best affordable running watch of the year, bar none","You don't need to overspend to get a fantastic, lightweight running watch. Only a frustrating watch band situation keeps this from a perfect score."
