UserId_Url,UserId,Tweet_Url,,Tweets,,Comments,Retweets,Likes,Impressions,,,
https://twitter.com/androidcentral,@androidcentral,https://twitter.com/androidcentral/status/1707820049900200100,Sep 29,A Quest 2 trade-in offer would've been a great way to convert some of its 20 million owners to Quest 3 users (and prevented a ton of e-waste),https://t.co/FCph5L93V0,1,1,21,7K,https://t.co/FCph5L93V0,"Meta won't offer Quest 2 trade-ins for the Quest 3, a missed opportunity","We received confirmation that Meta has no plans for an upgrade or trade-in program ""at this time."""
https://twitter.com/androidcentral,@androidcentral,https://twitter.com/androidcentral/status/1707813764672663626,Sep 29,It looks like the Pixel Watch 2 may come with a welcome Fitbit upgrade,https://t.co/n7eLnVcOwJ,2,1,27,8.1K,https://t.co/n7eLnVcOwJ,Pixel Watch 2 leak teases big changes for Fitbit integration,"The watch could be involved in a pre-order bonus, too."
https://twitter.com/androidcentral,@androidcentral,https://twitter.com/androidcentral/status/1707806236287058150,Sep 29,You might have a hard time telling the Galaxy S23 Ultra and S24 Ultra apart,https://t.co/0LTKKZuXAc,1,6,39,8.6K,https://t.co/0LTKKZuXAc,Galaxy S24 Ultra leak reveals very subtle design changes,"Much of the same, which isn't a bad thing."
https://twitter.com/androidcentral,@androidcentral,https://twitter.com/androidcentral/status/1707709463065432086,Sep 29,"Twitter, now X, used to let you flag tweets that you thought were misleading, but it just got rid of that feature",https://t.co/ckB125V2RQ,7,11,44,7.2K,,,
https://twitter.com/androidcentral,@androidcentral,https://twitter.com/androidcentral/status/1707667799772934611,Sep 29,"Thanks to the hard work of some third-party developers, using Android with macOS is more seamless than ever",https://t.co/Q9UQJRkaEm,4,31,,8.3K,,,
https://twitter.com/androidcentral,@androidcentral,https://twitter.com/androidcentral/status/1707667799772905539,Sep 29,Galaxy Z Flip 5 and Fold 5 owners may not have to wait much longer for the One UI 6 beta,https://t.co/0EMPGduLiV,6,33,,7.6K,,,
https://twitter.com/androidcentral,@androidcentral,https://twitter.com/androidcentral/status/1707652202947318196,Sep 29,Samsung may not be looking to drastically overhaul the Galaxy S24 design,https://t.co/3LR9aRqNmv,1,5,45,9.3K,https://t.co/3LR9aRqNmv,"This could be our first look at the Galaxy S24, and it's all too familiar",Samsung may be playing it safe.
https://twitter.com/androidcentral,@androidcentral,https://twitter.com/androidcentral/status/1707503722664689733,Sep 29,The Quest 3 will have 100+ new or enhanced games by year's end. Here's what we know about them,https://t.co/m8d8nh6YOX,1,22,,6.6K,https://t.co/m8d8nh6YOX,"Quest 3 games: Exclusives, free, launch titles, Xbox games, and enhancements","Every new Quest 3 owner gets a highly anticipated game for free, while Xbox fans have reasons to get excited."
https://twitter.com/androidcentral,@androidcentral,https://twitter.com/androidcentral/status/1707498174812680645,Sep 29,"With all these leaks, the Galaxy S23 FE has to be around the corner",https://t.co/wp6tHrBTZ7,1,3,37,7.9K,https://t.co/wp6tHrBTZ7,Galaxy S23 FE gets shown off in leaked promo videos,How they could appear in reality could go either way.
https://twitter.com/androidcentral,@androidcentral,https://twitter.com/androidcentral/status/1707490375651201332,Sep 29,New flagship OnePlus Buds may be on the way,https://t.co/zsohPAVH8t,2,21,,6.4K,https://t.co/zsohPAVH8t,"OnePlus Buds 3 may look a lot like the Buds Pro 2, but with some changes",Are these small variations enough to spur interest?
https://twitter.com/androidcentral,@androidcentral,https://twitter.com/androidcentral/status/1707453132639211604,Sep 28,"The At a Glance widget is getting a new look, and it's rolling out more widely across Android phones",https://t.co/iFXOYjYBc3,3,6,76,10K,,,
https://twitter.com/androidcentral,@androidcentral,https://twitter.com/androidcentral/status/1707433503439114700,Sep 28,"If you're worried about comfort while gaming, the Quest 3 has you covered",https://t.co/Ctwu0ftypt,1,16,,5.7K,,,
https://twitter.com/androidcentral,@androidcentral,https://twitter.com/androidcentral/status/1707414897074593861,Sep 28,Fitbit's latest fitness tracker has more Google in it,https://t.co/yxzAPPHBSC,3,23,,6.6K,https://t.co/yxzAPPHBSC,The new Fitbit Charge 6 brings a physical button and improved health sensors for $159,Control your music and grab some snacks on the way home.
https://twitter.com/androidcentral,@androidcentral,https://twitter.com/androidcentral/status/1707411104530317564,Sep 28,"Assassin's Creed VR almost feels like you've stepped inside an Animus to relive the memories of an assassin, and it's amazing",https://t.co/aIbsFjvrRz,7,24,,8.4K,,,
https://twitter.com/androidcentral,@androidcentral,https://twitter.com/androidcentral/status/1707382410927604052,Sep 28,The Pixel is becoming increasingly popular in the United States,https://t.co/jMV5NXGNBl,6,10,132,14K,https://t.co/jMV5NXGNBl,The Pixel prevails while others fall,The smartphone industry is in a tough place right now.
https://twitter.com/androidcentral,@androidcentral,https://twitter.com/androidcentral/status/1707350711485276443,Sep 28,"Disney+ follows Netflix with its own password-sharing crackdown, and it starts in North America",https://t.co/fWSjRVbllI,4,5,21,10K,https://t.co/fWSjRVbllI,Disney's password-sharing crackdown is now a reality,The restriction will start in Canada on November 1.
https://twitter.com/androidcentral,@androidcentral,https://twitter.com/androidcentral/status/1707258610919813611,Sep 28,"We interacted with the head of OnePlus software to know more about the future of OxygenOS, and whether a return to a vanilla UI is on the cards:",https://t.co/hstIFNEAuz,8,41,,8K,https://t.co/hstIFNEAuz,I asked OnePlus about the future of OxygenOS — here's what they told me,"Gary Chen, the head of OnePlus software, shares what's in store for OxygenOS — synergy with ColorOS, foldables, and AI."
https://twitter.com/androidcentral,@androidcentral,https://twitter.com/androidcentral/status/1707138064995271164,Sep 28,"If you were hoping to save on Quest 3 accessories by using the ones from your Quest 2, think again",https://t.co/b5K1X87VIy,2,18,,6.2K,https://t.co/b5K1X87VIy,Most Quest 2 accessories won’t work on the Quest 3,The changes to the Quest 3 design ensure that old straps and upgrades just won't fit properly without modification.
https://twitter.com/androidcentral,@androidcentral,https://twitter.com/androidcentral/status/1707133540960198915,Sep 28,YouTube Music has another little section to tell you more about the song you're listening to,https://t.co/O7L7uuPOV6,6,26,,6.8K,,,
https://twitter.com/androidcentral,@androidcentral,https://twitter.com/androidcentral/status/1707127225785479590,Sep 28,The Quest 3 gaming experience is truly phenomenal,https://t.co/x6qetuxeed,2,12,,6.3K,https://t.co/x6qetuxeed,You won't believe how much better Quest 3 games look,Now we finally know what 100% faster means.
https://twitter.com/androidcentral,@androidcentral,https://twitter.com/androidcentral/status/1707125476420878718,Sep 28,A new Android 14 beta is rolling out on the Galaxy S23,https://t.co/D2zRXJH8xr,3,9,63,9.3K,,,
https://twitter.com/androidcentral,@androidcentral,https://twitter.com/androidcentral/status/1707097793267913146,Sep 27,The new Ray-Bans Meta smart glasses are more stylish than ever and come with more than a few upgrades,https://t.co/DGbcramhFs,5,18,,6.3K,,,
https://twitter.com/androidcentral,@androidcentral,https://twitter.com/androidcentral/status/1707090746262651162,Sep 27,"Meta just launched the new Quest 3, and we got to try it out",https://t.co/W2EdygRoVD,1,4,19,6K,,,
https://twitter.com/androidcentral,@androidcentral,https://twitter.com/androidcentral/status/1707088997506314436,Sep 27,"The new Meta Quest 3 is a powerful follow-up to the popular Quest 2, and it'll be available soon starting at $499",https://t.co/kBrEcCtYyK,4,17,,5.8K,https://t.co/kBrEcCtYyK,"The Meta Quest 3 arrives October 10, runs laps around the Quest 2","Better loading times, pixels per eye, textures, audio, and all the major changes to tempt you into upgrading."
https://twitter.com/androidcentral,@androidcentral,https://twitter.com/androidcentral/status/1707060542781739077,Sep 27,"The Pixel 8 may bring better performance with a new chip, but it also needs to stay cool under pressure",https://t.co/tebUvOfz93,1,8,66,8.6K,,,
https://twitter.com/androidcentral,@androidcentral,https://twitter.com/androidcentral/status/1707050251650031620,Sep 27,"The Sonos Move 2 is like a book with the same cover, only it tells a different story when it comes to improved sound, connectivity, and battery life. Plus, there's an olive variant to go with the standard black or white color options",https://t.co/YnVk5AImQO,1,14,,5.5K,https://t.co/YnVk5AImQO,"Sonos Move 2 review: Same looks, better sound","Looks about the same, but doesn't sound like it."
https://twitter.com/androidcentral,@androidcentral,https://twitter.com/androidcentral/status/1706913064379973822,Sep 27,"Apple finally bit the bullet and brought USB-C to the iPhone 15, and this could be a great thing for accessory makers, but there are still some things to consider",https://t.co/1JvqiJom04,3,5,36,8.9K,,,
https://twitter.com/androidcentral,@androidcentral,https://twitter.com/androidcentral/status/1706897608772366822,Sep 27,"Google Podcasts is going away in 2024, and YouTube Music's podcasts feature will go live globally",https://t.co/Hr6MyxrrQZ,6,3,52,10K,,,
https://twitter.com/androidcentral,@androidcentral,https://twitter.com/androidcentral/status/1706778442455265482,Sep 27,Samsung may kick off 2024 with an early Galaxy S24 launch,https://t.co/qiZLe7O9yO,4,9,66,10K,,,
https://twitter.com/androidcentral,@androidcentral,https://twitter.com/androidcentral/status/1706771911328374905,Sep 27,"CMF by Nothing has its first major launch, with a few affordable products on the way",https://t.co/mjCjtYcW1G,1,15,,6.7K,,,
https://twitter.com/androidcentral,@androidcentral,https://twitter.com/androidcentral/status/1706766605210865874,Sep 27,Passing the aux cord around will become a thing of the past with Spotify's new Jam feature,https://t.co/5yOfFYPOBd,18,,,6.5K,https://t.co/5yOfFYPOBd,Spotify new 'Jam' feature lets you DJ with your friends,"Mid-week dance party, anyone?"
https://twitter.com/androidcentral,·,https://twitter.com/androidcentral/status/1706897608772366822,Sep 27,androidcentral.com,https://t.co/Hr6MyxrrQZ,3,52,10K,,,,
https://twitter.com/androidcentral,@androidcentral,https://twitter.com/androidcentral/status/1706747978420019311,Sep 27,Samsung might launch the S23 FE at a decent price this time around,https://t.co/gDUcQOd8P4,7,20,,7.3K,,,
https://twitter.com/androidcentral,@androidcentral,https://twitter.com/androidcentral/status/1706726551625048152,Sep 26,"Shokz OpenRun Pro too pricey? The Haylou PurFree BC01 headphones are a solid, budget-friendly alternative with decent sound and a handy quick-charge feature. However, the proprietary charging cable and lack of features may leave you wanting more.",https://t.co/VluVZd4Luh,1,10,,6K,,,
https://twitter.com/androidcentral,@androidcentral,https://twitter.com/androidcentral/status/1706717530939646366,Sep 26,YouTube is axing its cheaper Premium Lite plan,https://t.co/OugXkL7h8a,4,7,39,10K,,,
https://twitter.com/androidcentral,@androidcentral,https://twitter.com/androidcentral/status/1706708979324269052,Sep 26,The Xiaomi 13T and 13T Pro have some pretty impressive camera specs and up to 120W charging,https://t.co/b3bOKgKKN6,4,20,,6.2K,,,
https://twitter.com/androidcentral,@androidcentral,https://twitter.com/androidcentral/status/1706670769185677579,Sep 26,"Xiaomi's best-selling fitness band gets a massive upgrade, and it still costs just $40",https://t.co/dW5Cebnbix,17,,,6.5K,,,
https://twitter.com/androidcentral,@androidcentral,https://twitter.com/androidcentral/status/1706665495888621684,Sep 26,"Xiaomi made a Wear OS smartwatch, and it's launching globally. All the details here:",https://t.co/2WEgjbKTSY,1,7,31,7.8K,https://t.co/2WEgjbKTSY,Xiaomi gives Wear OS another shot with the Watch 2 Pro,The Watch 2 Pro is powered by Snapdragon W5+ Gen 1 and is launching globally.
https://twitter.com/androidcentral,@androidcentral,https://twitter.com/androidcentral/status/1706520674846871662,Sep 26,"TECNO's Phantom V Flip is going on sale soon, and it will cost just $600. Head to our review to know all about the most affordable foldable available today:",https://t.co/K3BLQewV8O,1,2,23,8.3K,,,
https://twitter.com/androidcentral,@androidcentral,https://twitter.com/androidcentral/status/1706448516678111703,Sep 26,Check out this video of OnePlus' new Dynamic Island clone in action on a screen recorder app,https://t.co/SBp9ZzQq0z,1,25,,7.7K,https://t.co/SBp9ZzQq0z,OxygenOS 14 is taking Apple's Dynamic Island UI for a spin,"OnePlus is borrowing the iPhone's interactive feature, but we'll have to see how it works out."
https://twitter.com/androidcentral,@androidcentral,https://twitter.com/androidcentral/status/1706438776715702361,Sep 26,The latest Garmin smartwatch has a huge accessibility advantage over Apple and Samsung watches,https://t.co/aOVXmz7MEB,2,18,,7.1K,,,
https://twitter.com/androidcentral,@androidcentral,https://twitter.com/androidcentral/status/1706419587435172056,Sep 26,There's a lot to uncover in the first Android 14 QPR1 beta,https://t.co/PQGOi6QmjB,3,32,,8.5K,,,
https://twitter.com/androidcentral,@androidcentral,https://twitter.com/androidcentral/status/1706412533035184289,Sep 26,The OxygenOS 14 announcement is much ado about nothing,https://t.co/Lba2adf144,5,28,,7.6K,,,
https://twitter.com/androidcentral,@androidcentral,https://twitter.com/androidcentral/status/1706407503557165110,Sep 26,"We're learning more about what Spotify's ""Supremium"" HiFi tier could offer",https://t.co/2VinerllBt,3,28,,8.2K,,,
https://twitter.com/androidcentral,@androidcentral,https://twitter.com/androidcentral/status/1706402457494987214,Sep 26,"Good Lock's next major update won't be as significant, but we're excited for new features nonetheless",https://t.co/ggjiC15Loe,4,29,,8K,,,
https://twitter.com/androidcentral,@androidcentral,https://twitter.com/androidcentral/status/1706382564749987947,Sep 26,"The Pixel Watch 2 is spilling all its secrets in a leaked marketing video, and it looks like it's addressing the original's shortcomings and adding some new tricks",https://t.co/lAoDsbscz3,7,50,,9.4K,https://t.co/lAoDsbscz3,New Pixel Watch 2 video gives us a sneak peek of its health and safety features,"The Pixel Watch 2 can't wait to launch, so it's giving us a preview of its fresh features in a new leaked video."
https://twitter.com/androidcentral,@androidcentral,https://twitter.com/androidcentral/status/1706377116973977620,Sep 26,It looks like the Pixel 8 upgrades may come at a price,https://t.co/cP4oxH9ApZ,3,6,51,9.9K,https://t.co/cP4oxH9ApZ,Pixel 8 leak suggest price increases are likely,Some smaller upgrades could've been taken into account.
https://twitter.com/androidcentral,@androidcentral,https://twitter.com/androidcentral/status/1706358782366806144,Sep 25,Pixel 8 software support could make most Android phones jealous,https://t.co/Do9Y2Qy5RB,5,6,67,11K,https://t.co/Do9Y2Qy5RB,The upcoming Pixel 8 series may get a whopping seven years of updates,"Ahead of the launch, full specifications of the Google Pixel 8 series have leaked online."
https://twitter.com/androidcentral,@androidcentral,https://twitter.com/androidcentral/status/1706347105105703220,Sep 25,A huge Pixel 8 leak shows off some rather impressive AI features and manual photo controls,https://t.co/K6QA7O5FZP,1,57,,8.8K,,,
https://twitter.com/androidcentral,@androidcentral,https://twitter.com/androidcentral/status/1706306540209152118,Sep 25,A foldable for $600? Meet the TECNO Phantom V Flip:,https://t.co/K3BLQewnjg,5,30,,7.5K,,,
https://twitter.com/androidcentral,@androidcentral,https://twitter.com/androidcentral/status/1706295464088453356,Sep 25,OnePlus is now rolling out the OxygenOS 14 public beta — here's everything you need to know,https://t.co/UfyNYDmghk,3,26,,7.6K,https://t.co/UfyNYDmghk,"OnePlus OxygenOS 14: Release date, new features, eligible devices, and more","OnePlus is starting to roll out its Android 14-based interface, and there's a lot to like."
https://twitter.com/androidcentral,@androidcentral,https://twitter.com/androidcentral/status/1706007854883225995,Sep 24,"It's about time the iPhone got in on the periscope camera craze, and that means you can finally zoom zoom no matter which phone you prefer",https://t.co/Ch2YLifmPG,6,40,,10K,https://t.co/Ch2YLifmPG,Here's why you want a phone with a periscope camera,It's for more than just zooming way in.
https://twitter.com/androidcentral,@androidcentral,https://twitter.com/androidcentral/status/1705963050988171369,Sep 24,Fitbit has had a rough 2023; it needs more than the Charge 6 to turn things around.,https://t.co/5ZaWKPvgp4,1,3,28,10K,https://t.co/5ZaWKPvgp4,Can the Charge 6 and Pixel Watch 2 fix Fitbit's woes?,Fitbit has several paths it can take to regain people's trust. Most of it starts with improving Fitbit Premium.
https://twitter.com/androidcentral,@androidcentral,https://twitter.com/androidcentral/status/1705717356658295199,Sep 24,The Fitbit Charge 6 could be right around the corner,https://t.co/Ob0dZ2objy,5,30,,10K,,,
https://twitter.com/androidcentral,@androidcentral,https://twitter.com/androidcentral/status/1705711278335910102,Sep 24,Would you pay to use X (Twitter)?,https://t.co/NqYBknxGJ3,142,54,167,79K,,,
https://twitter.com/androidcentral,@androidcentral,https://twitter.com/androidcentral/status/1705705622065319947,Sep 24,WhatsApp is making it easier to shop within the app,https://t.co/SWEMimWv9n,3,7,63,13K,,,
https://twitter.com/androidcentral,@androidcentral,https://twitter.com/androidcentral/status/1705687820768006428,Sep 24,Make sure to grab the latest Android update for your Pixel phone,https://t.co/LFjTXsMxF2,8,50,,11K,,,
https://twitter.com/androidcentral,@androidcentral,https://twitter.com/androidcentral/status/1705675417779138938,Sep 24,Get ready to pay more for Prime Video if you want to avoid ads,https://t.co/nmN4M5R6dP,1,5,30,9.3K,,,
https://twitter.com/androidcentral,@androidcentral,https://twitter.com/androidcentral/status/1705666286586408980,Sep 24,"Microsoft Surface will have to go on without Panos Panay, but that could be good news for Amazon",https://t.co/pvqpfpr2Xv,1,3,33,10K,,,
https://twitter.com/androidcentral,@androidcentral,https://twitter.com/androidcentral/status/1705658148248310186,Sep 24,"OxygenOS 14 may look the same, but there are some notable features arriving with the update",https://t.co/rQIdcFkvkX,1,6,34,11K,https://t.co/rQIdcFkvkX,The 7 best new features in OnePlus OxygenOS 14,Here's what you can look forward to in OnePlus's Android 14-based interface.
https://twitter.com/androidcentral,@androidcentral,https://twitter.com/androidcentral/status/1705644974442746326,Sep 23,Google is already giving us a taste of what's to come after the stable Android 14 update drops. Here's everything,https://t.co/9VQblYmST3,7,31,,10K,,,
https://twitter.com/androidcentral,@androidcentral,https://twitter.com/androidcentral/status/1705599673732325556,Sep 23,"If you move around on 4 wheels instead of 2 feet, the Garmin Venu 3 is the best smartwatch you can buy",https://t.co/V1FFBBfU1W,4,36,,8.8K,,,
https://twitter.com/androidcentral,@androidcentral,https://twitter.com/androidcentral/status/1705486161177706732,Sep 23,"USB-C on the iPhone 15 is a pretty big deal, and",https://t.co/l0Hqa3pvHa,31,8,49,22K,,,
https://twitter.com/androidcentral,@androidcentral,https://twitter.com/androidcentral/status/1705321592031511005,Sep 23,It looks like Google Weather's redesign is finally appearing on more phones,https://t.co/544p5PGDOX,2,1,31,9K,https://t.co/544p5PGDOX,Google's Weather UI redesign starts appearing on more Android phones,A Material You refresher before new devices arrive.
https://twitter.com/androidcentral,@androidcentral,https://twitter.com/androidcentral/status/1705317567324094557,Sep 23,"Porcelain looks great, but Sky might be the one",https://t.co/GUDl8Wlns7,1,3,35,9K,https://t.co/GUDl8Wlns7,New leaked Pixel 8 images give us every color,Unique colorways include Peony for the Pixel 8 and Sky Blue for the Pixel 8 Pro.
https://twitter.com/androidcentral,@androidcentral,https://twitter.com/androidcentral/status/1705291888817783041,Sep 23,"Threads now lets you easily switch profiles, just like you can on Instagram",https://t.co/LcZ9m9odUQ,3,13,,4.9K,,,
https://twitter.com/androidcentral,@androidcentral,https://twitter.com/androidcentral/status/1705278814983471234,Sep 22,October is going to be packed,https://t.co/Ot8SlKgSOD,3,36,,7.4K,,,
https://twitter.com/androidcentral,@androidcentral,https://twitter.com/androidcentral/status/1705274526173372863,Sep 22,"Google Wallet is acting up on the first Android 14 QPR1 beta, and contactless payments are completely broken",https://t.co/9FdH5cgorR,2,2,28,7.8K,,,
https://twitter.com/androidcentral,@androidcentral,https://twitter.com/androidcentral/status/1705267973454176340,Sep 22,Another Android 14 beta is rolling out for the Galaxy S23,https://t.co/MBsSKARMzh,2,26,,6.6K,,,
https://twitter.com/androidcentral,@androidcentral,https://twitter.com/androidcentral/status/1705252388460773454,Sep 22,Tecno launches its first flip phone with a circular cover screen and a low price,https://t.co/wn0QX3Cc7t,3,17,,6.7K,https://t.co/wn0QX3Cc7t,Tecno's stylish new Phantom V Flip massively undercuts the Galaxy Z Flip 5,It comes with a stunning circular cover screen and slick design.
https://twitter.com/androidcentral,@androidcentral,https://twitter.com/androidcentral/status/1705184126179881076,Sep 22,"If you're an Android user who has been on the fence about switching to an iPhone, Apple just made it a little easier for you with the iPhone 15",https://t.co/hbKuLdBGE1,22,8,49,21K,,,
https://twitter.com/androidcentral,@androidcentral,https://twitter.com/androidcentral/status/1705129853257683339,Sep 22,Looking to Quest with friends? Look no further than these two incredible D&D-inspired VR games on the Meta Quest.,https://t.co/J2Ge98ETNm,2,10,,5.8K,,,
https://twitter.com/androidcentral,@androidcentral,https://twitter.com/androidcentral/status/1705066619708621010,Sep 22,Xiaomi is setting sights on Samsung's Galaxy A devices with the Redmi Note 13 series,https://t.co/l42oDvgOFc,32,,,7.6K,,,
https://twitter.com/androidcentral,@androidcentral,https://twitter.com/androidcentral/status/1705030675798114737,Sep 22,We get yet another look at new Fan Edition tablets expected to launch soon,https://t.co/PJQy6k5JsW,4,31,,7.2K,https://t.co/PJQy6k5JsW,More official-looking Galaxy Tab S9 FE renders suggest an imminent launch,New leaked marketing images confirm a high-quality design for the upcoming Fan Edtion Tab S9 models.
https://twitter.com/androidcentral,@androidcentral,https://twitter.com/androidcentral/status/1705022859905483245,Sep 22,The new YouTube Create app wants to ease the process of making videos for the platform as it continues to compete with TikTok,https://t.co/faE4Z3rzf2,1,5,33,7.7K,https://t.co/faE4Z3rzf2,YouTube debuts a new app and AI-powered tools to make video editing easier,"YouTube Create, released in beta, is a standalone app, much like TikTok's CapCut."
https://twitter.com/androidcentral,@androidcentral,https://twitter.com/androidcentral/status/1705014055566561564,Sep 22,"If you use Facebook for both personal and professional use, you can now split your account into multiple profiles",https://t.co/mMbS9TNqmt,1,18,,6.3K,https://t.co/mMbS9TNqmt,Facebook now makes it easy to lead a double life with multiple personal profiles,You can now create up to four alternate Facebook profiles associated with your verified account.
https://twitter.com/androidcentral,@androidcentral,https://twitter.com/androidcentral/status/1704976056556400790,Sep 22,It looks like we're approaching Fan Edition season,https://t.co/4v7cTkH4iy,3,24,,6.3K,https://t.co/4v7cTkH4iy,"Galaxy S23 FE and Tab S9 FE appear on Google Play Console, doubling down on specs","The Google Play Console gives us a good look at the Galaxy Tab A9, as well."
https://twitter.com/androidcentral,@androidcentral,https://twitter.com/androidcentral/status/1704969517166649514,Sep 22,iFixit's Pixel Fold repair parts will drain your wallet and time,https://t.co/Nr6plh0JNc,1,15,,5.8K,https://t.co/Nr6plh0JNc,"iFixit lists Pixel Fold repair parts, and they're not cheap",Clear your schedule ahead of time.
https://twitter.com/androidcentral,@androidcentral,https://twitter.com/androidcentral/status/1704964240996553058,Sep 22,The Android 14 QPR1 beta addresses an annoying limitation for apps like Instagram that don't take advantage of larger foldable and tablet displays,https://t.co/wrBgiZYiUU,19,,,5.5K,,,
https://twitter.com/androidcentral,@androidcentral,https://twitter.com/androidcentral/status/1704957434433786250,Sep 22,"The Prime Big Deals Day shopping event is still a few weeks away, but we're already gathering the best early phone deals so you don't have to wait",https://t.co/Qh2dWkWe63,2,23,,7K,,,
https://twitter.com/androidcentral,@androidcentral,https://twitter.com/androidcentral/status/1704944860698956055,Sep 22,Check out Google's latest attempt to call Apple out over not adopting RCS,https://t.co/jKkaUHvAEB,6,46,,7.5K,https://t.co/jKkaUHvAEB,Google calls the iPhone 'outdated' for refusing RCS messaging,Get the message?
https://twitter.com/androidcentral,@androidcentral,https://twitter.com/androidcentral/status/1704930038171267579,Sep 22,"TikTok is steadily making moves to improve its search experience, even going so far as to integrate Google Search links and Wikipedia snippets",https://t.co/vFPfdJ8DLS,1,2,22,6.2K,,,
